,review_id,date,rating,text,num_likes,Vader_score,Vader_neg,Vader_neu,Vader_pos,TextBlob_sub,Flair_sent,Flair_conf
88,733930958,10/04/2013,4.0,"The Gruffalo is a fantasy story based on an intelligent mouse who is the desired prey of three intimidating animals. In order to avoid being eaten as the mouse makes his way through the dark wood, the mouse must utilize clever tactics to trick and distract his predators. His predators include firstly a fox, followed by an owl and then a snake. The mouse creates an 'imaginary' figure in his head to frighten the predators. He proclaims to them that he is on his way to a feast with a Gruffalo, whom he depicts as being a fierce and frightening beast. This description alone forces the fox, the owl and the snake to flee in fear of the beast. In conjunction with this, each time the mouse frightens one of the animals away he proclaims in rhyme ""Doesn't he know? There's no such thing as a Gruffalo!"".However, with a twist in events the monster of his imagination appears in real life in front of his very own eyes. Unlike his successful strategy before, the mouse can no longer create an imaginary figure to scare the Gruffalo as he in fact was the original figure to begin with. The mouse must be coy and think of a plan quickly before he is gobbled up ""on a slice of bread"" by the Gruffalo. The mouse soon comes up with a plan, he has decided that he will convince the Gruffalo that he (the mouse) is the most terrifying creature in the deep dark woods. As the mouse revisits creatures of the wood with the Gruffalo, the mouse manages to successfully convince the beast that he, the mouse, is in fact the scariest creature in the wood.I really enjoyed reading this book. I found the story line enthralling and felt like I was sitting on the edge of my seat waiting to see what would happen next. I felt that it was a highly original tale and displayed an excellent use of credible fantasy in that although everything in the story was made up, it felt as though it was all happening for real. I would recommend this book for reception and key stage 1 years 1 and 2. I think this book would be an excellent resource to utilize in the classroom. The use of rhyme and repetition would help to encourage the children to engage with the story and interact by repeating some of the phrases like ""Doesn't he know? There's no such thing as a Gruffalo!"". I think it would be a good tool to teach the children how rhyme works, I would ask the children what rhymes with various words in the story in order to consolidate their knowledge and understanding of rhyme further. ",2,0.9714,0.073,0.808,0.119,0.6523809523809524,POSITIVE,0.9993
89,263443515,01/17/2012,5.0," The Gruffalo is a children story typically for ages 3-7 initially published in 1999, its success has lead to west end productions and Broadway as well as winning multiple awards.the story is about a cunning little mouse's walk in the woods. During he's walk he encounters different animals who invite him back to their home only so they can eat mouse. The cunning mouse tells the animals he plans to dine with he's friend the Gruffalo, he describes the features of Graffalo and claims that hes favourite animal happens to be them. This scares the animals and they flee. When mouse carry's on with he's walk he is surprised to see a real Gruffalo with all the features he thought he was inventing. The Gruffalo wanted to eat the mouse but again the mouse was cunning and said that he is the scariest in the forest. The Gruffalo agrees to follow the mouse back into the forest to demonstrate how feared he is and encounters all the animals in the order he met them. Each animal was terrified at the sight of the Gruffalo and each time the Graffalo was more impressed by the mouse's toughness. The cunning mouse took this to advantage and threatens to eat the Gruffalo which than flees. Julia Donaldson has written a very creative story which instantly captures the young wild imaginations that children have. This book can be a great starter for creative descriptive writing, I have read this book to a year two class and done some follow up work on creating our own monsters and describing their features as well as acting out these monsters (developing the use of adjectives and similes). The lessons were a great success because of the natural wild imagination that children already have! The book also makes use of rhyming couplets, synonyms and repetitive verses making it easy for children to remember and retell the story as well as join in at times. What I love about this book is that it is split into two parts, the second part requires children to use their memory and understanding skills to reiterate the order of which the mouse met the animals on his way into the forest.The story is without a doubt amusing for readers and listeners and conveys a smart message that that even the most threatening of monsters are not always as scary as they seem at first. A definite must read!!",2,0.9943,0.06,0.77,0.171,0.531904761904762,POSITIVE,0.9998
90,1380198147,09/01/2015,4.0,"The Gruffalo is a story about a mouse and the giant Gruffalo. The story starts off when the mouse goes on a adventure into the 'deep dark woods'. Along the way, the mouse encounters many predators; the fox, owl and the snake, knowing very well that they are eager to make him their prey, the mouse invents tales of a creature called the Gruffalo. The smart thinking mouse one by one leers off his predators by giving vivid description of the creature; 'terrible tusks and terrible claws, with terrible teeth in his terrible jaws. He has knobbly knees and turned out toes and a poisonous wart at the end of his nose. His eyes are orange, his tongue is black, he has purple prickles all over his back'. The mouse successfully wards off any potential harm and proudly sets off for the rest of his journey. Much to his astonishment, his figment of imagination turns into reality when he's confronted by the real Gruffalo. However, being the smart thinking mouse that he is, the mouse ends up convincing the Gruffalo that all the animals are scared of him and his favourite meal is 'Gruffalo crumble'. Ultimately his fight for survival leads him scaring off the Gruffalo and becoming the King of the Jungle!Donaldson instantly draws us into the 'deep dark woods' and our minds are captivated throughout the whole journey. This is a brilliant book that can be read to reception and KS1 children and thoroughly enjoyed by all. The illustrations used are great and go well with the text, as they allow the children to use their imagination and create their own image of this mystical creature throughout, setting the story alive. The use of repetition and rhyme engages the children, getting them involved and creating a sense of excitement within the classroom. It's an excellent opportunity to be used in literacy for KS2 children to develop their creative writing and for KS1 children where they can explore their imaginations and describe what they think the Gruffalo looks like. It could also be used during art lessons, giving the children a chance to draw their interpretation of the Gruffalo. At first glance, one would assume that it would be a scary read for younger kids but the dominant use of humour in the story eliminates the scary elements. It's a book that has been enjoyed for many years and will carry on being enjoyed down the years. ",2,0.9802,0.062,0.797,0.141,0.6733643050716219,POSITIVE,0.9999
91,411634436,09/10/2012,5.0,"The Gruffalo is a fantasy story about a mouse travelling through the woods who encounters a series of would-be predators, but he scares them off by telling them that he's on his way to meet a fierce Gruffalo. ""His eyes are orange. His tongue is black. He has purple prickles all over his back."" After escaping a fox, an owl, and a snake, the story has a twist and the mouse actually comes face to face with the creature from his imagination which he described to the other animals. The clever part in the story is When the mouse actually encounters the Gruffalo, he manages to convince him that he is the scariest animal in the forest now. This book would be suitable for Early Years children aged about four years old, however it can even be enjoyed by adults. The short rhymes and their repetitive structure makes the Gruffalo a fun book to read aloud reinforcing words and giving children the opportunity to become familiar with the style of writing. It is a humorous story where the mouse is in constant peril but uses his brain to outsmart the other animals. Due to the encounters with all the different animals and also due to the situations the mouse finds himself in, the book could be read using different tones and levels of volume making it even more exciting. The book can even inspire activities such as role-play to be carried out, as children find it exciting and amusing to copy animals, make silly sounds and act out different emotions. Moreover, the vibrant colours and fantastic illustrations used in the book can help develop a child's imagination. The images captivate a child's attention and can be used as a method to strike up a conversation about what they think might happen next. The child may just enjoy studying the pages and pictures themselves as they seem enchanted by the story. The unique style of writing, immense description and also illustrations allows the reader/child to bring the story to life. The Gruffalo is a brilliant, interesting and fun book with a unique style of writing which makes it extremely enjoyable to read. The flowing rhyme, immense description and imaginatively illustrated makes it well-deserving of its 1999 Smarties Gold Award. ",2,0.998,0.03,0.76,0.21,0.545436507936508,POSITIVE,0.9999
92,410696287,09/09/2012,5.0,"‘The Gruffalo’ by Julia Donaldson is about a clever little mouse and his dangerous journey through a wood where he meets three predators, a fox, an owl and a snake. To escape being eaten he invents a gruesome friend, The Gruffalo, that would happily eat them all. To his surprise the mouse meets the imaginary Gruffalo and has to use further cunning to escape being dinner for all four animals. 	This Story is cleverly written with simple repetitive language and a very clever and cheeky protagonist. By informing the reader of the intent of the mouse and the trick he plays on the animals, the audience is immediately hooked and included in the story. This story allows the audience to relate to the cheeky mouse and enjoy the trick he plays on the animals and even his surprise when he finds that the Gruffalo exists.	This story is an excellent choice for key stage one children and has many applications in the classroom. The Gruffalo as a character can be drawn on in art class for children to develop retrieval skills. The story has given a brilliant and detailed description of the Gruffalo and this creates a great opportunity for children to bring these ideas together to create their own version of this fearsome creature. 	As a class dialogue there are many topics to focus on. As a group a class can discuss; Why the mouse had to trick the animals? How the animals felt when they heard of the hungry Gruffalo and its favorite food? Why the Mouse was shocked to find the Gruffalo? This could lead into smaller group discussions and even creative writing with their own retelling of the story to enhance retrieval skills. They could also create their own versions of the gruffalo constructing a creature that could help on a person journey such as shopping, going on a trip to the park or even to school. 	Overall this is a great short story that can be used to inspire a classroom on many different levels. Through its success the Gruffalo has now become a brand and has developed many different types of merchandise and media, all which can be useful in the classroom to further children’s understanding of the story. ",2,0.9958,0.034,0.783,0.182,0.6506265664160402,POSITIVE,0.9999
93,2798839558,04/25/2019,4.0,"in the Gruffalo by Julia Donaldson, there is a sneaky little mouse that lies to carry on with his life. but in this case, he makes up a creature to scare his PREDATORS. but little does he know something out there may be lurking. I think this book is really good mainly because it is very funny especially when he uses what he thinks is a fake monster to his advantage. I recommend this book for children because it is very humorous and I feel like children would find it entertaining. ",2,0.9306,0.12,0.654,0.226,0.737037037037037,POSITIVE,0.9979
94,3920334477,04/01/2021,5.0,Dangerously good. ,2,-0.0258,0.508,0.0,0.492,0.6000000000000001,POSITIVE,0.988
95,384106093,08/04/2012,5.0,"'The Gruffalo' tells the story of a clever and cunning mouse who uses quick thinking to protect himself from the threatening animals he encounters on his strolls through the deep dark wood. As the mouse encounters each predator he scares them away with the promise that he is meeting a Gruffalo for lunch. The mouse describes the imaginary Gruffalo to each predator, informing each predator that the Gruffalo's favourite snack is the predator themself. At the end of the mouse's travels he meets a Gruffalo who wants to eat him. The mouse convinces the Gruffalo to take a walk with him to realise how feared the mouse is and to scare the Gruffalo away. As the Gruffalo traces the mouse's steps he meets all of the mouse's predators, each in turn flees at the sight of the Gruffalo. The Gruffalo becomes fearful of the mouse, believing he is a threat. The Gruffalo then leaves the clever mouse, allowing him to escape all the dangers of the deep dark wood. I first read this book to a pre-school class at nursery and they thrived with excitement. This book comes to life when read aloud and young children feel the tension of the creatures in the wood as the mouse describes the Gruffalo. Slowly the reader is able to conjure up a vision of the mythological beast which leaves both adults and children on tender hooks, nervous and fascinated about what will happen next. I really loved this book; it made me feel like a big child lost in a world of fantasy and imagination. This book can be enjoyed by children from pre-toddler to adult. Younger children will love the beautiful illustrations whereas the older children can appreciate the storyline and the suspense that builds with every page. This book is a great story time read for the classroom, Julia Donaldson employs rhyme throughout making this picture book a fun read. Not only does this book entertain but it can also be used to help children develop the basic concept of rhyme and poetry. The detailed descriptions allow children to use their creativity and let their imaginations run wild. ",2,0.9555,0.055,0.83,0.115,0.4959770114942529,POSITIVE,0.9998
96,398387535,08/23/2012,,"This is a rhyming story about a large monster, known to the reader as the Gruffalo. This creature is invented by a very clever little mouse who is walking through the forest. He invented the Gruffalo because on his journey, through the forest, he comes across many predators who want to eat him. By creating this creature and telling his predators he is meeting the Gruffalo for lunch, he frightens them away.But then the mouse himself sees a real Gruffalo. Using all of his quick thinking, has to try to trick the Gruffalo, as the Gruffalo too wants to eat the little mouse.The cunning mouse encourages the Gruffalo to walk through the forest with him, to have him believe that he himself, although small, is the scariest creature in the forest.As they set off back through the forest, they pass each of the predators. One by one, they take one look at the Gruffalo and run away. However the Gruffalo, to his amazement, believes it is because of the mouse that they scarper.The mouse indicates at the end of the story that his favourite meal is ""Gruffalo crumble"" which causes the Gruffalo to run away from him. So like the other predators he too was tricked by the clever little mouse.This is a great book for both children and adults. Through the mouse's description of the creature, it enables both children and adults to create an image of the Gruffalo in their minds, and anticipating what will happen next.This book can definitely be appreciated by all ages. Children can enjoy the beautiful illustrations, whereas older children and adults can be left in suspense by the clever descriptions given to them by the mouse.Using rhyme helps to make the story fun to read. Also used in a classroom environment, when read to the children the repetition with the line ""Doesn't he know, there's no such thing as a Gruffalo"", enables the children to join in with the story.Overall this is an excellent book, highlighting the use of rhyme and repetition and also encouraging the children to use their imagination.",2,0.9936,0.02,0.831,0.149,0.4938988095238095,POSITIVE,0.9997
97,514066881,01/22/2013,4.0,"The Gruffalo – Julia Donaldson (Illustrated by Axel Scheffer)Take a walk with a mouse through the forest and see what excitement awaits. On his travels he meets a fox, owl, snake and the beastly gruffalo who all think he “looks good” for filling their hungry stomachs. With some bold, “quick thinking” the mouse tries to face them all down with an outrageous web of lies coming to an unlikely conclusion.Written in droll rhyme, immediately The Gruffalo grabs you and makes you want to read more. It is a book best suited for younger children; I would suggest those in key stage 1, particularly as it can be accompanied by cuddly toys from the story. The cute artwork lends to the feeling of this being a book most appropriate for young children as older children may feel it is a little young for them.Using repetition at key moments there is plenty for children to feel familiar with as the tale unfolds. This provides the opportunity for review and discussion in a memorable manner at key moments and at the end of the book. I would recommend this book as one for whole class and then it could be used to introduce a number of activities as suggested below:•	The story could be used as a basis a drama activity looking at the use of characters. Groups could be given characters from other familiar stories and asked to create a short play showing how they may react in the same situation as the mouse.•	The artwork in this book would be used as a catalyst for discussion around differing forms of art through comparison and juxtaposition.•	Pairs or groups could formulate arguments for and against why the mouse is a nice or good character. •	The Gruffalo could be used as the catalyst for an investigation of poetry and the use of rhyme, particularly the advantages of poetry and rhyme being best when spoken and listened to.•	Using pictures and speech bubbles, this book could be used as an introduction to writing simple sentences or for higher level or older students, alternative sentences to the story.",2,0.9814,0.023,0.859,0.118,0.5241723356009071,POSITIVE,0.9546
98,485952232,12/26/2012,4.0,"The Gruffalo is about a mouse that firstly meets different animals in the woods that are prepared to eat him, such as: The fox, the owl and the snake. Each of these animals then ask the mouse to come inside and eat with them, although the mouse realises that this is an invitation for them to eat him he then decides to tell each animal that he has to decline the invitation as he plans to eat with his friend the gruffalo. The mouse then adds to the description of the gruffalo by stating that he is a grizzly bear and buffalo hybrid who likes the taste of either ‘fox, owl or snake’ depending on which of the animals he is talking to, with this description each of the animals then run away in fear. After telling each of the animals the fictional character he states: ‘Silly old fox/owl/snake, doesn’t he know? There’s no such thing as a gruffalo!’ Upon saying those words the gruffalo appeared in front of the mouse and threatened to eat him. The mouse then said that he was the scariest creature in the woods and decided to prove this to the gruffalo by walking with him past the differentanimals he had told the gruffalo about earlier who decided to flee once they had seen the gruffalo was real. The gruffalo was now convinced that the mouse was the scariest animal in the woods, taking advantage of this, the mouse then said he usually ate gruffalo and upon hearing this, the gruffalo ran away.I think that this book would be good in the early years setting, as it would encourage children to explore different emotions. The line ‘Silly old fox/owl/snake, doesn’t he know? There’s no such thing as a gruffalo!’ also introduces children to rhyme and poetry. The amount of description in the book would encourage children to be more descriptive and would help them to increase their vocabulary.",2,0.9472,0.031,0.888,0.082,0.4518518518518518,NEGATIVE,0.8693
99,1398543142,09/22/2015,4.0,"A new twist on the classic children’s rhyming tales. The central character, a small mouse, is taking a peaceful stroll through the woods to find himself some lunch. Along the way he meets a fox, an owl and a snake- all of whom are hungry and think the mouse would make a tasty treat. To each of them in turn the mouse describes a fictitious creature he is going to meet that he names a ‘Gruffalo’. Each description becomes further embellished with this creature’s garish and frightful characteristics until the mouse is alone in a clearing and, incidentally, runs into a real life Gruffalo! The mouse becomes frightened as the Gruffalo expresses an interest in eating him; however he manages to convince the simple Gruffalo that he is the most feared beast in the forest and sets out to prove this, revisiting the fox, owl and snake who immediately spy the feared Gruffalo and scarper. The naïve Gruffalo falls for this simple trick and bolts for the deep woods when the mouse turns to him and explains that his favourite food happens to be Gruffalo crumble. The mouse is then finally left alone to enjoy his lunch of a tasty nut.This is a feel-good tale told in rhyme where the under-dog comes out triumphant. The beautiful illustrations and grumpy yet loveable character of the Gruffalo coupled with the positive message to always stand up for yourself highlight so obviously why this book has been, for the last 3 years, one of the most popular young children’s books available.The recommended age range for this book would be around 4-5 years but possibly could be extended to 8 years if working with predominantly SEN students. It could be used in a classroom setting not only for private reading but also could be adapted into a script and used in a drama class discussing rhyming couplets.",2,0.8045,0.041,0.889,0.07,0.4770703933747412,POSITIVE,0.9991
100,194350120,08/04/2011,5.0,"This is a very enjoyable book to read,great for both children and parents. The book tells the story of a mouse's walk in the woods. On his way the mouse comes across 3 dangerous animals (a fox, an owl, and a snake). Each of these animals, clearly intent on eating the mouse, by inviting him back to their home. The crafty mouse declines each offer. He tells each animal that he has plans to eat with his friend, a gruffalo, whose favourite food happens to be the relevant animal, and describes the features of the gruffalo. What the animals do not know is that the mouse is actually inventing the gruffalo, and it not actually real; well so the mouse thinks.After getting rid of the last animal, the mouse is shocked to come across a real gruffalo – with all the frightening features the mouse thought that he was inventing. The gruffalo threatens to eat him, but again the mouse is crafty: he tells the gruffalo that he, the mouse, is the scariest animal in the forest. The gruffalo agrees to follow the mouse as he shows how feared he is. In fact all the animals that they encounter (the fox, the owl and the snake) as the two walk through the forest are terrified by the sight of the pair. The gruffalo was impressed with the mouse's apparent toughness. Exploiting this, the mouse threatens to eat the gruffalo, who then runs off.The book itself is vividly illustrated, with colourful pictures drawn in a child manner, to accompany the text. The rhyme in the book is also very fun, and the rhymical style of reading allows the children to get into character and recite verses. It is a book that makes the children want to know more about what happens next escpecially more about the monster that the mouse describes ""A gruffalo!Why, didn't you know?"".Overall a great fun book for everyone.",2,-0.7792,0.092,0.835,0.073,0.5290909090909091,POSITIVE,0.9996
