,review_id,date,rating,text,num_likes,Vader_score,Vader_neg,Vader_neu,Vader_pos,TextBlob_sub,Flair_sent,Flair_conf
0,1887038195,01/21/2017,3.0,"Brains beat brawns every time. The Gruffalo teaches children to be patient and understanding. Whilst not necessarily advocating the cunning manipulation that the mouse utilises, it does suggest that there is more to people than their outward appearance. Just because someone may appear “scary” doesn’t mean they’re a bad person, and innocent seeming things can be the worse. Judge only on actions not how one appears. ",56,-0.7506,0.122,0.845,0.033,0.7615740740740741,NEGATIVE,0.9873
1,3295780119,04/22/2020,5.0,"One of the delights of parenthood is being able to enjoy some of the most popular children's books from the last 20 years, The Gruffalo is an award winning hit from 1999.It's a brilliant simple rhythmic story as a mouse trys to scare off other woodland creatures from eating him by describing this big beast known as The Gruffalo.Unfortunately The Mouse is about to discover that he's been right all along!I think the reason why this appeals so much as it hooks into a child's vivid imagination, I remember tells of strange creatures living in the woods when I used to go camping.With each animal mouse meets the descriptions become even more elaborate!This is one that I'm looking forward to enjoying together over and over again.",28,0.9637,0.035,0.794,0.17,0.494345238095238,POSITIVE,0.9998
2,2215285464,12/15/2017,5.0,"I love, love, love this book. I'm a fan of stories where a little mousy guy gets its way against the most terrible odds, and this one it's just perfect in that and many other ways.The little mouse, our protagonist, is smart and full of grit but he's also lucky and sweet and it's so cool to see him getting out of a bad situation just to run into a worst one to then manage to get out of that as well.The illustrations are lovely, the rhymes are funny, the story it's interesting--as shown by my niece's little yelps of excitement each time a new nemesis appears--so I can't recommend this book enough.Read it with your children before bed, read it to yourself after a long day... just read it and enojy, it doesn't matter when.",24,0.9679,0.099,0.67,0.231,0.648745572609209,POSITIVE,0.9991
3,2503150003,08/22/2018,5.0,"Foxes are supposed to be cunning, but it is the mouse who is cunning and manipulative. He or She manipulated all the predators fears against them to stay safe. That's pretty smart. I guess that's how you survive. I love that even the Gruffalo had fears. I guess being a mouse, the mouse has had to learn to live with fear. It's an amazing story about bravery and finding the weakness of scary looking, bigger obstacles in life. Find that fear and use it against you. Does the mouse offer a seminar? I need to learn a thing or two from it.The kids enjoyed this. The nephew loved the gruffalo and the niece did too for different reasons. They both gave it 4 stars. ",25,0.8402,0.184,0.597,0.22,0.6530612244897959,POSITIVE,0.971
4,1822250674,11/26/2016,5.0,A wonderful tale and movie about dealing with bullies. A must for kids!,22,0.6114,0.0,0.715,0.285,1.0,POSITIVE,0.9997
5,1935047349,03/09/2017,4.0,"The Gruffalo, by Julia Donaldson is a cute rhyming story about a mouse and a gruffalo. We loved the combination of the sly little mouse and gullible gruffalo. 
 ""My favorite food!"" the gruffalo said.""You'll taste good on a slice of bread!""""Good?"" said the mouse. ""Don't call me good!I'm the scariest creature in this deep dark wood.Just walk behind me and soon you'll see,everyone is afraid of me.""
The illustrations are detailed and interesting. Overall, its a charming little story children will enjoy.4****",27,0.958,0.024,0.757,0.218,0.6433333333333334,POSITIVE,0.9998
6,1780839516,10/10/2016,4.0,Another delightful rhyming story from the pen of Julia Donaldson with brilliant accompanying illustrations by Axel Scheffler.Donaldson and Scheffler are a formidable team (although not quite rivalling that of Dahl and Blake) and this is undoubtedly one of their classics. The Gruffalo is a great character and creation loved by adults and children alike. Although well adapted for television and stage versions - nothing can compare to the original story and illustrations. ,22,0.9686,0.0,0.737,0.263,0.86,POSITIVE,0.9997
7,100056862,08/27/2019,5.0,"With Julia Donaldson's 1999 picture book (and in my opinion already a classic) The Gruffalo, aside from the author's sweetly and humorously (not to mention rhythmically rollicking and yes just asking to be read aloud) poetic text and Axel Scheffler's delightful and visually stunning accompanying illustrations (which are not only wonderfully colourfully expressive and as such a perfect mirror to and for Donaldson's engaging verses, especially how Axel Scheffler has drawn the little mouse main protagonist, it sweetly and nostalgically reminds me visually of one of my very favourite German cartoons from when I was a young child, namely Die Sendung mit der Maus), for me The Gruffalo as a unit is actually not just a fun and engaging picture book romp. For indeed, The Gruffalo also shows both with Julia Donaldson's verses and Axel Scheffler's accompanying artwork the importance and even the at times necessity of both bravery and cleverness when dealing with possible dangers, bullies, nasties and monsters, as the little mouse bravely ventures into the forest and cleverly keeps itself safe from potential predators by telling a fantastical tale of the forest monster known as the Gruffalo (and later, when the Gruffalo actually turns out to not be a fantastical imaginary beast after all, but a very real and bona fide monster, how the mouse, instead of simply being frightened and capitulating then makes the Gruffalo actually believe that it, that the little mouse is in fact a big, bad and frightening animal, bravely manipulating both the Gruffalo and the forest animals to keep its diminutive self safe from harm, from being consumed as a meal or a snack).",20,0.3857,0.103,0.759,0.138,0.5874285714285715,POSITIVE,1.0
8,1985163100,04/28/2017,5.0,"Delightful!I've heard of this book, and my kids have seen the cartoon on Netflix, yet we hadn't read the book until recently, when my sister gave it to my youngest. We love Donaldson's Room on the Broom, and this is more of the same. Tight, elegant rhymes, a fun story, and great pictures. Now we need The Gruffalo's Child!",17,0.9458,0.0,0.779,0.221,0.4638392857142857,POSITIVE,0.9997
9,202678161,08/27/2011,,"This book tells the tale of a scary Gruffalo,is he real, is he pretend, nobody knows.A sly little mouse describes him so true, other animals listen intently, their ears fixed like glue.Through the deep dark woods does little mouse go,announcing his meeting with the fierce gruffalo.His aim is to put off predators leering in the woods,who all want to eat little mouse, they surely would.A fox comes along, thinking of his meal for the day, little mouse is quick to react, as he starts to say, ""Those terrible tusks, and terrible toes, with terrible teeth in his terrible jaws.He has knobbly knees and turn out toes, and a poisonous wart at the end of his nose. His eyes are orange, his tongue is black,he has purple prickles all over his back!"" Little mouse uses his tricks to leer off owl and snake,proud of himself for thinking he’s invented a fake!Through the woods little mouse continues to go,unaware that round the corner stands the big Grufallo!As little mouse sees him, heartbeats he can feel,The Grufallo isn’t pretend, he is in fact real!Little mouse continues his tricks and uses the beast, to scare off the animals who wanted him for their feast. Little mouse sat alone, amazed at his luck,as he nibbles into a brown, delicious sweet nut.",15,-0.8765,0.135,0.784,0.081,0.5716880341880342,NEGATIVE,0.5896
10,1480674310,12/26/2015,5.0,Description: This is a rhyming story of a mouse and a monster. Little mouse goes for a walk in a dangerous forest. To scare off his enemies he invents tales of a fantastical creature called the Gruffalo. So imagine his surprise when he meets the real Gruffalo.4* The Stick Man5* The Gruffalo,14,-0.6293,0.17,0.734,0.096,0.5666666666666667,POSITIVE,0.9248
11,1608847261,04/12/2016,5.0,"This is a totally awesome book. My children read it at school and they really loved it. And of course we bought the book and we saw the movie.And then we read the book again again and again :-)It is a clever story about a little mouse and a scary (not really) monster, the Gruffalo. The intelligent sourceful little mouse manipulated the bigger animals who wanted to eat him. He made them think that he is scarier than Gruffalo. Thus, he should not be eaten.The little mouse though that Gruffalo is a made up monster, but he was wrong. Surprise!",13,0.5355,0.073,0.813,0.114,0.7194444444444444,POSITIVE,0.9995
12,1478044108,12/24/2015,5.0,Have just bought this and all the toys to go with it for my little nephew. Hope he's going to like it as much as I did!,13,0.6612,0.0,0.816,0.184,0.35,POSITIVE,0.9994
13,3298081196,04/23/2020,4.0,Great story! You can watch Michelle Obama reading The Gruffalo here and then add it to your reading challenge: https://www.youtube.com/watch?v=Wyhgu...,11,0.69,0.0,0.76,0.24,0.75,POSITIVE,0.9923
14,2385876925,05/08/2018,5.0,Ha ha ha. It was really great. this is my new favorite children’s book. :D,10,0.956,0.0,0.326,0.674,0.8011363636363636,POSITIVE,0.9952
15,2506123933,08/24/2018,4.0,"This is a wonderful book for kids! I loved the illustrations, and the story is so smart. Would make a great gift or a nice first book to someone who's just learning how to read.",10,0.969,0.0,0.541,0.459,0.7543650793650793,POSITIVE,0.9949
16,798966037,12/24/2013,4.0,"Popular kids books are powerful vehicles of merchandise. Take The Hungry Caterpillar (as just one example) - you can buy the book, the cardboard book, the cloth book, the colouring book, the pop-up book, the touch-and-feel book, the finger-puppet book, the audio book, the baby 'development toy', the plushy toy, the 'big apple' toy, the play floor tiles, the bedspread, the toothbrush, the body-wash, the bubble-bath, the playroom stickers, the height chart, the calendar, the garden water toy, the memory game, the seat-belt strap covers, the baby vests, the kids t-shirts, the welly-boots, the backpack, the lunchbox, the pencil case... that's just off the top of my head - I'm sure there's more!I remember that book from my own childhood, and I don't find this grating - it's sweet, it's unisex, the art style is lush and I don't mind seeing it splashed around.But I was 15 when 
The Gruffalo
 was published... listening to Rage Against The Machine and lamenting the over-commercialised tat we peddle to our children... To my teenage self, 
The Gruffalo
 was just another hook to get parents buying their kids more crap: a symbol of a broken system. Obviously, I never read it - but I was aware there was a TV adaptation made (with much fanfare) and a sequel book, etc. 
The Gruffalo
 has become a 'standard' (one of those books every kid should have...) and I was surprised to find how much I liked it!The rhythm and rhyme is perfect - it's heavily structured, but flows naturally, so even the most stilted beadtime-story reader is guided smoothly into a sing-song cadence. The story itself is clever and fun. The art style is very modern and clean - a touch generic for me (which is why it doesn't get 5 stars) - but overall 
The Gruffalo
 is a great bedtime story, and certainly one of Fin's favourites. We have the paperback and the noisy-hardback - the one where you press the buttons for Gruffalo's growl, or Owl's hoot, etc. We also have a Gruffalo flannel... but aside from that we've avoided any more of the merch!We also have many of Donaldson & Scheffler's other books - and I'm pleased to say that they're consistently good. The Gruffalo's Child, Room on the Broom, The Smartest Giant in Town, A Squash and a Squeeze, Charlie Cook's Favourite Book, and Superworm all have my little boy's seal of approval. After this I read: The Gruffalo's Child",8,0.9941,0.03,0.829,0.141,0.5361192511192512,POSITIVE,0.9993
17,2145308571,11/01/2017,5.0,"I hadn't read this book since my childhood, loved it!Great opportunities to look at rhyme and rhythm with children. The repetitive line of 'there's no such thing as Gruffalo' would be lovely for EAL children to join in too. You could also explore Donaldson's use of alliteration with children. Children could create more animals for the mouse to meet and their own rhymes for them. In science, children could look at the different habitats in which the animals live in. Good morals about not having to be the biggest to be the best. That you shouldn't judge from what you see, as the Gruffalo wasn't scary. Also not to believe everything you hear.",8,0.9658,0.032,0.78,0.188,0.6181818181818182,POSITIVE,0.9703
18,1797524718,10/29/2016,5.0,"Despite the lead character a rather scary looking monster, this is a fun bedtime read geared at younger children. The story is told through rhyme, as we meet various animals who cross paths with the giant Gruffalo. With beautifully unique illustrations, this is a perfect gift for young readers. ",9,0.886,0.055,0.709,0.235,0.5666666666666668,POSITIVE,0.9984
19,438502573,10/20/2012,5.0,"The Gruffalo, by Julia Donaldson The Gruffalo is about a cheeky and confident little mouse who defends himself from an array of predators, whilst walking through ‘a deep dark wood’. He defends himself through words rather than violence. He does this by outsmarting the naïve predators by claiming that he is about to meet a ‘Gruffalo’, a mythical beast. The mouse frightens the predators by giving them vivid descriptions of the beast - ironically, the mouse does meet the 'Gruffalo', and outwits him too.  Overall, this is a very enjoyable children’s tale with an exciting setting and great introductions to various characters. The various animal characters help children identify with different types of animals that could be in a forest. The use of ‘deep dark wood’ to describe the forest works very well, as it sets the scene and makes the reader excited about what there is to come. The dialogue between characters is very clever and the rhyming is well done. It creates a rhythm for the story and makes you want to read on. The descriptions of the 'Gruffalo' stimulates one’s imagination and the concept of meeting the 'Gruffalo' becomes very exciting. The illustrations are fantastic and capture the essence of the story. The consistent story works very well, especially with an anti-climatic ending where the mouse remains superior. Every part of the story is great, but the witty and clever character of the mouse is definitely the main highlight. I would say that this book is aimed at 3 to 6 year olds and can also be enjoyed by older children. The story could be used in the classroom by interacting with the visuals of the book. The teacher can ask questions about what the animals are called or if the children can spot the ‘Gruffalo’ anywhere in the detailed illustrations of the ‘deep dark wood’. The repetition and rhyming theme of the book would make it very enjoyable for children and would help them understand what could happen next in the story. This story could support a lesson in literacy and a topic of rhyming poems and using rhyme in creative writing and story telling. ",7,0.9946,0.011,0.82,0.168,0.6053703703703702,POSITIVE,1.0
20,213384640,09/22/2011,5.0,"I first came across the Gruffalo when BBC3 pretty much kept it on replay. I then decided to buy the book for my niece and found that its far far better in comparison to the film version. What enhanced the qualities of the book even more was the fact that it had sounds! This meant that my niece could not only listen to me read, but join in by associating the correct sound with the right animal. The book is very bright with lovely illustrations thus making it even more appealing (even without having read the words yet). The story revolves predominately around a mouse and his trek through the woods. He bumps into some intimidating animals and realises that his imagination (of a made up ‘monster’) will serve him well. Unbeknown to the little mouse, this fictional monster does exist! But true to form, the little mouse manages to conjure up a plan that will aide his survival back through the woods. A great story for children to re-enact and create a colourful wall display. I love how this book can be read over and over, yet the excitement remains!!",7,0.9904,0.018,0.79,0.192,0.5937641723356009,POSITIVE,0.9999
21,213290098,09/22/2011,4.0,"Julia Donaldson does an excellent job on writing this creative story book. The first time I read the story, I initially felt it was a very long read for children as I thought it was long myself and repetitive but upon reading it a second, third time, I realised I had not fully appreciated how good the storybook was. Complete with rhyme and repitition it captured my attention and the children to whom I was reading to. The use of animals was a good idea as children were able to point out different animals that they came accross throughout the book, creating a sense of excitement. Use of synonyms such as 'Big and little' help children to begin to understand opposites of words, a good literacy aspect of children's learning. Ideally, the book is for 3-7 year olds, but is enjoyed by many, a good must have within any home or classroom. ",7,0.9887,0.031,0.737,0.232,0.4751449275362318,POSITIVE,0.9995
22,147193313,02/09/2011,5.0,"I wish I had a dollar for every time I've read this book because my 2 year old cannot get enough of it. It was a gift for her 2nd birthday and hardly a day has gone by since that we've not read it to her. It's a bit long so initially Kidlet would flip through the pages before I could finish reading it, but after four months, she sits through it and waits for her favorite parts. She even learned the cadence of the words, so when she asks for it we recognize more the rhythm than the actual words she says. It's a clever book and I have come to really enjoy it. Kidlet juts out her ""knobbly knees, turned out toes,"" and nose for me to tap when I get to those parts of the story, and she loves when I tickle her back with ""purple prickles."" ",7,0.9705,0.0,0.859,0.141,0.38125,POSITIVE,0.9879
23,214513686,09/24/2011,5.0,"The Gruffalo is another thoroughly enjoyable book by Donaldson and Scheffler, with wonderful illustrations. There is good a use of rhymes, descriptive vocabulary and repetition throughout the story which gives it a nice flow and makes you want to read on. The Gruffalo is a humorous story to read out loud during story time. It could be used in Reception and Year 1 Art sessions with English and Literacy where the children can create their own monsters and write a description for each body part, just like in the book.",7,0.9589,0.0,0.785,0.215,0.75,POSITIVE,0.9988
24,209420842,09/16/2011,5.0,"In the big dark woods, a mouse is going for a walk when he meets a fox that, thinking the mouse looks like a good meal, tries to lure him back to his den. The mouse is an intelligent little thing, and explains to the fox that he can't come because he's having lunch with a gruffalo. The fox has never heard of a gruffalo before, so the mouse starts to describe a terrible monster who likes to eat roasted fox. The fox, terrified, runs away. The mouse is molested by an owl next, and then a snake, and each time he tricks the animals into thinking there's a bigger, badder beast in the woods than they.Until the mouse meets an actual gruffalo, just as he described it, and the gruffalo wants to eat him too. But he's still got some tricks up his sleeve, does mouse!This is an absolutely wonderful story that I've read to my 2 month old baby several times already - he has no idea what's going on of course but the pictures grab his attention and I can do silly voices that make him grin and squeal; the word ""gruffalo"" seems to delight him and the cadence of the rhyming text does too. I can't wait till he's older and can actually enjoy the story of the clever little mouse who outwits the bigger, stronger animals of the woods - great lesson in that, but also lots of fun!",6,0.9887,0.04,0.797,0.163,0.447463768115942,POSITIVE,0.9995
25,205512908,09/05/2011,4.0,"The Gruffalo is a classic children’s read with a beautifully written story and wonderful illustrations about a little mouse who takes a journey into the woods. On his way he encounters a fox, an owl and a snake who all want to eat the little mouse, until he tells them he is expecting a visit from the Gruffalo! “He has terrible tusks and terrible claws and terrible teeth and terrible jaws”. The little mouse ends up finding the Gruffalo and manages to convince the giant that all the animals are afraid of him! A humorous return through the forest follows. I feel this book will engage young children and early readers as it allows them to get into the character of the Gruffalo, which provides a fantastic opportunity for role play and describing the features of the Gruffalo. The story is a wonderful read for children and you can’t help but keep looking at the beautiful illustrations which bring the story to life. A must read for all children. ",6,0.9401,0.047,0.801,0.153,0.7870370370370372,POSITIVE,0.9995
26,1884527882,01/18/2017,4.0,Read 18/01/17,6,0.0,0.0,1.0,0.0,0.0,NEGATIVE,0.9937
27,2132150884,09/22/2017,5.0,This is my Lamby's (5) favourite book ever! She giggles all the way through. ,6,0.2714,0.0,0.861,0.139,0.0,POSITIVE,0.9996
28,4201473930,08/26/2021,5.0,"Haha I just really wanted to tell everyone that this is my favorite kids’ book for the toddler age. The rhythm, cadence and rhymes are perfect. I memorized it quickly (the mark, to me, of an excellent kid’s book: it’s simple and the lines are intuitive). The little brown mouse is fun, funny, and delightful. ",5,0.9732,0.0,0.663,0.337,0.6415584415584416,POSITIVE,0.9999
29,328794725,05/12/2012,,"The Gruffalo is a children’s book by author Julia Donaldson. It tells the story of a mouse’s walk in the woods. On his walk the mouse encounters any dangerous animals such as a snake, a fox and an owl. Each animal he meets invites them back to their house where they clearly intend to eat him. The mouse is very cunning and he declines each animals invitation by telling them that he is going for dinner at his friend, the Gruffalo’s house. He tells each animal that they are the Gruffalo’s favourite food and describes his frightening features to them. This allows the mouse to continue safely on his walk through the forest. The story then turns when the mouse meets a real Gruffalo. He tells the Gruffalo that he is the most fearsome animal in the forest and shows him by walking back through the forest where all the earlier animals run in fear away. This in turn scares the Gruffalo away from the mouse. This is one of the most popular children’s books around. The humour in it and the easy to follow story with the rhymes make it a much loved book for children. It can be easily used to tell a class story which can be then transformed into roleplay, hot seating etc. ",5,0.8625,0.063,0.833,0.104,0.6005882352941176,POSITIVE,0.9996
30,451512803,11/08/2012,5.0,"This book is about a mouse who took a stroll into the woods, along his way he scares a fox, an owl and a snake by telling them the story of the gruffalo who eats them for dinner. The mouse then runs into the gruffalo and he is hungry for mice. The mouse advised the gruffalo that everyone is afraid of him and that the gruffalo should be scared. To prove himself he advised the gruffalo to follow him behind, as they walk through the woods they come across the fox, the owl and the snake who run away when they see the gruffalo although the gruffalo believes they are running from the mouse as he is the most scariest creature in the woods.I enjoyed this book, especially reading it to my reception class. The author had put in some sentences to rhyme and also repeating pattern of phrases. Great illustration and very captivating. Book gives humour especially the part when the mouse persuades the gruffalo that all the other creatures are running from him when really they are scared of the gruffalo.This book is fantastic for story time and I recommend for reception and Year 1.",5,0.8625,0.039,0.876,0.085,0.7295454545454546,POSITIVE,0.9968
31,396025120,08/20/2012,4.0,"I really enjoyed reading this beautifully illustrated story, in which a small mouse escapes the clutches of woodland creatures Fox, Owl and Snake by outsmarting them his imagination and creativity (a classic case of how brain can overcome brawn).Mouse creates the story of a hideous and fierce 'Gruffalo' unawares to him that such creature actually exists, ‘Silly old snake doesn't he know there is no such thing as a Gruffalo'. On encountering the hideous creature himself, Mouse successfully convinces the Gruffalo that he, Mouse, is the scariest creature around!I found this story quite humorous in places, and found that it's rhyming verses and repetition was ideal to allow children to easily join in. Having educational elements within the story I'd say that this book is suitable for young children. However, having read and enjoyed the book so much myself, it's clear this story is suitable for all ages.",5,0.9855,0.013,0.764,0.223,0.5829166666666665,POSITIVE,0.9991
