,review_id,date,rating,text,num_likes,Vader_score,Vader_neg,Vader_neu,Vader_pos,TextBlob_sub,Flair_sent,Flair_conf
213,2876412601,06/29/2019,5.0,Wonderful!,0,0.6114,0.0,0.0,1.0,1.0,POSITIVE,0.9979
214,2983471915,09/19/2019,5.0,Such an amazing book! My 5yr old nephew was given this the first day of school and it was a delight to read for him and to him. Rating: GLanguage: no bad stuffRecommend: Yes! ,0,0.7418,0.128,0.627,0.246,0.5199999999999999,POSITIVE,0.9994
215,3116858085,01/02/2020,5.0,"Heard of this one for ages, but never read it. A funny little tale of the mouse who meets the gruffalo on his walk.",0,-0.4782,0.124,0.876,0.0,0.75,POSITIVE,0.9669
216,3237634986,03/19/2020,5.0,Carwyn really enjoys the Gruffalo. He loves to hear 👂 the story every night at most and enjoys reciting the rhymes.,0,0.8976,0.0,0.61,0.39,0.35,POSITIVE,0.9952
217,3258919509,04/01/2020,5.0,I like this book because the mouse was very clever and he tricked the Gruffalo and the other animals in this book.,0,0.6361,0.063,0.709,0.228,0.6875,POSITIVE,0.9984
218,3319046153,05/06/2020,,"A mouse creates a made up creature, the Gruffalo, as he walks through the forest. He is surprised when he actually meets one. A good read aloud book because of the rhyme scheme.",0,0.7096,0.0,0.796,0.204,0.5333333333333333,POSITIVE,0.9996
219,3428461194,07/06/2020,4.0,Read this adorable story to my nephew and I adored it: it's a delight reading it to the little ones!,0,0.8805,0.0,0.595,0.405,0.75,POSITIVE,0.9906
220,877480473,10/26/2020,5.0,A mouse finds a way to scare off all of his predators by creating the oh so scary Gruffalo! This is such a fun story! One of our favorites! ,0,-0.2245,0.195,0.56,0.245,0.5666666666666667,POSITIVE,0.9998
221,3614127163,10/26/2020,5.0,"The Gruffalo is everything a read aloud should be. It is the one picture book my fourth and fifth graders beg me to read each year, and that's high praise, indeed.",0,0.5574,0.0,0.89,0.11,0.2699999999999999,POSITIVE,0.998
222,3620383098,10/30/2020,5.0,"Cute, smart, short :)",0,0.8271,0.0,0.103,0.897,0.7357142857142858,POSITIVE,0.9989
223,3732300775,12/31/2020,,Something about my daughter constantly saying 'you go ahead and I'll follow after' in every day life. The little patterns that break out of great children's books and linger.,0,0.6249,0.0,0.872,0.128,0.5277777777777778,POSITIVE,0.9992
224,3939285654,04/11/2021,5.0,We're all different and unique. A nice book that talks about using each other's strengths to cover our own weaknesses.,0,0.4588,0.104,0.667,0.229,0.795,POSITIVE,0.995
225,4008103728,05/18/2021,4.0,WOW!!I didn't think I would enjoy this as much as I did!!It was Short and engaging with great illustrations. ,0,0.7219,0.108,0.576,0.316,0.49,POSITIVE,0.8957
226,4127972844,07/21/2021,5.0,Wonderful book for kids. The story is simple for them to follow but good. The art is excellent. Great fun. ,0,0.9731,0.0,0.413,0.587,0.6511904761904762,POSITIVE,0.9412
227,4216826162,09/03/2021,5.0,Great informative book 10/10 amazing plot line raised me fed me saved me,0,0.8934,0.0,0.483,0.517,0.825,POSITIVE,0.9887
228,4339430724,11/15/2021,5.0,The favourite book of my kids. About smart little brown mouse and another fairy tale creature Gruffalo,0,0.4019,0.0,0.856,0.144,0.5714285714285714,POSITIVE,0.9956
229,4397801371,12/19/2021,5.0,my favourite book ever,0,0.0,0.0,1.0,0.0,0.0,POSITIVE,0.9974
230,3349902680,05/21/2020,5.0,I love this cute little story. It is also great on audio. Less than 10 minutes on read time. ,0,0.9062,0.0,0.57,0.43,0.5833333333333334,POSITIVE,0.9956
231,4157777354,08/05/2021,3.0,At the end of the book It doesn’t make any sense why would the gruffalo be scared if a mouse said “my favourite food is gruffalo pie? Because how is a mouse supposed to eat something 10 times the size of you?,0,-0.504,0.077,0.923,0.0,0.0,NEGATIVE,0.9992
232,3291603162,04/20/2020,5.0,Only giving 5 stars because of how well Michelle Obama read it on PBS,0,0.5423,0.0,0.71,0.29,1.0,NEGATIVE,0.9896
233,3614049217,10/26/2020,4.0,Very cute story with an engaging rhyme and repetition. ,0,0.6901,0.0,0.551,0.449,0.85,POSITIVE,0.987
234,3652265462,11/18/2020,4.0,Read this one with the kids. Cute and original. ,0,0.6486,0.0,0.569,0.431,0.875,POSITIVE,0.999
235,3614140383,10/26/2020,5.0,This is one of the books bought for the little library. So super funny I will say that mouse is very sneaky lol. a book you and the kiddos in your life will love for sure. :) ,0,0.9552,0.044,0.561,0.395,0.7069444444444444,POSITIVE,0.9989
236,2835763428,05/27/2019,5.0,Funny and thought-provoking. My 3 year old recites the hole story by heart.,0,0.4404,0.0,0.791,0.209,0.5,POSITIVE,0.9998
237,2824217391,05/17/2019,4.0,A modern clever critter tale,0,0.4588,0.0,0.5,0.5,0.5666666666666667,POSITIVE,0.9994
238,2820610242,05/14/2019,4.0,"Read again and again with the 4 yo, who almost has it memorized. She loved saying ""the three things"" when the mouse describes the Gruffalo, and to be tickled when she reads ""he has purple prickles all over his back!""",0,0.5255,0.042,0.861,0.098,0.4,POSITIVE,0.9888
239,2989014616,09/24/2019,4.0,"The book follows a mouse who goes on a walk through the forest, inventing a tale of a terrible creature called The Gruffalo to scare the other animals he meets. But what will the mouse do when he comes face to face with the real Gruffalo? I have loved this book since I was a child and it gives an important lesson not to judge a book by its cover. ",0,-0.1531,0.09,0.829,0.081,0.6950000000000001,POSITIVE,0.9987
240,2811126628,05/06/2019,5.0,Such a brilliant book. My baby and I can't get enough. The rhythm and story is so satisfying and there's a lot to unpack with perception and the quick thinking mouse. Obsessed and happy 20 year anniversary!,0,0.8992,0.039,0.692,0.269,0.7857142857142857,POSITIVE,0.9991
241,660078013,07/06/2013,5.0,"The Gruffalo by Julia Donaldson is an addictive and attention grabbing children’s book aimed at children from the ages of 3 to 6. It is an expressive story about a clever little mouse travelling through the deep dark woods meeting a fox, an owl and a snake along the way. The only problem is they want to, potentially, eat him. However, the quick thinking mouse, tells a tale of a scary fictional beast called the 'Gruffalo' to get out of the tricky situations. A dramatic twist in the story shows how the mouse ends up confronting the fictional beast later, who is actually real and wants to eat the little mouse too. The double twist in the story then arises when the quick witted mouse tactically escapes the ‘Gruffalo' by devising another tale by which he successfully outsmarts the beast.I can read this to my own children (aged 3 and 7) many times and they are absorbed by its rhyming couplets and repetition which allows story telling to flow brilliantly. The book has vibrant illustrations by Axel Scheffler which are light hearted yet good enough to display and help children visualise the scary ‘Gruffalo’ before his grand appearance. The pictures can help children of all abilities comprehend and enjoy the story. My three year old can describe the ‘Gruffalo’ through the pictures, so story telling becomes very interactive.This book can be used in many ways to form creative lessons especially in reception and year 1 classes. The story can be told in segments with activities based around each theme forming discussions to get the children involved. In literacy children can identify rhyming words and create their own rhymes and in creative writing children can brainstorm ideas to form versions of a scary imaginary character using synonyms of the words used to describe the ‘Gruffalo’ in the book. Also, through improvisation and role-play children can use the different characters to construct a short play and bring the story to life. It can also be incorporated into science, integrated into the learning of food chains, habitats and adaptations of animals. Art lessons benefit greatly using this book as of its excellent descriptions of the animals and brilliant illustrations. Also, on a moral level it also can be used to convey the importance of telling the truth and how a little fib like the mouse told, which although did get the mouse out of trouble from being eaten by predators, did eventually land him to confront the real beast in the end.Overall, story telling truly comes to life with this admirable book and children discover how the mouse becomes the hero of the story, and his innocent betrayal of the others animals puts him in and out of inconvenient situations. The Gruffalo is fun to read, dynamic and catchy and therefore it is a must have in every classroom. ",0,0.9942,0.049,0.8,0.151,0.6110062893081761,POSITIVE,0.9999
242,2574153630,10/26/2018,3.0,"Nobody's as gruff as a gruffalo.It's another story where the main character is a ""trickster,"" which basically means they lie a bunch. It's not bad, especially because the main character is lying to save their own life. There's a mouse, and a fox sees the mouse and implies that he's going to eat him. The mouse says, 'No, I'm going to wait for my friend The Gruffalo, who's scary and gigantic and likes to eat foxes.' The fox leaves in fear, and the mouse says to himself, ""Silly old Fox! Doesn't he know? There's no such thing as a Gruffalo!"" The mouse then encounters an owl and a snake, using the same story on them, getting more descriptive about the imaginary monster. Suddenly, he encounters a Gruffalo, exactly as he had described. Which is a rather unusual twist for a trickster tale. The Gruffalo threatens to eat the mouse, but the mouse shows the Gruffalo that the fox, owl, and snake are all afraid of the two of them (obviously to the reader, because they are afraid of the Gruffalo, not the mouse, but the Gruffalo interprets it as them being afraid of the mouse), and then the mouse threatens to eat the Gruffalo, who leaves in fear. The end.Like I said, it's a really unusual twist to have the thing that a character is explicitly, intentionally lying about, turn out to be true. Of course, as in most ""trickster tales"", it relies on the ""tricked"" characters being complete idiots. For me, this doesn't paint the trickster as clever or intelligent, just lucky and dishonest. If the mouse wasn't trying to save his own life, this would have a bad message, but as it is, it's just middle-of-the-road. It's perfectly reasonable to lie to somebody to save your own life.The rhymes are actually pretty good. The meter is good, nothing feels forced, and it seems like it would work well being read aloud. And the descriptions of The Gruffalo are interesting. I guess people enjoy seeing others get tricked. Of course, as is the case in similar stories with anthropomorphic animals, you have the moral quandary of intelligent animals eating other intelligent animals. If they were all humans instead of animals, this whole thing would be highly disturbing, but they're not, so it's not. So I guess it's okay for a talking fox to eat a talking mouse. I know it's a convention we're pretty used to by now, but that doesn't mean it isn't weird.Message: People who try to hurt you are stupid, and will fall for obvious tricks.For more children's book reviews, see my website at http://www.drttmk.com.",0,0.9909,0.095,0.737,0.168,0.6555833333333334,NEGATIVE,0.9984
243,2143315215,10/04/2017,5.0,"This was a very good book for shared reading, because it involves a lot of prediction. The children can join in the book themselves, because even if they can't read it, they can predict what is going to come next. It is also a funny book that can be enjoyed by both children and adults. It can be used for many other activities, such as drawing the Gruffalo or creating a role-play with the various animals.This book has rhythmic language, which is suitable to being read aloud. By having a good rhythm, more intonation and emotion can be put into the language, which helps to increase the children's interest in the story.The language is also repetitive. At the end of each meeting with an animal, the mouse says: ""Silly old (animal's name)! Doesn't he know, there's no such thing as a Gruffalo?"" This is beneficial for shared reading, because the children join in with the story, as they can predict what is going to happen next. The language also follows the same sentence structure: an animal meets the mouse; the animal tries to eat him; the mouse explains why he can't be eaten because he is meeting with the Gruffalo; the mouse describes the Gruffalo and says that his favourite food is the animal he's talking to; the animal runs away. This repetitiveness encourages prediction and response, as the children are more able to understand the story.There are also many excellent illustrations in the storybook that support the text. For example, each time the mouse describes the Gruffalo; we just see the features that he is describing, not the whole Gruffalo. This encourages the children to use their imagination to guess what the Gruffalo could look like and each time they receive more clues.",0,0.9918,0.013,0.825,0.162,0.5033333333333334,POSITIVE,0.9982
244,2569438961,10/22/2018,4.0,"Summary:The Gruffalo is about a mouse who encounters multiple predators and every time he meets one he describes new details about his friend the Gruffalo. Eventually, the mouse encounters a real Gruffalo that matches his description. To keep from being eaten, he tells the Gruffalo he is the most feared in the forest and proves it to him by reencountering all the predators from earlier. As he encounters each one, they all scatter because the mouse had told them that they were the Gruffalo's favorite meal. After seeing all the predators scatter, the Gruffalo becomes scared of the mouse and runs away.Evaluation:This is a good story about how brains and cunningness can protect even the smallest of creatures. The mouse proves this by describing something that the predators would be afraid so that he would not be eaten. Each time he added another detail and told the predator that they were the creatures favorite meal. Then when the mouse was encountered by his described creature, he used his earlier lie to save him from being eaten by the creature. To come up with lies on the spot takes brains and cunningness.Teacher Tip:As a teacher, I would use this story to talk about visualization and descriptions. The lesson would begin with me reading the story and having the students draw their own Gruffalo based on the description. Then I would show the students what the illustrations show what a Gruffalo looks like. This would lead to a discussion about how they want to add enough detail to their own writing. I would follow this by giving the students a picture of an odd looking creature and have them write a description of the creature. Then the students would read it to the class and see if anyone could draw exactly what he or she was describing.",0,0.8911,0.036,0.888,0.076,0.5149732620320855,NEGATIVE,0.6338
245,2608459474,11/27/2018,4.0,"The Gruffalo is a fun rhyming story about a mouse and the big gruffalo. The mouse was on his way to see the gruffalo when he was stopped by the fox. The fox asks what the gruffalo was and the mouse described him as a big monster with large tusks, big bear claws, and terrible teeth. The mouse tells the fox that the gruffalo eats foxes and the fox ran away. But, there is no such thing as a gruffalo. The mouse then ran into the owl who tried to eat the mouse. The mouse told him he was on his way to see the gruffalo who has knobby knees, turned out toes, and a poisonous wart on his nose. The mouse told the owl that the gruffalo's favorite food is owl and the owl flies away. The mouse then runs into a snake and the mouse tells him the same thing that he is going to meet the gruffalo. The mouse describes the gruffalo with having orange eyes, a black tongue, with purple prickles all over his back. But, little does the snake know the gruffalo isn't real. Once the snake learns that the gruffalo eats snakes, he slithers away. As the mouse continues on in the forest, he runs into the real gruffalo. The gruffalo tries to eat the mouse but he said wait and said that he was the scariest animal in the forest. He told the gruffalo to follow behind him and he would prove his scariness. The mouse and the gruffalo pass the snake, owl, and fox who run in fear from the gruffalo following behind the mouse. The mouse then tells the gruffalo that his favorite food was gruffalo crumble and the gruffalo ran away scared. The mouse sat in peace and ate his nuts. This is a fun story for kids to enjoy with their imagination. Describing the gruffalo allows students imagination to run free and picture what the gruffalo actually looks like before he is revealed in the book. ",0,0.9246,0.055,0.864,0.081,0.4168219461697722,POSITIVE,0.8398
246,2783021201,04/11/2019,5.0,"The Gruffalo by Julia Donaldson is based on a Chinese folktale. As the story goes, a tiger wanted, more than anything to become human. In order for him to make his wish come true, he had to eat three children. He finally met his match when he came upon the third child. Donaldson does a wonderful job recreating the folktale. Mouse can be credited with giving Gruffalo the big scary creature persona. It was absolutely necessary to keep himself from being someone else's meal as he walked through the deep dark wood. His plan was working perfectly until he, unexpectedly, met up with the Gruffalo. Could Mouse's wit save him?The Gruffalo is a terrific book filled with of vivid descriptions, rhymes, repetition, and predictability. I would recommend it for K-3 and possibly as a mentor text for upper elementary. The big scary creature is not quite gruesome enough to scare the little ones and the colorful description of him, that Donaldson provides, may be an inspiration for older kids and their writing. This story could be tied into a science curriculum. Students could create their own creature, then describe the creature’s habitat, prey, predators, and adaptations. Another science related activity, would be to have the students to create a food chain, as an extension to the story. This book would also make a good choice for a choral read, reader’s theater activity or a ""moral of the story"" discussion for the primary grades.",0,0.9776,0.036,0.821,0.143,0.6026041666666666,POSITIVE,0.9939
247,2484402333,08/06/2018,4.0,"We love this book! It’s just so clever and fun, and the illustrations are great. I like the cleverness of the mouse tricking the other creatures one by one. I like how the text goes from fox to owl to snake, then Gruffalo, then back in reverse order (snake, owl, fox). Certain phrases are repeated often, too. The repetitions are great for little readers. Asher has parts of this book memorized as a result, and you never know when you’re going to hear a little “Oh help! Oh no! It’s a Gruffalo!” in his playing.As usual, I’m not super thrilled that every single creature in the book is male. Five total creatures and not one could be female?Also, other parents have complained that this book encourages lying. I’m not as solidly against lying as most people are, though — for one thing, I think it’s an unrealistic place to plant my flag and don’t want to get caught up in enforcing it; for another, lying at a young age is correlated with intelligence; and finally and especially, the power and control aspect of telling others not to lie troubles me (awfully convenient for those in authority). And, importantly, the story doesn’t work without it. This mouse has to be shrewd to survive! So that never even occurred to me as a concern with this book until it was pointed out, but if that’s a big deal in your moral code, this might not be the book for you.Detailed review on the Over-Analyzing Children's Books blog at https://o-acb.com/2018/08/06/review-t...__",0,0.9225,0.051,0.83,0.119,0.5244897959183673,POSITIVE,0.8845
248,2789549443,04/17/2019,4.0,"“A mouse took a stroll through the deep dark wood… but what happens when he meets a hungry gruffalo?”This story follows the journey of a very smart mouse who manages to trick the scary creatures she faces but can she trick a gruffalo?The Gruffalo is a wonderful way to introduce key stage 1 to the key features of an adventure story and the excitement of story mountains. It is also a great way to teach what a noun and adjective are, the differences between them and how we can make word choices to manipulate our reader. Its rhyme and repetition makes it a brilliant book to read aloud. Its rhyme and repetition also makes it easy to recite, ideal for extended pieces of writing in year 1.",0,0.9873,0.046,0.714,0.24,0.8380952380952382,POSITIVE,0.9999
249,2146217134,10/07/2017,4.0,"The Gruffalo by Julia Donaldson is just a wonderfully written, beautifully illustrated book which is now one of my firm favourites! I love the descriptions of the characters and the way it has been written I think is very clever. Using passages of text full of description allows one to fully immerse themselves in the imagination of these rather interesting characters. The sly little mouse really gives you an insight into what he might be like. Using excellent passages such as 'through the deep dark woods does little mouse go, announcing his meeting with the fierce gruffalo'. Just magical!Wonderfully captivating, and beautifully illustrated - the pictures have made this into an incredibly successful franchise which is adored by children - my nephew being one throughout. He loves sitting on my knee laughing like a drain in utter enjoyment as the story unfolds, pointing at the pictures and desperately waiting to turn the next page and finds out what happens next. The fact that he has read it now over 40 times should indicate just how much he does love it, but it always makes me smile reading it to him! The language used and repetitive nature of the text makes it a firm favourite - and the opportunities for further extention activities either at home or in the classroom are endless.Just a delight to read, and if you haven't read it yet - you are definitely missing out!!",0,0.9886,0.027,0.787,0.185,0.5571428571428572,POSITIVE,0.9999
250,2726895167,02/23/2019,4.0,"The Gruffalo is a story about a mouse going through the woods and all these animals come up trying to convince the mouse to come to their house so the animal can eat him. The mouse makes up a story about a gruffalo and how he likes to eat the animal the mouse is talking to. The animals scare away until the mouse runs in to a real gruffalo! He tells the gruffalo that he is the most scary of them all and to follow him through the woods to see. The animals all scurry away because their scared of the gruffalo so the gruffalo thinks the mouse is really scary and runs off. The Gruffalo's theme would be to not judge a book by its cover. Everyone thought the gruffalo was scary when he turned out to be afraid of the mouse. This is a great example of how being smart can really get you places in life. When I read this book I found myself smiling because the mouse was so smart. He kept getting harassed and all he wanted was a nice stroll through the woods. He was very smart and it worked in his favor. I would recommend this book because it is fun and it rhymes. This is perfect for children because it will keep them entertained. It would also be a good book to be able to ask questions along the way to keep the reader engaged like ""Why do you think he is doing this?"" or ""What do you think is going to happen?"" ",0,0.9731,0.068,0.773,0.158,0.6997767857142857,POSITIVE,0.9915
251,2137908980,09/28/2017,5.0,"I thoroughly enjoyed reading this book. The rhyming text lends itself perfectly to being read aloud and would therefore be a brilliant book to use as a shared read. The repetition of certain phrases throughout the book helps children to feel at ease and gives them the chance to get involved. The book uses humour cleverly to engage its reader and children will love phrases such as ""scrambled snake"" and ""gruffalo crumble"".Alongside Scheffler's wonderfully detailed illustrations, Donaldson's brilliant descriptions help to bring the text to life. The book could be used to help children to think about character descriptions and effective use of adjectives. Children could have a go at writing their own descriptive pieces, inventing their own versions of the gruffalo. They could also try to spot the many different language devices used by Donaldson in the text, for example alliteration (""deep dark wood"").This book promotes the power of intelligence and it's wonderful to see the tiny mouse using wit to overcome all of the other creatures in the wood.Overall I see this text as a fantastic one to share with children. Readers of all ages will find themselves enthralled with the plight of the little mouse and the book can be adapted to be used in many different ways. ",0,0.9964,0.0,0.731,0.269,0.6969461697722568,POSITIVE,0.9998
