,review_id,date,rating,text,num_likes,Vader_score,Vader_neg,Vader_neu,Vader_pos,TextBlob_sub,Flair_sent,Flair_conf
0,219008611,12/09/2019,,"Honestly at this point I really love getting to spend time with Bella, Edward, and Jacob. They’re all silly and I love them.",427,0.9199,0.0,0.565,0.435,0.74375,POSITIVE,0.9972
1,1237783050,08/06/2020,1.0,"It’s always Team Edward this and Team Jacob that, but there’s only one real team when it comes to reading the Twilight series. And that’s Team Suffering.Honorable mention to Team Alice.The only character I respect.Everyone else is a nightmare gremlin demon, and also somehow the plot isn’t even fun, and also this book is no joke like 1,200 pages long. I’m pretty sure. Don’t fact check me.You really have to wonder why we all stanned these books so hard in middle school. Were we depraved? What was wrong? Did we just need a juice box and a firm hug?I don’t know, but it’s upsetting. These books really do surprise you with their sheer ability to find new ways to be terrible. If in 50 years a CIA report is declassified outlining the use of this series as a torture mechanism for feminist women who would one day be forced to confront the ways their middle school favorite series traumatized them I wouldn’t be surprised. In fact, that’s a more likely explanation than everyone spontaneously being horrible.Like, Jacob kisses Bella without her consent and tries to manipulate her continuously. Charlie cheers him on for a taking-what’s-his mentality even though it’s HIS OWN KID. Edward kidnaps her when she doesn’t do what he tells her to do.This sh*t is exhausting. WHY IS EVERYONE THE WORST.But Bella is boring as hell so I don’t feel that bad for her. Honestly she needed some excitement forcibly injected into her life.But there isn’t actually any excitement because HOWISTHISSOBORING. The plot doesn’t start until 55% and even then the action is nowhere close to arriving. The whole action sequence is probably about 0.43% of the page count. And for what, you might ask?Easy. To make more time to talk about how important it is to wait until marriage before you get it on.I mean, vampires who kill for pleasure, that’s all well and good, but personally I draw the line at premarital f*cking. Edward literally looks Bella in the eyes and goes “your virtue :) I have to protect it :) everyone knows if you f*ck outside the bounds of holy matrimony you get locked out of heaven :)” and Bella’s just like no yeah sound logic that tracks goodnight!!!It’s fun foreshadowing for how hard this poor girl has to work to get her husband to give it to her in the next book. I cannot emphasize enough the extent to which I would burn everything to the ground in her shoes. One cool thing about this book is that if you were worried about the weird comparing-the-adult-you-love-to-a-child motif being over since Bella and Edward are firmly in <3 now...you don’t have to be!We get everything we need in Rosalie’s tragic backstory, during which she tells us that she’s sexually and romantically interested in Emmett because he reminds her of her friend’s baby. This series really stays giving us everything.Including basic errors and overdramatic writing techniques all in one, like when on one page Jacob says “what’s it like having a werewolf for a best friend?” and on the next page there’s a big dramatic moment where he can’t say the word werewolf…Basically what I’m trying to tell you is that this book sucks.Bottom line: See above.---------------pre-reviewthis book is 629 pages long, and i felt every single one of them.review to come / 1 star?---------------amazing that stephenie meyer wrote a romance about murderous vampires and moral priority #1 is No Sex Before Marriage---------------edward: bella is so hot :) she's a child, but in a hot way :)rosalie: wow look at that guy getting eaten by a bear :) he looks like my best friend's baby :) and that's sexy to me :)me: ---------------only one love triangle in literary history deserves rights",353,0.998,0.112,0.675,0.213,0.596247511279157,NEGATIVE,0.9999
2,5997602,09/10/2007,1.0,"My notes to characters in Eclipse:Bella: I'm so done with you. You're a self-absorbed little snot. You're not a strong modern woman because you don't want to be a teen bride, and you're not cute because you fall down a lot.Alice: You're so not cute either. Jacob: What you did is called ""date rape,"" buckaroo. And to think I liked you best until the middle of this book!Edward: Checking the brood-o-meter... yep, you're still no David Boreanaz.Leah (the one lady-wolf): I don't understand why you're getting the short end of the stick just because you had your heart broken... everyone seemed to cut Bella enough slack in the last book for a lot less. Sucks to be a supporting female character in these books, huh?Note to Stephenie Meyer: Even you must think the Wuthering Heights references are a little over the top, right? Oh, and all your acknowledgements? Well, you're not cute too.",303,-0.2422,0.114,0.791,0.096,0.4321789321789321,NEGATIVE,1.0
3,3793381637,01/30/2021,1.0,"*sharp inhale*trash trash trash trash trash trash trashThat's what this book is.A dumpster fire. A rubbish heap. A garbage bin. This is a series of events where Bella wants to do something and so she asks Edward, and Edward refuses so she doesn't do the thing. Like she needs permission from him to do what she wants. Honey, he's a senior citizen, I don't think he and you should be in a relationship in the first place. Second of all, I believe you are a human of your own, and he doesn't own you. But I guess Bella is too entranced with his marble skin and golden eyes and sharp cheekbones to care. Every time Edward walks into the room, we have to go over all of this again. Over and over and over again. I get it. I understand that he has skin. And a face. And hair. Apparently only one person understands this, and that's Charlie Swan. 
""I don't think you should dump all your other friends for your boyfriend, Bella,"" he said in a stern voice. ""It's not nice, and I think your life would be better balanced if you kept some other people in it.""
You see? He gets it. 
""If you'd have had more of a life outside of Edward Cullen, it might not have been like that.""
GET WRECKED, ISABELLE GOOSE. I don't think Bella has enough brain cells to understand, but whatever. She and Edward combined only have half a personality. DNF0.2 stars; I added the extra 0.1 for Charlie",214,0.2093,0.033,0.935,0.032,0.4857142857142856,NEGATIVE,0.9997
4,322665665,05/02/2012,2.0,"snif. my link is worthless now.this is the virgin daiquiri version of wuthering heights, all watered down, plopped in a blender, and sitting at the folding card table with the kiddies.and they are all gulping it down without knowing that the real deal is way more fun.elizabeth has probably written the best review this book could ever get, with much wittier analogies, so go read that, then come back here for some less-articulate complaints.i messed up. i thought i would have a nice vacation, where i would have plenty of time and concentration to lounge over our mutual friend. instead, there was drinking, and some self-pity, and vacation-langour, and i just couldn't give dickens the attention he deserves. you know who really doesn't deserve my complete attention? stephenie meyer.and why is that? because she has grievously misinterpreted one of my favorite books and has created this sort of chimera byproduct that you can see some of the source material in if you squint, but it's mostly just wrong.i mean, at this point in everyone's lives, the world doesn't need another eclipse review, right? so i am mostly going to just bitch about why this book misrepresents wuthering heights and why that makes me cranky.i suppose it is ambitious of her to have attempted to pepper her vampire romance novels with elements of better works of literature like, say, shakespeare and jane austen. she made the decision to try to shoehorn these characters into the mold of another book, and just didn't bother trying to fix the parts that overflowed or got stuck together.but you can't get mad at a puppy for pissing on the rug.and i knew what i was getting into. before i started reading this, i was aware that this was the wuthering heights installment of the series, so i was obligated to read it on those grounds alone, as i will read any retelling of w.h., for better or for worse. usually worse.and elizabeth had warned me and warned me that meyer got w.h. all wrong and had reversed the roles of heathcliff and linton in a most embarrassing way, but at first, i saw no problems. bella was obviously catherine, edward was heathcliff the true love and jacob was linton,the more ""appropriate"" choice, right? done and done. i kept reading, shocked, thinking, ""but elizabeth is never wrong! what gives??""is she only basing this on appearance? on the superficial? edward is fair and wealthy and very understanding of bella's other ties - like linton (maybe not ""understanding"" in linton's case, but ""ineffectual"") and jacob is definitely darker-complected, like heathcliff, and tied to nature and the earth. but that shouldn't change the basic differences.because obviously edward is the sun to bella's flower face. she cannot be without him - even an afternoon spent apart is unendurable and the intensity of their love is undeniable and unbreakable and blah and blah. jacob is her father's choice for her, which makes him linton, who is technically a better choice because there is less self-destructive passion, and choosing him allows her to remain, you know, alive.but let's back up.because wuthering heights was never a choice between two suitable men. it was a choice between passion and security. head and heart. and linton was never an alternative to heathcliff, catherine always just wanted it all. it was never about love, not with linton.he was simply the path of least resistance, and a means to an end. securing him meant securing a place for heathcliff, whom she could never marry. but who needs marriage when your husband is much weaker than your lover?so, in a more modern version of the story,it makes sense to do away with the financial angle, especially with characters this young. the conflict here is between soul and body. all bella has to do is choose humanity or immortality.easy-peasy. so the reversal of edward and jacob's fortunes didn't cause me too much grief, and still maintains the distinction between edward/heathcliff and jacob/linton. the root of the conflict is the same: to go with an all-consuming passion that ""eclipses"" one's own self and is potentially dangerous (for so so many reasons here) or to go with the one who feels more like ""family,"" who has the paternal approval, who will allow her to remain a living breathing human and retain her entire life...except her passion.fine. this still parallels w.h. and the more specific details: heathcliff goes away while catherine recovers at the linton's. and then he goes on that much longer absence, plunging her into despair. so far, so good. edward leaves bella in new moon and jacob steps in to be there for her and heals her and manages to stick a little bit of him in the space edward's leaving left.but then it gets messy and too many of heathcliff's characteristics start leaking into jacob. because jacob is kind of a dick. forcing kisses, always smirking and pushing his boundaries.he takes much more delight in troublemaking and hurting his rival, and occasionally hurts bella,too. jacob is warm and furious and tied to the forest the way heathcliff is tied to the moors.it is jacob who is the earthbound heathcliff she can remain a grubby child with. meyer rightly recognizes edward as the other half of bella's soul, but extracts all the physical, earthly passion from that role and gives it to jacob.edward protects her like a fine crystal object while his sister dresses her like a doll. what does this sound like?? linton linton linton! bella as catherine is obviously the weakest here. she is nothing like catherine. she moans about not being good enough for edward. catherine was never ""good"" enough for linton, but did that stop her? she barreled in and took what she wanted and refused to leave. bella fusses over everyone and just wants everyone to be happy and self-sacrifices all over the place. i understand that bella's character has already been established in other books, but how can she compare herself to catherine with a straight face?? catherine is a goddamn honey badger. bella is a mother hen.her relationship with edward certainly has elements that are unappealing - who wants to be watched and protected that closely all the time?, but at least i believed in their feelings because they are always reminding me and shoving my face in it.jacob forces himself on her, laughs at her human weakness when she fights back, and tries to separate her from her happiness at every turn. it is both arrogant and insecure, but this is still somehow, but the one who is most ""like family"" who bella's dad wants her to be with. (do NOT get me started on ""parental roles in the twilight saga."")(but quickly: our girl walks through the door from her vacation and already is making dinner for her father who supports some shirtless douchebag's forced kisses, but hates the rich boy who really wants to marry his daughter and preserve her virginity.) but this is another reversal to w.h., too since heathcliff was at least raised as family, even if you don't interpret heathcliff as mr. earnshaw's bastad son. which is not a belief i personally subscribe to, but it is out there. edward is patient and forgiving and gentle and willing to give bella the space she needs before making her decision before she is even aware there is a decision to make.come on - that can't be right!heathcliff doesn't share. he can tolerate linton because he is weak and catherine would not have him harmed, but this vampire zen shit has no place in a heathcliff character, and isn't even a linton quality. that element is pure meyer.in wuthering heights, everyone behaves poorly.in this one, it is really just jacob as linton, i mean heathcliff, i mean jacob.nonsense.apart from any messing-with-the-heights stumbles, this also maintains all the lazy writing and comical details meyer interprets as passion: all the tooth grinding and clenching and chuckling and things said under the breath.oh, and snorting. why does everyone snort? and borrowing lines from wuthering heights to help bolster your characters is like posing next to the chubby girl in photographs to look slimmer. we see your borrowed finery.and the love triangle thing is pretty forced. bella herself doesn't even realize until the end that she is even in a love triangle, so how are we supposed to? honestly, i am aware that there is such a thing as ""team jacob"" because i am a citizen of the world, but god - what's the appeal in some pushy dude who won't take ""no"" for an answer??and why do i excuse heathcliff all his sins? is it because the writing is better? is it because i believe in his love in a way i do not believe in bella? because when i think of heathcliff i feel a physical reaction in my heart. when i think of jacob, i roll my eyes.i actually liked twilight, despite its flaws. new moon was boring and repetitive. this one was irritating because of how much i looove w.h.there is no evil in this book - no revenge. the stakes are too low in the triangle.i picture the three of them at a bar:oh, i made sure jacob would overhear my conversation with bella about our upcoming nuptials. snort chuckle. eeeevil! oh, i knew edward could read my mind so i thought about how sad bella was when he went away. clenched teeth, snort,eeeevil! oh, i married her husband's sister, alternately beating and ignoring her, raised my enemy's son to be an illiterate brute, and ruined everyone's lives while i mourned my one true love. (crickets... the sound of edward and jacob pissing themselves)here is some exciting eclipse information for this year:http://eclipse.gsfc.nasa.gov/eclipse....and get on that venus one, because you're not gonna get another chance unless you are team edward.and because this still makes me laugh:http://www.funnyordie.com/videos/f03d...i think i have probably made a point or two in that rant somewhere. i wasn't enraged, overall, not really, but it was a pretty bloated book and i really don't get all the love for this series...oh, and a gross dedication:to my husband pancho for your patience, love, friendship, humor, and willingness to eat out.TMI, stephenie meyer, TMI ...come to my blog!",186,0.9979,0.114,0.736,0.15,0.4867920561391898,NEGATIVE,1.0
5,7745588,10/15/2007,2.0,"I had expectations for this book, but I found it to be a terrible disappointment. Where to begin with? First of all, I have lost most of the respect I had for Bella as a character. Her obsession for Edward has really gone overboard, to the point of becoming downright annoying, even unhealthy. She worships the ground he walks on, and is all too ready to dump her parents and friends just so she can spend more time with him without growing old. She doesn't seem to have any serious problem with the idea of making her parents worry, or the thought of never see them again... she's willing to stomp over anything that isn't Edward, even things that can enrich her life. She's like a satellite, her boring life revolving solely around him. She has no self-worth, and spends a good deal of the book whining, complaining and sighing, I really wanted to shake her hard at times and tell her to GET A LIFE. I also find it deeply disturbing that Bella is not more repulsed by the idea of blood lust. How could she accept the thought that she will want to kill people (even her family) so easily, just because of him? Second, Edward has gone from charming to BORING. There is such a thing as being too perfect (read: dull), and Edward fits the mold perfectly. His character is so flat, and how many times can we hear Bella and Edward exchange their love for one another before becoming bored? I mean honestly, how perfect can he be before it simply becomes ridiculous? Most of the book is spent on the two of them fawning over each other and Bella saying over and over and over again how sexy and good-looking he is. Writing tip for the author: You don't need to tell us countless times that your character is wonderful. Actions speak for themselves. Jane Austen didn't need to remind us several times that Mr. Darcy was perfect... he simply was.Third... Jacob. He's the reason I gave this book 2 stars. He was the most compelling character in the book. He wasn't perfect, but he was fun, honest, and very human, making big mistakes, but always trying to do his best... he was impossible not to love. He was real, not a perfect pretty doll with no flaws. Sadly, he was mostly wasted.I also the think the magic Twilight had dissapeared. I liked the books because the author made the whole vampire/werewolf thing so credible, but now, with armies of vampires raging through Washington, credibility has gone out the window. Also the whole book was focused on on a love triangle that everybody knew how it would end, and it made everything very predictable. And how come nobody saw that Victoria was behind the killings, when it was so darn obvious even to the casual reader? Were they stupid? Overall, a great disappointment, I'm not sure if I'll read the next book in the series. Why bother? ",183,0.9738,0.169,0.642,0.189,0.6123377085877086,NEGATIVE,1.0
6,84750788,01/12/2010,4.0,"Eclipse (Twilight #3), Stephenie Meyer Eclipse is the third novel in the Twilight Saga by American novelist Stephenie Meyer. Bella finds herself in danger again. He has to choose between his love for Edward and his friendship with Jacob. A choice, which can fuel the long-standing enmity between vampires and werewolves. She has to make another decision as the high school exam date approaches: life or death! Which decision brings him death, and which choice brings life?عنوانهای چاپ شده در ایران: «خسوف از مجموعه شفق»؛ «ماه گرفتگی»؛ نویسنده: استفنی مه یر؛ تاریخ نخستین خوانش روز چهاردهم ماه دسامبر سال2009میلادیعنوان: خسوف - ادامه رمان ماه نو - کتاب سوم از مجموعه شفق؛ ماه گرفتگی؛ نویسنده: استفنی مه یر؛ مترجم: شهناز کمیلی زاده؛ کرج، در دانش، سال1388، در572ص؛ چاپهای دوم تا چهارم سال1388؛ چاپهای پنجم تا هشتم سال1389؛ شابک9789641740704؛ موضوع: داستانهای نویسندگان ایالات متحده آمریکا - سده21معنوان: ماه گرفتگی؛ نویسنده: استفنی مه یر؛ مترجم: فرشید قهرمانی؛ قزوین، سایه گستر، سال1388، در456 ص؛ شابک9789645024404؛نقل از ابتدای متن کتاب: (بعضی میگویند: دنیا در میان آتش، به پایان میرسد، دیگران میپندارند در میان یخ، با طعمی که از اشتیاق و شور و شوق چشیده ام، با آنها که آتش را ترجیح میدهند، موافقم؛ ولی اگر بنا باشد دوباره از بین برود، فکر میکنم به اندازه ی کافی نفرت را میشناسم، که بگویم: برای ویرانی دنیا یخ نیز معرکه است، و کفایت میکند)؛ پایان نقل از «رابرت فراست» در ابتدای متن کتابکشتارهای زنجیره ای دهشتناکی، در شهر «سیاتل» رخ میدهند، زن خون آشام خبیثی، همچنان به جستجوی انتقام جویانه ی خود، ادامه میدهد؛ «بلا» بار دیگر، خود را، رودررو با خطر، میبیند؛ او باید، میان عشقی که به «ادوارد» دارد، و دوستی با «جاکوب»، یکی را برگزیند؛ گزینشی، که میتواند به دشمنی دیرینه ی خون آشامها، و گرگینه ها، دامن بزند؛ او مجبور است، با نزدیک شدن تاریخ امتحانات دبیرستان، تصمیم دیگری نیز بگیرد: زندگی یا مرگ! کدام تصمیم، مرگ را برایش به ارمغان میآورد، و کدام گزینش زندگی را؟تاریخ بهنگام رسانی 29/09/1399هجری خورشیدی؛ 09/09/1400هجری خورشیدی؛ ا. شربیانی",177,-0.5242,0.035,0.937,0.028,0.4279999999999999,POSITIVE,0.9926
7,3493839166,08/13/2020,5.0,"FIRE AND ICE
Some say the world will end in fire, Some say in ice. From what I’ve tasted of desireI hold with those who favor fire. But if I had to perish twice, I think I know enough of hate To say that for destruction ice Is also greatAnd would sufficeROBERT FROST
Still loving and still wishing I could be a werewolf. Of course, I would look ultimately more awesome 😉Mel 🖤🐶🐺🐾BLOG: https://melissa413readsalot.blogspot....",131,-0.3485,0.176,0.676,0.148,0.7699999999999999,POSITIVE,0.9857
