,review_id,date,rating,text,num_likes,Vader_score,Vader_neg,Vader_neu,Vader_pos,TextBlob_sub,Flair_sent,Flair_conf
46,40007270,12/13/2008,5.0,"Eclipse started out pretty good, and by the time I finished it, I was once again feeling the love glow that these books give me. My Thoughts:1.Bella. Bella was rather annoying in this book. I have decided that she must have the lowest self-esteem of any person alive. I just don't get why she doesn't like herself, doesn't think herself worthy of others' love. I think that everyone should love themselves, and with two parents that adore her, you think that would have instilled some degree of self esteem within her. But, no! Yes, we all see our flaws magnified, but still we should love ourselves as God made us. Unique creations, good part and areas in need of improvement, alike. And to make her more annoying, her self-esteem issues make others' lives more difficult. As much as I love Edward, Bella's attitude that he's so far above her, that he couldn't love her is frustrating. She doesn't think she should take anything from him more than his love. Like he shouldn't fight for her, or be willing to die for her. When she'd do it for him. That he can't give to her selflessly, when she gives all for him. In contrast, she seemed to take Jake's love for granted. The saving grace of Meyer's portrayal of Bella is that she's actually fairly self-aware. She can see her flaws clearly, her tendency to be selfish, despite her lack of self-love. She knows she's neurotic and grasping, and seems ungrateful at times. She wants to do better, and she tries. And in other ways, she's very giving, the way she cares for others. In the end, I still like her, but she's hard to swallow at times.2. Bella and Jacob. I'm not sure how I feel about the way Bella and Jacob's relationship changes in this book. (view spoiler)[ Why does Bella have to be in love with Jacob too? A woman/man love? I am not saying that people can't feel more than one kind of love, but I just don't believe that you can love more than one person as your mate whole-hearted. In this story, it seems as though part of Bella loves Jacob as much as Edward, but she can't live without Edward, so that's why she chose him. That's a cop-out. It makes it seem like Edward is more of an addiction, and not the man she chooses to love. That she loves fiercely. I'm not discounting Bella's capacity to love Jacob. Jacob is a wonderful guy. He's very lovable and wonderful in a different way from Edward. I think that in another life Jacob was her true mate. I know that when Edward left, Jacob was there, and his love healed that wound that Edward's leaving caused Bella. He's always going to be a part of her, and even Edward knows that. I believe that he is her soulmate in that he is her best friend. But I don't think he's her other true love. So that drama of having her heart broken because she loved both guys seemed unnecessary to me. Far be it for me to tell a writer how to write her story. If that's how Ms. Meyer wanted to write it, then so be it. I just wasn't too fond of it, though.  (hide spoiler)] I do like the sweetness and the snarkiness and the enrichment that Jacob and Bella's friendship brings them both.3. Jacob. I started caring deeply for Jacob in New Moon. Even when he is annoying, he's so vibrant, and it's hard to dislike him. I can see why Bella felt like he was so necessary to her life. He has that way of bringing life and love to the lives of those around him. I see him maturing into quite a man. I think some of what he does to Bella and Edward was kind of low-down, but he playing to win Bella from Edward and a future as a vampire. He thought he was doing the right thing, and I could see that, even though I can see why Bella and Edward wanted to hit him. I appreciated the perspective I gained of Jacob by learning more about his tribe, their pasts, and the awful things the Cold Ones had done to them. I can totally see why Jacob feels such hatred for the Cullens. I can see why he seemed so mercurial and he shows some emotional cruelty in moments. He has a whole lot on his plate. Not only does he have his unrequited love for Bella to deal with, he has a several tons' weight of all his pack and tribal family's issues to carry around. That's a lot, even for a six-feet, seven, enormous guy like Jake. At the end of the day, flaws and all, I want to hug him. Even if I don't think he should be with Bella in the long run. He needs a more balanced, more emotionally healthy person than Bella to be his true soulmate. (view spoiler)[ One thing I don't get is why he hangs onto Bella so hard, when he knows he's not imprinted on her. Is he trying to rebel against his destiny in this way? Shape at least one thing for himself? He sees that Bella can be the one thing he can claim selfishly, that doesn't have to be about his heritage as a Quilete tribesperson? I think yes.  (hide spoiler)]4. Edward. I still love him as much as I did in the first two books. Yes, he's kind of bossy sometimes, but Bella does what Bella thinks is right, and he's pretty easy for her to manipulate. He's wrapped around her finger. I love that Edward's love for Bella isn't a selfish one. He really does want what's best for her, and much of what he does comes out of that. That doesn't mean he's perfect. There are times when he does want to be selfish, or when he tries to be controlling in her best interests, but he realizes that he's wrong and he makes up for it. And I can't stay mad at him. Really, I love this character. Everything about him. He's very courtly and decent. He's also tough and protective. His beauty isn't just skin deep. It goes to the heart and that shines out, and becomes part of his appeal for this reader. I like his interactions with Jacob, how they both do the territorial guy thing, and you see some of his more primal aspects in those moments. But at the end of the day, Edward is always going to be that decent, kind man who will do the right thing even if he doesn't like it. I hurt for Edward that he could see the draw between Bella and Jacob, and how he was hurt by some of the interactions between Bella and Jacob. Almost as though Bella's love for him was so sacred, he couldn't have the normal moments with her that she shared with Jacob. I think he shows his love for Bella that he tries very hard to allow her to have that, and not to mess that up for her. I can totally see why Bella loves him, although I don't think she should put him on a pedestal. Even Edward doesn't want that. 5. Edward and Jacob talking things out. As with the movie, which I saw first, this was one of my favorite moments in this book. I felt that it shows a lot about the two characters, and they come to realize that they aren't the enemies that they believe themselves to be. They are part of a triangle that has complemented their lives even as it's complicated them, but also one that has enriched each person. I think this is when they make peace on a deep level (even though things are a bit rough after this point). Jacob comes to see how Bella can love this 'cold one', and that Edward would never be selfish when it comes to Bella. He would give her up out of love, if he thought that was what Bella wanted and needed. And Edward comes to realize how important Jacob is to Bella, and how he can give her things that Edward can't. It's a painful thing for both to accept--the importance that the other guy has in Bella's life. This part was very well done, in my opinion. 6. The Cullens' stories. I loved reading about Rosalie and Jasper's stories. Rosalie in the movies annoys me. I like her more in the books, because you can see that her enmity with Bella isn't so much against Bella, but the desire for Bella to have the life that she couldn't, and for Bella to appreciate those choices better. What happened to Rosalie was shockingly dark. It's hard to believe that people can be so wretched to do something like that. But that's real. I can't say I regret that Rosalie was 'theatrical' in exacting her revenge. Jasper's story was one of my favorite parts of the book. I have to say that other than Edward and Jacob, Jasper is up there for me as a guy in this book. I like him almost as much as Jake. I liked seeing more of him, and how Meyer takes him from being the 'strange' brother to having a rich back story and a crucial role in the story in this book. As Rosalie's story is dark, Jasper's is equally so. Even though people hate how Meyer portrays vampires, thinking is all sparkling and light, that's clearly not the case. I like the constrast that Meyer draws between the luminous beauty of the vampires, to their dark, ravenous, grasping, cruel, destructive natures. I think in some ways, these vampires scare me more than the traditional lore, and that's coming from a girl who's read vampire stories for many years. Her vampires are formidable in a more scary way than some of the traditional vampires I've read about The typical nature of the Cold Ones strikes a sharp contrast to the decent, loving, humane natures of the Cullens. I don't want to be a vampire at all, but being a Cullen....I think I'd like that very much.7.Victoria. I can't stand her! She's so selfish and cruel. I think she got just what she deserved.8.The Volturi. I can see a major standoff between them and the Cullens looming on the horizon. They will realize that it's folly to take the Cullens for granted. I especially despise Jane!Overall Verdict: After the emotional rollercoaster of New Moon, it took me a while to find my feet in this installment. However, Meyer worked her spell on me once again. There are some moments of pure brilliance in this novel. I think that she has a way with words, with painting powerful imagery in my head. I loved the line in which Jacob says he is Bella's sun, but he can't fight the eclipse (which is Edward). That one line pretty much conveys the essence of this series. I love this series because it strikes me at the heart. The idea of a love that great, something beyond understanding. When you love someone, you can't always dissect out the whys, and you can't change it. You can move on, sometimes. Live your life, but part of you is always going to be with that person, and you don't ever get it back. That's what I see with Edward and Bella, and with Bella and Jake. Although not on the same scope, as an inveterate booklover, when I finish these books, I feel like part of me stays with them after I read the last page. It echoes that powerful feeling of love in a small way in my life. And I like that!",27,0.9999,0.082,0.708,0.21,0.6054422799422801,NEGATIVE,0.9963
47,3291225084,04/22/2020,2.0,"So like, plot wise this is one of the better ones (maybe the best one?) but FUCK I cannot stand Edward and Bella and halfway through this book Jake turns unbearable too. I only reread this for a term paper and I cannot believe I liked this as a teen. WTF. I honestly don't even wanna waste words on how horrible this one was, but she really just fit it ALL in there, didn't she? Racism? check. Sexism? Check. Homophobia? Even managed to cram that in there. Sexual assault? hell yeah. Gaslighting and a rather toxic relationship? All there, plain as day. Anyway, gotta go listen to Breaking Dawn now, because, you know, Term Paper. Big F in the chat for me.",25,-0.9173,0.207,0.624,0.169,0.5556547619047619,NEGATIVE,1.0
48,50300042,03/24/2009,1.0,"Anyone who's read my reviews of the first and last books in the Twilight saga knows that this review won't consist of much. Twilight was the beginning, the best book, the start of something great. Or at least, it should have been. Breaking Dawn was the bitterly disappointing ending to the saga that had potential, but just didn't deliver. New Moon and Eclipse were the pointless, disappointing, utterly forgettable filler books in this tragedy sandwich. You know it's sad when, three days after I read this book, I couldn't immediately remember what it was about. I still don't remember much of what happened in it, aside from the fight scene towards the end. The only reason I remember said fight scene is because I'm still infuriated that Bella was able to act like such a spoiled, selfish little brat and somehow have fate reward her for it. When Edward and his family are preparing for battle, Bella has an emotional breakdown and decides she just can't live without Edward. So she asks him to stay out of the fight. For her. Internally, she feels terrible for requesting it, but she can't reconcile those feelings with the overwhelming fear of losing Edward. So she never takes it back. Edward, like the totally pussy-whipped doormat he's become (completely uncharacteristic of him considering his behavior in the first and second books), agrees. The explanation is that he feels so badly about leaving Bella for eight months (in the second book) that he can't refuse her anything. Even if it means leaving his family to fight, alone, against a sadistic, revenge-bent she-vamp whose only target is Edward's own precious little girlfriend. So he does just that. He leaves the werewolves and his family to fight alone while he and Bella camp out in the mountains. But wait! It's okay because the she-vamp has other plans. While she sends her army of newborn vamps to fight the Cullens (the ones who didn't allow some selfish bitch to talk them out of fighting, anyway) and the werewolves, *she* loops around to the mountains with her freshly-made lover-vamp to take Bella out while the others are preoccupied. It's a real good thing she asked Edward to stay out of the fight, otherwise he wouldn't have been on that mountain to defend her from Bonnie and Clyde Vampire. Please. Don't even get me started on Bella's other admirable traits. As the series progresses, she gets dumber, more selfish, and less empathetic. I hate this character. She's not the same character as the Bella in Twilight. Not even close. Her attitude and behavior make this book barely tolerable.",25,-0.9964,0.195,0.721,0.084,0.5515480895915679,NEGATIVE,1.0
49,3447566092,07/17/2020,3.0,"This is the book in which Bella discovers that sexual pleasure does exist... Just not for her... Because it's too dangerous according to Edward. Remember Edward? He's the control freak that threw her away like garbage ""for her own good"", but she still risked her life to save him.This is also the book where Bella knows what she wants, but acts like she's not sure, and hurts Jake because she's not mature enough to stop spending time with him and stop giving him false hope since she PERFECTLY KNOWS what he wants.So we have bachelor #1:-Control freak-Suicidal tendencies-Dangerous for your life-Could kill you anytime-Must always fight his instincs not to kill you-Most probably have a stick up his ass-Acts like a freaking prude afraid to break you if he touches you-You also would have to abandon your previous life and never talk to your family again if you choose him Or we have bachelor #2:-Sweet-Funny-Does not risk killing you at any given time-Is hot and would do anything for you-Would give you physical pleasure without hesitation-Would give you a steady and somewhat normal lifeEasy choice you say? Well not for Bella apparently, who managed to create one of the most frustrating and boring wannabe love-triangle I've read.Let's just say that 14 years old me would have give it 5 stars and present 26 years old me knows that this series is garbage, so let's just agree for 3 stars, for old time's sake... 🙄",25,0.6548,0.158,0.671,0.172,0.5450727513227512,NEGATIVE,1.0
50,1435195705,11/06/2015,4.0,"Eclipse is the third book from the Twilight Series and from my opinion the most complex in action and characters all-together. Comparing it to the first 2 ones, you can definitely see an evolution of the writing style and also of the plot. It was more alert, with a lot of things going on and a lot of connections were made between the previous books and this one. After all the issues between Edward and Bella dissipated, one question lingered: Will Bella accept to marry Edward? I know.. The question was popped suddenly at the end of New Moon and everybody was left hanging, wondering what Bella will answer. Of course, the romantic scene we all imagined will not happen very soon soon.. Bella is determined to marry Edward under the condition to be transformed into a vampire. From this point on, there will be a lot of discussion whether Bella will face this transformation now on after their wedding. They are both very stubborn and eventually somebody will give in. I will let you discover who it will be.Beside this romantic problem, bigger issued occur and they all have a name: Victoria. Yap, the villain vampire who wants revenge over her partner's death is out for our couple again, but this time it won't be smooth like in New Moon. Now thing get darker and more dangerous, because she is building an army of now-born and their destination is Forks. Victoria is keen on killing anyone who had to do with James death, and her obsession is Bella and Edward. Now, everybody has to work together to protect Bella, including the werewolves. I had so much fun reading the way they cooperated, and the way they managed to learn from each other. I enjoyed the harmony between both species, even if they were natural enemies. The fact that they stood together for a cause made me believe so much that they could actually co-exist and leave it all behind. The element that made me give this book 4 stars was the love triangle made of Bella-Edward-Jacob. If you thought New Moon was packed with tension and challenges, just wait until you read this one. Bella kind of annoyed me because I am Team Edward all the way and just couldn't understand why was she so confused between the 2 of them. Her actions and behavior were sometimes odd and let me believe that she was not very sure of her feelings as she said she was. If you love somebody you don't do the things you do, even if that person was there for you in a hard period. I understand that Edward left her vulnerable and that her relationship with Jacob healed her, but doing the things she did kind of made me look at her from another perspective.Edward and Jacob were very fun to read about, their constant arguments were both funny and kind of hot, because let's face it, not any girl nowadays has 2 extremely good looking guys fighting over her. I felt that Edward could again sacrifice his love for Bella if the situation demanded it, and that he was willing to face the possibility of letting Jacob be the one for her. Jacob on the other hand fought hard for Bella and until the last moment wanted to be the right man for her. You will just have to read the book to figure out Bella's choice:)In conclusion it was a good book, with a lot of intense moments and I will repeat my idea that the evolution in characters and plot was visible, in comparison with the rest of the books from the series.4 stars!For more reviews please check https://readwithloveblog.wordpress.com ",39,0.9197,0.101,0.786,0.113,0.4822989939353575,POSITIVE,0.9921
51,478161039,05/16/2017,2.0,"I admit I had some hope brewing after the second improved over the first, earning three stars in front of two, but...no. The third went backwards again. It keeps the slightly improved writing flow, but that's about it.The Bella-Edward obsession is back. While he isn't overdoing his eyebrows and shifting his mania moods every paragraph, and isn't even dis-likable anymore, Bella is the worst. She gets so mad at Jacob over a playful kiss that anyone else would have seen coming from a mile away, she hits him and unrealistically breaks her hand. She has this very bizarre worry about aging - why is turning 20 the end of the world? Why won't she compromise even a little with Edward and wait awhile? Her moaning about aging and waiting takes up a large part of the angst.The second annoying thing that makes no sense at all is she won't wait to turn into an immortal creature, despite Edward's warnings - but she is terrified of marriage because she thinks its wrong and embarrassing to marry right out of high school. Yeah, makes no sense.Then she starts harping on Edward not having sex with her before she changes because she's worried she'll change personalities later, but this is still worth a risk for her while marriage wasn't?She is dedicated enough to die for him, give up being human for him, but is scared when he talks about being engaged and refuses to wear his ring right now because it's too unsettling?She won't let him even buy her a birthday present (only homemade allowed), but she tricks and forces him on other things like not group fighting and not waiting to turn her? Bella really does have to be one of the most annoying characters ever. Seriously. The side characters don't even bother me now - Edward, Jacob, Alice, Charlie, etc. are fine - but the main character? Yikes.",23,-0.9878,0.187,0.699,0.113,0.4412068965517241,NEGATIVE,1.0
52,2321893438,03/19/2018,4.0,"This book shows the different shades of love.(view spoiler)[Bella hurts Edward by leaving with Jacob in his bike as she thinks that Edward is trying to control her.Edward hurts Bella by letting Jacob know that she has agreed to marry him just before the fight against Bella's wish and without her permission.Jacob hurts both Edward and Bella by making Bella kiss him by emotionally blackmailing her before leaving for the fight.Bella forces Edward to choose between staying with her and fighting alongside his family, although she feels more guilty than Edward about it. (hide spoiler)]All of them hurt each other, because, they love passionately and truly. True love is selfless, but also jealous.(view spoiler)[What I have liked most about the book is the fact that, in the end, Edward is ready to let Bella go to Jacob if she really wants it, seeing her hysterical crying. And, Bella goes along with Alice's elaborate planning of their marriage to make everyone happy, though she does not want it. (hide spoiler)]I have also loved the way Edward proposes Bella.This book shows the reality of love that hurts as well as sacrifices.",25,0.9667,0.107,0.708,0.184,0.6697368421052632,POSITIVE,0.9773
53,436568995,10/18/2012,3.0,"I swear, all these books might've gotten an extra half star if they all shed at least 200 pages. Sheesh!Onto book 4 at some point...",23,-0.126,0.064,0.936,0.0,0.2222222222222222,NEGATIVE,0.625
54,2569642202,11/01/2018,3.0,"I'm honestly not joking when I say that I'm Team Mike Newton all the way. He's better than either option in every regard. 1) He's there for you as a friend even when things get tough (unlike Edward and Jacob). 2) He's willing to put aside his wants when it's obvious that you do not feel the same way, and therefore keeps his friendships without making things weird, all without manipulating you into feeling bad that you don't like him romantically and threatening suicide if you don't make out with him (unlike Jacob). 3) He's mortal and normal and won't bring any kind of danger onto you, and also isn't too old or too young (unlike Edward and Jacob). Basically, there's nothing wrong with Mike Newton. He's the only normal option but Bella doesn't consider him for some reason.Besides all that, this book dragged. I was at the 50% mark hoping I was about to reach the climax. Most of that was because Jacob is the devil and Bella is too deluded to see that, but also because the order of events was so illogical and hard to follow that my suspended disbelief was precariously hanging over the ground, threatening to fall at any moment. I'm glad the movies changed stuff, keeping all the vital plot points but simplifying and correcting the random confusing crap, while also maintaining the fun ridiculousness without destroying all possible believability.I did shed a tear during Rosalie's tale, though.",24,-0.8489,0.147,0.734,0.118,0.592948717948718,NEGATIVE,0.9984
55,4042709469,06/05/2021,2.0,"""BELLA?""(Yo, hag!)Edward's soft creepy voice came from behind me. I turned to see him spring lightly up the porch steps, his hair windblown from running. He pulled me into his arms at once, just like he had in the parking lot, and kissed me again.This kiss frightened me. There was too much tension icy, too strong stinky an edge to the way his lips crushed mine - like he was afraid we had only so much time left to us that he'll have to spend the rest of his life with my nagging ass.As Seattle is ravaged by a string of mysterious obvious killings and a malicious vampire with common sense continues her quest for revenge, Bella once again as always finds herself surrounded by danger. In the midst of it all, she is forced to choose between her love obsession for Edward and her friendship lust with Jacob - knowing that her decision has the potential to ignite the ageless struggle between vampire disco ball and werewolf shirtless dog. With her graduation (surprise she passed) quickly approaching, Bella has one more decision to make: life or death be stupid or finally have some common sense?. But which is which?I'm too tired to write more. More review after finishing FSOF review!!!",22,-0.9729,0.176,0.74,0.083,0.5570512820512821,NEGATIVE,0.9267
56,2552464860,10/05/2018,4.0,"These audio books keep getting better and better! I'm really enjoying the added emotion the narrator is using in her voice.I was a little surprised when a male voice came through the speakers at the beginning. But when I heard it again in the Epilogue, I thought they were probably going to use that same male narrator for Jacob's POV in Breaking Dawn. Anyway, this audio book opened my eyes to how silly Bella can think and react to certain moments. It doesn't make me love the stories any less however, it does make me cringe when Bella is filled with self-loathing for other people's choices. ",22,0.849,0.03,0.841,0.129,0.4795068027210884,POSITIVE,0.9776
