,review_id,date,rating,text,num_likes,Vader_score,Vader_neg,Vader_neu,Vader_pos,TextBlob_sub,Flair_sent,Flair_conf
0,2200677739,06/17/2020,2.0,"This wasn’t really my cup of tea. Think I’ll stick to Joanne Harris’ thrillers in future. It was ok. That pretty much sums up my feelings toward this book. There were parts I liked - mainly the side characters like Armande, and her grandson Luc. I liked Josephine and her storyline. I didn’t particularly like either of the main characters and there was so much pettiness that is just wasn’t enjoyable and i found myself rushing just to finish. Vianne Rocher and her daughter Anouk have just moved to a small town and opened up a chocolate shop on the first week of Lent in a strong Catholic community. Naturally feathers are ruffled and a lot of the locals give Vianne a wide berth. However there are some that make it their business to give their opinion on Vianne and her way of living. Mainly the Priest and some of his more devout believers. Vianne doesn’t go to church, as is her right, but this doesn’t sit well with the community. At the same time she is quite open about her disregard for the others beliefs. I can see where both sides were coming from, and it made the whole thing uncomfortable. The priest is in the wrong, he sees Vianne as a threat to his congregation, he acts in a way he believes is right - but often frequently doubts his own path. Vianne is also pretty disrespectful. She has every right to live her life as she chooses and not be spoken down to because of it, but surely so do the believers? Unless they are being cruel of course, then they need standing up to. I don’t know, it wasn’t enjoyable and I read for enjoyment. I couldn’t relate to either side really - there were two major extremes shown. Plenty of good themes in here, but I would be lying if I said I’d recommend it. ",72,0.8074,0.079,0.8,0.12,0.5137159137159139,NEGATIVE,0.9995
1,20425691,04/17/2008,4.0,"Chocolate, crazy-fun old ladies, Bible thumpers learning to lighten up, French people, witchcraft, and sexy gypsies. Come on, say no to any of those things. I dare you. ",60,0.296,0.072,0.817,0.111,0.3999999999999999,POSITIVE,0.9998
2,1420635636,10/19/2015,4.0,"""Lansquenet-sous-Tannes, two hundred souls at most, no more than a blip on the fast road between Toulouse and Bordeaux. Blink once, and it's gone. One main street, a double row of dun-colored half-timbered houses leaning secretively together, a few laterals running parallel like the tines of a bent fork. A church, aggressively whitewashed, in a square of little shops. Farms scattered across the watchful land."" Magical and scrumptious, Chocolat is a thrilling delight for the senses. When Vianne Rocher and her imaginative daughter, Anouk, establish themselves and their chocolaterie in the small, French-Catholic town of Lansquenet, they are met with guarded curiosity and veiled hostility. As Vianne slowly begins to attract the townspeople with her winning combination of tantalizing chocolate creations and her warm friendship and unprejudiced acceptance, she sparks the wrath of the self-righteous and judgmental priest, Père Reynaud. Determined to rid the town of both the river gypsies as well as the influence of Vianne Rocher, Père Reynaud readies himself and his church for the battle between what he considers good versus evil. But, there is something quite incongruous and disturbing in his convictions. He loathes the members of his congregation: ""Sheep are not the docile, pleasant creatures of the pastoral idyll. Any countryman will tell you that. They are sly, occasionally vicious, pathologically stupid."" He is arrogant and overly confident: ""When Vianne Rocher sees the power of the church - my influence over every single soul in the community - then she will know she has lost."" Can Vianne and Père Reynaud exist side by side in this small community?The story alternates between the first person narration of Vianne and Père Reynaud, allowing the reader to become quite intimate with the innermost thoughts of these complex characters. With vivid imagery, an entertaining and eccentric cast of secondary characters, and an engaging storyline, author Joanne Harris has created a novel which satisfies not only your senses, but also your intellect. Don't let the backdrop of exquisite chocolates and other heavenly concoctions fool you into thinking there is nothing more to this novel. With its underlying themes of moral perplexities, Chocolat contains more than meets the eye. Note to potential reader: Prior to opening the pages of this book, I highly recommend that you indulge and stock up on a plentiful supply of superior chocolates to be consumed while reading. A last minute search for a leftover Hershey bar or chocolate kiss will leave you a bit disappointed. ",59,0.9794,0.066,0.8,0.135,0.5769470899470899,POSITIVE,0.9936
3,34711819,10/07/2008,4.0,"When Vianne Roche blows into Lansquenet-Sous-Tannes, a sleepy French town, on the tail of carnival she brings with her a touch of witchcraft and huge gobs of humanity. Accompanied by her daughter, Anouk, her imaginary pet rabbit, and a wealth of knowledge not only of how to make the finest confections, but how to see into people’s souls, she is destined to stir things up. The darkness to her light is the local priest, Francis Reynaud, who makes it his business to try to rid the town of this impure non-believer, and spoil her planned chocolate festival. Vianne’s humanity proves decisive for many in the town, Josephine, who finds the strength to leave her abusive spouse. Gaillume eventually learns to let his sick dog Charley move on. Vianne befriends Amande, an elder practitioner of Vianne’s arts, who welcomes the travelers when they arrive and are rejected by the bigots of the town. She is less successful with the dark Muscat, wife beater and perpetrator of even darker crimes. Most chapters tell Vianne’s story, but some are told through the eyes of Reynaud, as he speaks of his fear, desires and crimes to his comatose predecessor. This is a clear battle between the warmth of a secular or at least non-Christian humanity against the cold disapproval of the church. Harris has made her demons quite dark, but allows a glimmer of humanity to peep through. We have a sense, at least, of why they may have fallen so far from the path of truth. Vianne is sometimes a bit too quick to judge, and if she does indeed become aware of that the fact that the author allows her a flaw or two adds to her humanity. The book was engaging, magical, both literally in its subject matter and in the beauty of its telling. Joanne Harris can be found at her site",48,0.7941,0.094,0.786,0.12,0.5321946169772257,POSITIVE,0.999
4,2121402790,09/30/2017,4.0,"I loved the read. I had read the book as a child from the local library and now picking it up after many many years was a pure joy. I loved Lansquenet, the characters, the lovely prose; everything! Basically the story looms around chocolates being an indulgence and a sin and the local priest seeing Vianne and her chocolate shop as the evil that has come to break the lent and prayers of the townsfolk. The descriptions will make you yearn for chocolates and hot chocolate drinks. That’s a guarantee because I don’t even love chocolates that much. I had unbearable cravings.Strengths:-Atmospheric (you might want to bathe in chocolates)-Magical (oh, Lovely)-Strong characters (all of them touched my heart. They were written to perfection)-Themes of religion, superstition, prejudice towards gypsies, the idea of Home to those who are always on the run etcI had forgotten how the book was and the movie had imprinted itself in my thoughts. I didn’t know (or rather remember) both the stories were different. OH MY GOd!! WHYYY? I kept screaming in my head, ‘’ Joanne, follow the movie. FOLLOW the movie.’’ But yeah, nothing happened. Don’t get me wrong. I LOVED the book. I kept reading searching for A’s party because it is one of the BEST scenes in the movie. Ah! It isn’t there in the book. Roux? I refuse to believe that the gypsy’s story turns out the way it does in the book. Movie please?The book is good, the movie is good too. You might say the book is more realistic, but why don’t we have happy endings over warm chocolate drinks? Doesn’t that sound better?Blog | Instagram |  Twitter | Facebook",40,0.9713,0.052,0.814,0.133,0.5555555555555556,POSITIVE,0.992
5,1351704226,08/01/2015,1.0,"Having read and loved Five Quarters of the Orange

 by Joanne Harris, I was really looking forward to reading Chocolat. Unfortunalty this particular book just didnt suit me.I didn't enjoy the plot of the novel and the found the characters underdeveloped and no sense of time and place. I rarly rate a novel 1 star but I found nothing in this stroy to to keep me entertained and I felt like I was reading each chapter over and over. I did finish the book as I was waiting for something to happen that would redeem the novel but butI by the end I was left feeling very disappointed. Many of my friends have loved this book but it just didnt work for me. ",37,0.9568,0.059,0.744,0.197,0.5135416666666667,NEGATIVE,1.0
6,124335148,10/01/2010,2.0,"Let me start this review by saying I have never seen the film version of Chocolat. Therefore, I started reading this with no preconceived notions. (Well, no more than usual, anyway.)I liked Chocolat but there were several glaring annoyances that ruined it for me.I did not appreciate the ""chocolate lovers vs. churchgoers"" plot. Casting a priest in the role of the villain irritated me. (I echo the others who say this is overdone.) Even so, I think the priest could have been redeemed. If only he had worked through his guilt and developed a good sense of humour and humility. But, nooo... that would never do. Because religious figures can never have true faith. *rolls eyes*And the most unforgivable sin: I never really felt anything for the characters... No love or sympathy. Except maybe Guillaume. I liked him.Also, the moral of this book seemed to be: ""Indulge yourself! Do what feels right! (Even if you consequently die/get pregnant/shame yourself forever.)"" Yeah. I'm not really digging that moral.Yet, I could not dislike this book. It was strangely addicting. Reading it was like eating a confection you know is not very good when compared with something of a higher calibre, but you keep mindlessly eating it anyway though you're not sure why.Oh! Which reminds me: Don't read this book if you're on a diet. I literally craved chocolate the entire time I was reading.",33,0.2284,0.162,0.685,0.152,0.4982337107337107,NEGATIVE,1.0
7,1397222009,09/20/2015,4.0,"Yes, you are stuck: Juliette Binoche is Vianne Rocher, and you can't work your way around it, unless you've spent the past two decades under a rock. But, let's face it, she was at least appropriately cast, and you'll get through it.Beyond that, it turns out this novel is like a refreshing and delicious wind that blows in your direction right when you need it. And, naturally, by the end of the novel, you're ransacking your kitchen for chocolate.",33,0.9032,0.023,0.815,0.162,0.5232142857142857,POSITIVE,0.9821
8,1966604799,01/14/2018,5.0,"Chocolat is a contemporary novel with a few fantasy elements. I really liked the setting, which is one of most beautiful and immersive settings I've read about lately. This is the second time I have read the book. It was worth rereading, but not amazing enough for me to read it a third time, most likely.The beginning: We came on the wind of the carnival. A warm wind for February, laden with the hot greasy scents of frying pancakes and sausages and powdery-sweet waffles cooked on the hot plate right there by the roadside, with the confetti sleeting down collars and cuffs and rolling in the gutters like an idiot antidote to winter. There is a febrile excitement in the crowds that line the narrow main street, necks craning to catch sight of the crêpe-covered char with its trailing ribbons and paper rosettes. Anouk watches, eyes wide, a yellow ribbon in one hand and a toy trumpet in the other, from between a shopping basket and a sad brown dog. We have seen carnivals before, she and I; a procession of two hundred and fifty of the decorated chars in Paris last Mardi Gras, a hundred and eighty in New York, two dozen marching bands in Vienna, clowns on stilts, the Grosses Tetes with their lolling papier-mâché heads, drum majorettes with batons spinning and sparkling. But at six the world retains a special luster. A wooden cart, hastily decorated with gilt and crêpe and scenes from fairy tales. A dragon's head on a shield, Rapunzel in a woolen wig, a mermaid with a cellophane tail, a gingerbread house all icing and gilded cardboard, a witch in the doorway, waggling extravagant green fingernails at a group of silent children... At six it is possible to perceive subtleties that a year later are already out of reach. The plot:Vianne Rocher and her daughter Anouk move to the French village of Lansquenet, where Vianne sets up a chocolaterie called La Céleste Praline. When the book opens, it is Mardi Gras. They arrive in town during the carnival. The shop is on the square opposite the church and clashes with the old-fashioned town's strict observation of Lent.Vianne is the main point-of-view character, but Pere Reynaud, the local priest, who has a vendetta against Vianne, gets some chapters from his point of view. I also enjoyed the secondary characters.The magic:The magic is understated, but it is a bigger deal in the book than the film. The main character knows what each character's favorite chocolates or sweets are as soon as she meets them, because she can read their thoughts. Tarot cards play a role, although they may or may not actually reveal the future. The antagonist: Reynaud is great, and I don't think he's a cartoon villain. This is a gray hats vs white hats type of conflict. The film made the mayor the antagonist instead, so if you have only seen the movie you might want to check out the book version. The ending: The ending is bittersweet, but not too sad, and it leaves a few loose ends. In contrast, the film comes closer to tying things up in a neat little bow. (Softening the impact of a bittersweet ending is not exactly new in film adaptations, so I really should have expected it. Stardust by Neil Gaiman comes to mind.)",28,0.893,0.074,0.831,0.095,0.4288460510682733,NEGATIVE,0.7546
9,786994849,12/10/2013,4.0,"I enjoyed reading this book very much. A little bit of magic, good people, bad people, gypsies, little songs in French, an imaginary friend, love, loss, mystery and more chocolate drink than I could have imagined. The names of the candies made my mouth water. The story made me laugh at things a little girl can say it made me cry over an old man and his old dog. It made me think about what it means to hear someone say that they had lived a good life and how they wanted that life to end on their own terms.I loved the little French town, Lansquenet-sous-Tannes, that Vianne and her daughter Anouk found themselves in after the carnival was over. She was there to open a little candy shop. She called it La Celeste Praline Chocolaterie Artisanale.There are two first person narrators of this story. One is Vianne and the other is the priest, Monsieur Renynauld. Vianne tells the story to us, the reader, and the Monsieur tells his to someone called only ""mon pere"". I liked it. It added a mystery to the story, that slowly unfolded.It was a good story. A struggle between good and evil in a tiny little villiage that did not take well to outsiders.This was the first book that I have read by Joanne Harris. I am looking forward to reading many more. ",27,0.945,0.07,0.8,0.13,0.5275252525252526,POSITIVE,0.9994
10,1997857735,06/01/2017,4.0,"“Why can no one here think of anything but chocolates?” ― Joanne Harris, ChocolatThis book will be sure to make you crave some chocolate..or..baked goods at least. So have your appetite ready.Seriously, we all know the plot so no plot review on this one. I adored the book AND the film. I fell in love with the charming and quaint little village and wanted very much to live there. (And have some of their chocolate.) I think I liked the movie a wee bit more but that is only because this book is so VISUAL. It was delightful to see the village brought to life. (And looking at Johnny Depp did not hurt either!).If you have not read this, make some cocoa or something, curl up on a snowy day and get lost in this warm and luscious book about Chocolate and the village people who make it!",29,0.9831,0.043,0.762,0.194,0.649074074074074,POSITIVE,0.999
11,39138331,12/02/2008,4.0,Like so many people I read the book after I saw the movie. I can see why people would be upset with the book after seeing the movie - the book is a different story in many ways. I think the tone of the book threw me off more than anything. I have to say I really enjoyed both the book and the movie. I think it is rare to read a book and have it be almost verbatim what you experience in the movie (The Princess Bride is the only exception I can think of off the top of my head) so if I like a movie well enough to read the book I almost always have to take a deep breath and hope that the experience I had with the movie is not destroyed by the book. So to be able to walk away from the book and think that I would read more by Joanne Harris is a good thing. ,25,0.9485,0.016,0.851,0.133,0.6019230769230769,NEGATIVE,0.9532
12,164386435,04/29/2011,1.0,"I did not like this book. I didn't think the author developed the characters well enough that I could even tell them apart by half-way through. There was not enough for me to develop emphathy for anyone in the book except the guy with the little, old dog.I also have a problem with an author being so blatant about the axe they have to grind with any particular group. I thought the book was anti-religious and anti-Catholic, specifically. I am not of the thought or feeling that anyone has to be religious by any means, people can believe what they want. But when those of different belief systems have to put down others to make themselves feel wise or superior (ie, refer to religious people as those who believe in fairy tales), it is counter productive to the message that we should all be accepting of others' differences (as I thought was a main theme of the book), and turns the author and main character into hypocrites.",22,0.7839,0.036,0.881,0.083,0.4459259259259259,NEGATIVE,1.0
13,52469514,04/13/2009,5.0,"""I believe that being happy is the only important thing. Happiness. Simple as a glass of chocolate or torturous as the heart. Bitter. Sweet. Alive.""If you've watched the movie from a few years back and you've only decided just now to pick up the book where the movie was based on, prepare to be surprised (although in what way exactly, I leave it to you). I can hardly believe that a novel so richly packed with meaning could be so relatively short. Harris' prose here is at its finest, as we follow the narratives of Vianne, the free-spirited chocolate-creating witch, and Reynaud, the guilt-stricken oppressive village priest. Young widow Vianne Roche's mouthwatering bonbons, steaming mugs of liqueur-laced cocoa and flaky cream-filled patisserie don't earn her a warm welcome from the stern prelate of Lansquenet-sous-Tannes. In Francis Reynaud's zeal to enforce strict Lenten vows of self-denial, he regards his sybaritic neighbor with suspicion and disdain. It is Lent, the priest has decreed abstinence, deprivation. Yet, Vianne's shop is a ""red-and-gold confection,"" her window a proliferation of truffles, pralines, candied fruits, hazelnut clusters, candied rose petals, all there to tempt Reynaud's parishioners. He sees it as a disgrace, a degradation of the faith, and eventually preaches against Vianne from his pulpit.Undaunted, Vianne garners support from the town's eccentrics, chiefly Armande Voizin, the oldest living resident, a self-professed sorceress who senses in Vianne a kindred spirit. A fun-loving band of river gypsies arrives, and a colorful pageant unfurls.Each narrative is uniquely told, with personality quirks inherent to each, and each narrative can be subtly imperfect - Reynaud slowly descends into madness, as does his precise narrative; Vianne's fear of weakness and displacement causes her to falsely claim that she never cries, causes her to state a yearning to move on which does not exist, and causes her to doubt her own importance to her lover Roux - creating a tantalizing problem for the reader: do we believe Vianne or do we believe Roux and his actions? The problem is - like Vianne's chocolates - delicate and bitter-sweet, with possibilities abounding on either side.Beautifully drawn characters become very real. My favorites were Anouk, Vianne's utterly delightful child (not to be without her imaginary rabbit friend, Pantoufle); Guillaume who comes out of his shell after the death of his beloved dog, Charly; and of course Mme. Armande Voizin who was reunited with her grandson even under the close scrutiny of her self-important daughter. I was most touched in a jarring way of the domestic conflict between Josephine Muscat and that of her husband. I cheered for her when she finally found the inner strength to leave him for good and live her own life. ""Places all have their characters, and returning to a city you've lived before is like coming home to an old friend. No, places do not lose their identity, however far one travels. It is the heart that begins to erode after a time.""A surprising yet fitting denouement caps this deftly told tale of lust, greed and love. Francophiles will be drawn to the evocative descriptions of daily village life, while gourmands revel in the mouth-watering descriptions of chocolate preparation. ""Chocolat"" is a heart warming and enjoyable story. The only downfall: the intense chocolate cravings the whole time you read!Book Details: Title ChocolatAuthor Joanne Harris Reviewed By Purplycookie",21,0.9783,0.098,0.759,0.143,0.6261095238095239,POSITIVE,0.9741
14,460299843,11/20/2012,5.0,I dare anyone to read this novel and not hunger for something sweet.This is a wonderful tale of family and magic and hope. It is not your typical romance and well worth the time. You may find yourself wishing for a confection or two...before you've finished reading. Devlin,20,0.8988,0.051,0.652,0.297,0.65,POSITIVE,0.9993
15,281614398,10/09/2018,5.0,So much chocolate (in liquid form) was consumed during the reading of this book.,19,0.0,0.0,1.0,0.0,0.2,POSITIVE,0.6129
16,3198763390,02/20/2020,3.0,"Nomadic single mother Vianne Rocher, comes to the small French village of Lansquenet-sous-Tannes and opens up a sumptuously described chocolaterie during Lent, oh... and she might or might not be a witch! Her chocolaterie and presence in the village really upsets priest Francis Reynaud, and his supporters. Harris builds the suspense up to an inevitable confrontation.Harris writing really captures this French village and the chocolaterie so well at the start of this, so well indeed, that for me the bar was set so high, I found it difficult to get into the rest of the book. Definitely a book I'd love to re-read one day. 6 out of 12",18,0.908,0.044,0.807,0.149,0.423116883116883,POSITIVE,0.9962
17,3329408150,05/05/2021,5.0,"I loved this book. One of my comments I made as I got into it was that it was a book that I could sink into and that feeling continued throughout my read. It was a story of substance with a touch of magical realism. The ""winds"" bring Vianne Rocher & her daughter to a tight small French community whose lives revolve around the church. Their insulated lives makes them suspicious of others especially those who did not adhere to the teachings of the church or participate in the services. The story eventually pits the priest against Vianne( the two voices in the novel), not quite ""good vs evil"" but a tense battle of wills of an intolerant man against a non-judgmental woman who seeks to bring happiness and pleasure through her Chocolaterie to the townspeople. The timing of the opening of her shop during Lent, a time of fasting, and reflection, sets the stage for that battle. There are some stock characters but they fit nicely into the plot and move the story forward. I got invested in the peeling back of their lives. And what about the chocolates? Although chocolate abounds and are delicious in the descriptions making one's mouth water, it really is just the backdrop as the layers of the story unfold.Vianne's philosophy could probably be summed up in the following quote:  I believe that being happy is the only important thing. Happiness. Simple as a glass of chocolate or tortuous as the heart. Bitter. Sweet. Alive.  Hmm I think the Dalai Lama would approve!",18,0.9829,0.069,0.773,0.158,0.5663690476190476,POSITIVE,0.9999
18,3604032121,10/22/2020,4.0,"A small French village is changed from its conservative, anti outsider(particularly Gypsies in houseboats) by the arrival of a woman (Vianne) and her daughter who open a chocolate shop. Themes of acceptance, ageing, death and domestic violence. Told mostly from the point of view of Vianne, some chapters are from the priest Reynaud, who sees Vianne as a threat to the town. So while this book on the surface is a pleasant read (so much chocolate!) it has much darker undercurrents both in the towns history and the present. ",17,-0.8268,0.142,0.794,0.064,0.3185185185185186,POSITIVE,0.9912
19,2111391753,09/02/2017,3.0,I remembered that I did read this book a long time ago and cannot remember the actual date. I am not re-reading it.,17,0.0,0.0,1.0,0.0,0.25,NEGATIVE,1.0
