,review_id,date,rating,text,num_likes,Vader_score,Vader_neg,Vader_neu,Vader_pos,TextBlob_sub,Flair_sent,Flair_conf
43,1966381831,04/09/2017,2.0,"I saw the movie many years ago and this is one of those rare instances where I think that the movie was far better than the book. The constant repetitions of the same themes became rather tiresome. I also didn’t see any real plot. It was more a like a lengthy character study and I ended up not really caring for most of the characters anyway. I have to say that since I love food and also enjoy reading detailed descriptions about it, those parts were truly enjoyable. I also enjoyed the atmospheric description of being in a French country village, which I imagine it to be somewhat like this: ",7,0.9688,0.024,0.764,0.212,0.5004629629629629,NEGATIVE,1.0
44,2778821954,04/07/2019,4.0,A nice warm and cozy reread like a hot cup of chocolate. I had given it 3 stars back in 2019 but been meaning to reread it lately as I was sure I would enjoy it more and I definitely did. Right times right book. Been lucky with my choices oof pick me up books. Think I'm ready to read other less comfy now haha,8,0.9773,0.0,0.646,0.354,0.5491363211951448,POSITIVE,0.9971
45,3982628340,05/04/2021,3.0,"Country prompt challenge: FranceI've owned a physical copy for the longest time and so when the next round of Eurovisionathon came about, I knew that Chocolat was going to be on the reading pile for it. I did feel pleasantly surprised that the book is written in a diary format and alternating between characters. Set in a small town in France, a mother and young daughter arrive and set up a chocolate shop for the residents to enjoy. The shop's location is directly opposite the church and the Reverand there completely opposes the shop. The storyline also does revolve around family breakdowns, some discrimination between the traveling community and the town as well as a whole lot of chocolate. Even though this one was the middle of the road for me, I did end up placing a hold on book two in the series which I hope to read soon!",6,0.9151,0.0,0.9,0.1,0.3220779220779221,POSITIVE,0.9991
46,2068966336,07/22/2017,5.0,"""We came on the wind of the carnival. A warm wind for February, laden with the hot greasy scents of frying pancakes and sausages and powdery-sweet waffles cooked on the hot plate right there by the roadside, with the confetti sleeting down collars and cuffs and rolling in the gutters like an idiot antidote to winter. There is a febrile excitement in the crowds that line the narrow main street, necks craning to catch sight of the crêpe-covered char with its trailing ribbons and paper rosettes.""  And so is Lansquenet-sous-Tannes ' greeting to Vianne Roucher and her daughter, Anouk. She dares to open her Chocolat boutique right across from Père Reyaund's Church. And he tells his captive audience, his long-time mentor, ""We were right, père. This vindicates us completely. By striking at the three areas closest to us—the community, the church’s festivals, and now one of its holiest sacraments—she reveals herself at last. Her influence is pernicious and fast growing, seeding already into a dozen, two dozen, fertile minds."" But Vianne only wants to help people and spread a little magic and happiness upon the residents of the French village. ""Happiness. Simple as a glass of chocolate or tortuous as the heart. Bitter. Sweet. Alive."" Soon her shop becomes a safe haven for people to gather. Secrets are shared as well as some dreams and a few grievances. But all leave with their favorite treats.  But when Vianne announces an Easter Chocolat Festival, war is declared from Père Reyaund's point of view though they have been engaged in a quiet rivalry since she first came to the village. And Reyaund is the ""Black Man."" Who will win?  Reading many of the reviews here on Goodreads, many believe the novel is anti-Catholic. I do not. I see the struggle between Vianne and Reyaund as a conflict between those in Power and those the Powerful govern. Reyaund has imprinted HIS values and morals upon those dwelling in Lansquenet. And like the Powerful elite, he shows disdain for his flock. He doesn't know them, but yet HE knows what's best for them. Catholicism and his position as country priest just gives him the cover to do so. I loved the magic and magical transformations of the many characters that Vianne touched with her sweet confections. And Joanne Harris is a marvelous writer. I couldn't turn the pages fast enough. Each time I nibble on my favorite chocolate treat, I'll think of all of these wonderful characters, especially Vianne and Anouk. ",6,0.9957,0.029,0.796,0.176,0.5888402980239714,POSITIVE,0.9979
47,3891120580,03/20/2021,4.0,"This is a lovely small community story where a chocolate shop has the power to transform a small closed-minded community into a hopeful and positive place to live. I loved the decadence of chocolate in this book and the descriptions of Vianne's shop were beautiful. The story had subtle elements of magical realism which I really liked and thought worked well in the narrative. There were quite a few characters so there was a lack of depth to a lot of them but the book portrayed the village, where everyone knows each other's business, brilliantly and there was never a shortage of rumour or scandal among the residents to keep the plot interesting.This was the first Joanne Harris book I have read and certainly won't be the last. I would definitely like to try the other books in this series. ",6,0.9713,0.037,0.755,0.208,0.5564935064935065,POSITIVE,0.9997
48,179979370,06/27/2011,4.0,"21/7/2016This book is so beautifully written and so full of compelling and complex characters. On reread, I suspect a good part of the reason why the movie version is set in the 1950s is that it's easier to buy a nobleman having that much power over his small town community than it is to accept a priest having that much power over his small town community in the late 1990s. It may also have something to do with the domestic violence that takes place in one subplot of the book and the prejudice towards the itinerant population. Just put a nice, 1950s glow on it, and the audience will say ""Oh, that's just how things were back then!"" and move on. In short, the book is absolutely incredible, and I love all of these characters. But little niggling problems in the story (such as Vianne's conviction that (view spoiler)[Roux and Josephine are meant to be together (hide spoiler)] prevent me from giving it more than 4 stars. 14/1/2014I love this book so much. Like, ridiculous levels of love. It's not QUITE a five star book for reasons that I can't quite put my finger on, but I still think that pretty much everyone ever should read it. It's vastly different to the film of the same name - quite why the film makers decided to take a story set in the late 1990s featuring a feud between Vianne and the local priest and instead set it in the 1950s as a feud between Vianne and the local nobleman/mayor is beyond me - and by ""different"", I mean ""better"". The characters are full of life, the setting is marvelous, and every character is hiding a secret of some description. As the story unfolds, the secrets are gradually revealed, adding depth and colour to the characters' lives. I love Harris' writing style, the way she manages to make the mundane seem rich and slightly fantastical. So yeah. Go read it. Just don't expect it to be like the film...",6,0.9888,0.052,0.797,0.152,0.4998958333333333,POSITIVE,0.9999
49,674540780,07/22/2013,5.0,"This book falls somewhere between 5 stars and an eternal firmament of them. It is definitely the best book I've read this year, and I am only sorry that it has taken so many years to discover it. I saw the film a number of years ago and much as I liked it, I would have to say the book is better, if incredibly different. Don't expect quite the light hearted sense of the cinematic version, however, because you will be disappointed.In the film, Vianne's antagonist is the mayor; in the book, he is the village priest -- which creates a much more complex and layered exploration of the nature of personal freedom and religious choice than is evident in the film. Having been born, washed and baked in the RC faith, I recognized Vianne's struggle for what it was: not a repudiation of the faith, but a wider acceptance of the world, within a personal realm of belief. Once we start discounting other faiths, other belief systems, other races, the world deteriorates into chaos. If we allow ourselves to embrace the ""other"", then suddenly the world opens an infinite realm of possibilities. Harris handles this topic with incredible perspicuity and lucidity -- so beautifully managed, in fact, that she quite takes my breath away at times with her insight and wisdom.Quite apart from her sagacity on religion, the book is pure magic. It's a fairy tale, a fable, a morality play all in one. It delivers everything, including the (metaphorical) cherry on top. Harris's words are as delicious as all the mouth watering confections that she allows Vianne to create and I rolled each sentence around in my head with the same enjoyment as any of the villagers experienced her confections!",6,0.992,0.031,0.79,0.179,0.5408333333333333,POSITIVE,1.0
50,319721293,04/27/2012,4.0,"Chocolat is one of those books that you hear about. You hear how good it is. You’re familiar with the highly successful film. You’ve been meaning to read it for years but it just hasn’t happened yet. It kind of seems like maybe you’ll never get around to it.I finally got around to it and surprise of surprises I should never have waited. If all of Joanne Harris’ novels are as addictively engaging as Chocolat than I’ve found a new ‘must read’ author and I can’t tell how much nerdy joy that brings to me and my little life.Chocolat tells the story of a small French town in the 60’s and the two wayward travellers that make their influence known in the most repressed of communities.Vianne Rocher and her daughter, Anouk open a Chocolate store/café and the sleepy little religious town of Lansquenet is never quite the same.Chocolat is full of vivid characters and places. Harris’ descriptive writing made for a highly believable and wholly enjoyable experience. I adored the time spent with this little wonder of a book and am looking forward to getting lost in more of Harris’ charming prose in the future.",6,0.9809,0.035,0.806,0.158,0.5111818181818182,POSITIVE,0.9997
51,1949023623,04/17/2017,4.0,"This was a heroic story of one women wanting to set up a chocolate shop in a small town in Italy, with her daughter. I read this earlier in the year around Easter time and found the themes to be perfect for this. The descriptions of the chocolate shop were enchanting, making the reader thirst for the wonderful chocolate and imagine the creations in front of them. The background and descriptions of the French town were very well done, and created an atmosphere.Vianne Rocher’s journey through the book was well paced, each hurdle she encountered with was met with courage. Strong friendships were formed in the chocolate shop, and as Vianne became more familiar with the locals, they supported one another with warmth and kindness. My few criticisms, which knocked one star from my review were the characters, yet believable individually, were hard to keep track of as there were so many. Also there were a few less interesting parts to the book, and with the writing style being quite dense throughout, it made me have to concentrate more while reading. But overall it was a very charming read.4/5 stars",7,0.9906,0.015,0.778,0.206,0.4781746031746031,POSITIVE,0.9994
52,354109488,06/23/2012,5.0,"I must have read Chocolat quite a few times by now. It's an entrancing book: I didn't used to want to admit I'd read it, with its sensuality and femininity and the barely-there magic, but I now admit to it gladly -- I've read almost all of Joanne Harris' output, and I love the way she writes. There's something moreish about it, no matter what she's writing about. A lot of her stories have a similar sort of narrative arc; I wouldn't read too many of them back to back. But it's a comforting warm world to come to, with the domestic and yet magical delights of food front and centre, when you need somewhere.I actually read it this time with an astonishing amount of sympathy for Reynaud, perhaps prompted by the knowledge that there is now a third book in which he crops up again. I'm looking forward to reading that, either over the next few days or in July, when I'm (blech) recovering from my operation. Regardless, I do love the delicate magic of these books, more hinted at that stated outright, which somehow makes it more intoxicating.",6,0.9834,0.019,0.814,0.166,0.5,POSITIVE,0.9998
53,1474881786,12/20/2015,4.0,"This is one of those rare gems, like Harry Potter and the Philosopher's Stone, that achieves a level of parity between book and movie adaptation. There's a level of pragmatism and uncertainty and even a depth of madness here on the page that wouldn't have translated well onto film, but close enough that I lost the feeling of dread about half-way through and just enjoyed the story and the writing. I did deduct a star for completely stuffing up the medical details.Wordy review: http://jenn.booklikes.com/post/123939...",6,-0.4691,0.133,0.778,0.088,0.4999999999999999,POSITIVE,0.9999
54,2064982363,01/06/2018,5.0,"I cannot not to compare this book with chocolate. It's not any kind of chocolate. It's my favourite one, which I eat very slowly, letting it melt in my month, feeling notes of cinnamon. I want to eat more but then stop myself I don't know why. Maybe beacause I fear that if I eat more than one piece, it will become a common chocolate for me. I enjoy that little piece and when it's gone I just don't want to eat something else in order to feel the taste of it as longer as I can.This book is like a cinnamon chocolate for me.",6,0.2274,0.071,0.822,0.108,0.5599999999999999,POSITIVE,0.6523
55,17091829,03/05/2008,4.0,Really really good book. Not what I thought it would be. Usually I cringe to read a book that became a movie. But this book makes me want to either move to a small village in France or start making fancy candy. I also liked the narration shifts and alternating perspectives. It put a little edge and anticipation to the story. ,6,0.7722,0.0,0.852,0.148,0.51,POSITIVE,0.995
56,1075315143,10/08/2014,4.0,"This was a sweet (in more ways than one) book, a little magical, & a nice easy read. I never saw the movie but now I will make it a point to.",6,0.5543,0.0,0.798,0.202,0.7472222222222222,POSITIVE,0.9869
57,991069448,08/27/2017,4.0,Delicious character driven story with a touch of magic.,6,0.5719,0.0,0.654,0.346,1.0,POSITIVE,0.9997
58,2989984284,05/24/2021,2.0,Life is what you celebrate. All of it. Even its end.,5,0.5719,0.0,0.73,0.27,0.0,POSITIVE,0.9981
59,35965666,10/22/2008,4.0,"Bitter orange cracknel, apricot marzipan rolls, cerisette russe, white rum truffles, manon blac. crêpes, pain au chocolat, various types of couverture, and countless chocolate beverages, all fill the air of Vianne Rocher’s chocolate shop, La Celeste Praline. Vianne and her young daughter, Anouk, move to Lansquenet hoping to find themselves a permanent home. However, instead they find a criticizing community in which anything not considered normal is outcast. Chocolat, by Joanne Harris, occurs during the course of Lent and ends on Easter Sunday. The town’s priest, Francis Reynaud, refers to Vianne as his enemy, a witch, and as a bad influence on the residents of Lansquenet. Conflict between Reynaud and Rocher arises when she schedules a chocolate festival for Easter Day. Along the way Vianne is constantly unintentionally contradicting Reynaud by telling people that you should do what makes you happy, as a opposed to following the laws of the church. Joanne Harris, the author of Chocolat, has written many others books, such as Runemarks, Sleep, Pale Sister, Five Quarters of the Orange, The Evil Seed, and The Lollipop Shoes. 	There were several components that I enjoyed while reading the novel. The characterization, descriptions, and humor were among these components. The characterizations and descriptions make you feel like a real resident of Lansquenet. The descriptions greatly captivate the reader’s attention, especially when Vianne Rocher’s delectable sweets are described, or the lavish parties celebrated by Vianne Rocher, Armande Voizin, (the eldest, and most mischievous member of the community), the river gypsies, and other Lansquenet residents. Harris’s characterizations leave the reader feeling a sense of friendship and even love for the various characters of the novel. Even the distasteful acts of Reynaud, who is resented by the majority of the town, makes the reader yearn even more to understand him. Also, the mother daughter humor, the sly remarks from Armande, and the ironic ending of the novel add to its humorous entertainment. One thing that I disliked was the usage of French in parts of the story. Many of the recipes Vianne makes along with some words, names and phrases made portions of the novel difficult to understand. Overall there is only one main weakness in the novel. The element that I thought was especially weak is the general repetition. Chapters where Francis Reynaud is the narrator always discuss similar ideas and situations: his disapproval toward Vianne, Armande, and the river gypsies, his one-sided conversations with his previous priest, who is now in a comma, and his continuation of decreasing all pleasure in his life in order to live out the Lenten vow. The repetition of these things made the novel mildly boring during the middle. Harris could have added in more story lines from the characters’ lives to give the monotonous parts more excitement. By the end of the book you don’t want the book to be over, because that’s when the majority of the action occurs. I felt like the novel really puts you into the lives of the people of Lansquenet by showing repetition and routine. However, more action throughout the novel would have made this a much more entertaining read. Chocolat is a charming, humorous, entertaining tale about keeping, and mending basic human relationships, especially in times of struggle and grief. The conflict of religion versus happiness is also a main theme in the novel. The author does an incredible job with characterization, and description. Despite its weakness of redundancy, the novel is magical and fun to read, as well as presents key themes that play a role in everyday life. Anyone who enjoys reading books mixed with romance, comedy, and drama, will love this novel. It will widen your beliefs as well as your pallet! ",5,0.9962,0.079,0.748,0.173,0.5259595959595961,NEGATIVE,0.6546
60,2725458681,03/12/2019,5.0,"It's taken me twenty years to get around to reading Chocolat by Joanne Harris, and now that I've finished it I'm determined not to leave it as long to read the rest of the series.The story follows chocolatier Vianne Rocher as she arrives in the small Catholic town of Lansquenet with her daughter, Anouk, and sets about opening and running a chocolaterie during the period of Lent. At first the locals are cautious and in some cases even hostile towards Vianne, but slowly they begin to frequent her shop, much to the chagrin of the local priest, Père Francis Reynaud. Enflaming Père Reynauld's anger even further is the arrival of a group of river gypsies, who the locals see as trouble but who are openly welcomed by Vianne and the town's matriarch, Armande Voizin.The narrative alternates between Vianne and Reynaud's points of view, and quickly establishes the conflict between the staid rigidity of Reynaud's religious beliefs and Vianne's more whimsical openness. The Père sees Vianne and her chocolaterie as a force of evil, invading and corrupting his flock and his town, while Vianne herself simply wants to settle down with her daughter and spread a little happiness.There's a fair amount of magic in this book, but it's a subtle magic, a magic of the heart and the soul. Vianne is able to read her customers, identifying their favourite confection with almost absolute perfection. Through the narrative we learn that her mother was a card reader, constantly in fear of a shadowy figure known simply as the Black Man. This fear resulted in Vianne and her mother being constantly in motion, never staying in one place for long. Even after the death of her mother Vianne has felt the need to keep moving, dragging her daughter along behind her despite a desire to eventually settle down.Secrets also play a large part in the narrative. Père Reynauld's secrets darken his religious fervour and guide his conflict with Vianne. Then there's the mystery of Vianne's past, a subtle suggestion that perhaps her mother may have stolen a child and made that child her own. The townsfolk have their own secrets, some shameful, some upsetting. As Vianne gains the trust and friendship of the town some of those secrets are brought to the fore, bringing conflicts with them.Finally, this is a book about letting go. Letting go of the child you cherish, letting go of your preconceptions, letting go of anger and hatred. It's about letting those we love make their own decisions and forgiving those who hurt us, whether by choice or accident. And it's about letting go of those we love when it's their time to move on.It's a long time since I saw the movie so I can't make any sort of reasonable judgement between the two. What can I say with certainty is that this is a book full of emotion and one I will carry with me for a long time. A solid five stars.",5,-0.9847,0.143,0.759,0.098,0.4902695105820107,POSITIVE,0.9998
61,3846000676,04/29/2021,5.0,"This book is truly a sensory overload - for all the senses.On every page, you can see the delicate care with which the author has crafted each sentence, each word. The book makes you feel like delving into a storm of indulgence, of temptation, of tasting true freedom, and a thorough pampering of all the senses.At its heart,  Chocolat  is the story of Vianne Rocher and her daughter Anouk - how they have only known changed all their lives, moving from town to town, city to city in search of a place to call home. When they arrive at the village of Lansquenet, Vianne is travel-worn and weary of heart. She longs to finally stop moving and settle down, to give her daughter the gift of carefree childhood. Luckily for her, she opens a small chocolate shop and the village folk seems to love it.But there are other forces at play: the people who see Vianne as a threat to what Lansquenet stands for. They consider her an evil force out here to uproot their belief systems and leave them in ruins. Vianne can barely grasp the reality of it all, but her chocolate shop has managed to ruffle some very powerful feathers - of people who will stop at nothing to make her dreams come crashing down.Will Vianne be able to survive the ruthlessness of another village, another community? Or will she crumple under pressure and her little chocolate shop will go up in flames in front of her eyes? Read on to know more. But if I'm 100% honest,  Chocolat  isn’t a book that you read. It’s a book you try, test, then taste. ",5,0.952,0.059,0.821,0.12,0.6395424836601307,POSITIVE,0.8125
62,330843743,05/16/2012,1.0,"I was so bored by this book that I even made laudable sighs and yawns while reading. The characters are so stereotypical and Harris is trying so hard to create some sort of mysticism around chocolate and food, but to my mind she fails miserably. Not one single bit of saliva managed to press its way out from its glands in the passages of festivities and chocolate making. That is quite some feat. The book is a masterpiece in political correctness and I am not surprised that it was written in the 90s. The faiblesse for some sort of New Age spirituality, the dogmatic and hypocritical priest of the established religion all add up to a terribly outdated and charmless book, when read 15 years after its publication. ",5,-0.9201,0.172,0.751,0.077,0.6143831168831169,NEGATIVE,1.0
63,545538166,02/24/2013,4.0,"My second re-read of this wonderful magical book, but seems the old review never made it here. No matter, I am happy to start afresh. It's been decades since I read it for the first time.There is something magical, beautiful, and sensual about this book. And now that I have seen the movie, there are faces and images that go along with it. There is a subtle hint of magic, but its not overpowering. Its like the perfect slice of chocolate bliss.Chocolat is my series for this year (2021). I plan to read the next three sequels. I thought it would be the perfect light treat for the year.",5,0.9762,0.043,0.738,0.219,0.6952380952380952,POSITIVE,0.9999
64,141447540,01/17/2011,5.0,"Having seen the film a couple of times before reading this novel, I was slightly afraid my love of the film would impact on my experience of the novel. However, once I started turning the pages of this delightful tale, I rapidly forgot about the film and experienced the full magic of Chocolat in its novel form. Truly magical, and I don't even have a sweet tooth.I recently listed this novel in my 'top ten books that I've read and have stayed with me'. I love many of Joanne Harris' novels. She offers such a wide variety of stories, there is something for everyone.",5,0.9753,0.021,0.741,0.238,0.584375,POSITIVE,0.9999
