,review_id,date,rating,text,num_likes,Vader_score,Vader_neg,Vader_neu,Vader_pos,TextBlob_sub,Flair_sent,Flair_conf
82,38114025,11/18/2008,2.0,"This book was a bit of a disappointment for me. I LOVE the movie. Completely. Have watched it over and over again. So it was a bit weird to have the book be quite different from the movie. I really didn't enjoy how it flowed or the story in itself. The characters were so harsh and the weirdness of the priest being the antagonist was very strange for me. In this case, I TOTALLY enjoyed the movie more than the book. And to be honest, had I read the book first, I doubt I would have ever seen the movie.",4,-0.6685,0.185,0.704,0.111,0.5406410256410257,NEGATIVE,0.9999
83,423046769,01/16/2021,4.0,"Vianne Rocher along with her young daughter came to the small town of Larsquenet. She found an unoccupied shop and began making her exquisite chocolates. The towns people were ,mesmerized by the goodness of her chocolate products.She had a large window in her shop and behind it she had all her concoctions on display. Tempting young and old to try the delicious candies.When she arrived in the small town it was the beginning of Lent; which made chocolates her more of a temptation.Vianne had a special perception of all of her customers.It was a magical time.",5,0.8555,0.0,0.904,0.096,0.5833333333333334,POSITIVE,0.9995
84,1415786749,10/13/2015,5.0,"Don't know which is more delicious; this book or its subsequent movie. I swear this book literally tastes like chocolate. And I loved the split-narrative literary device that was used here as well.Not only you can taste this book, you can Eat the words.Eat Her.Inside the Atelier.Where she is never Gone. ",4,0.8805,0.021,0.795,0.184,0.5750000000000001,POSITIVE,0.9998
85,3529661482,09/25/2020,4.0,"The perfect easy read! Having read The Strawberry Thief recently, it was nice to go back to see where it all began and I loved seeing how the arrival of Vianne impacted on the villagers with her different attitude and outlook on life! The prejudices of others who can't and won't understand her ways and the lengths they go to turn others against her.",4,0.8264,0.08,0.739,0.18,0.6404761904761905,POSITIVE,0.9976
86,28474001,07/27/2008,2.0,"I liked the movie much better than the book, although it was interesting to see the differences, and helpful to visualize the characters and setting from the movie while reading. The music from the movie is amazing- one of my favorite soundtracks.",4,0.9517,0.0,0.66,0.34,0.74,POSITIVE,0.9987
87,1625593279,09/29/2016,4.0,"This is beautiful writing, whether you agree with the idea of subtle sorcery or not (and I do not), and whether you miss the joy of Christianity (as this book does) or not. Miss Harris is quite a talented artist.",4,0.9279,0.033,0.655,0.312,0.65,POSITIVE,0.9978
88,2730296848,02/27/2019,3.0,"Aussie Readers Feb 2019 Reading Challenge - Love is in the Air: A cover containing a food I love. I picked this book up at a second hand book shop a few years ago and just never got around to reading it (until now). I have only read one other Joanne Harris book (Five Quarters of the Orange), which I loved, so I did go into this with high expectations even though I had no idea what the story was about (I had seen the movie about 10 years ago, but apart from knowing Johnny Depp was in it, I couldn't remember a single thing about the story line). On the plus side, this book was beautifully written and Harris has a way of bringing food to life in her stories. She really has a gorgeous way of writing that provokes such amazing imagery (and sensation). However, I really struggled with the characters (and the lack of character development) in this one and the over the top stereotypes. I am definitely not a supporter of any organised religion (especially with what is going on in the Church around the world at the moment and in particular in Australia today), yet even I found the portrayal of the priest and his flock really painful to read and very much a caricature (and how is this supposed to be set in the 1990s? I initially thought it must have been late 1800s/early 1900s given the priest and the flock portrayal). I found the story a little dull with no real variation in pacing, the characters unlikable (except that gorgeous man and his beautiful dog) and the ending with (view spoiler)[Roux, the runaway priest and the ""lets move to another town"" to save more lives  (hide spoiler)] all a little absurd. Oh well. Can't please all the people all the time :-)",3,0.9844,0.076,0.767,0.157,0.5694568452380953,NEGATIVE,0.9999
89,114692030,08/01/2010,2.0,"An older review:It happens every year like clockwork. Exactly five weeks after the first day of school, my doorbell rings.Standing there on my front porch is an adorable little boy or girl holding a lunchpail-sized cardboard box, its handle soggy with nervous sweat. Stacked inside are bars of chocolate. The little urchin takes a deep breath, stares straight ahead in the region of my navel, and launches into a rehearsed speech: “Good-evening-sir-I’m-raising-money-for-my-school-by-selling-candy-bars-these-candy-bars-are-called-the-world’s-best-chocolates-would-you-like-to-buy-one-and-help-me-earn-prizes?”I smile, pat the tike on the head, and fork over five dollars for one candy bar (anything to help that kid win a Nintendo game system). I peel back the foil wrapping, inhale the cocoa aroma, take a bite…then spit it out. Blech! It’s like sinking my teeth into a stick of dietary margarine. Bland, chalky, bittersweet—the five-dollar candy bar isn’t worth the calories.I always end up giving the rest of “the world’s best chocolate” to my daughter, but even she makes those double-blech faces.I tell you this story to give you some idea of how I felt after reading Joanne Harris’ novel Chocolat. It’s got a nice foil wrapping and purports to bear a high literary price tag, but don’t be fooled—it’s nothing but empty calories.The story (which, incidentally, is forthcoming as a movie from Miramax Films) is one of those treacly sentimental fables that give all their characters signposts to carry around while cheerleading Big Messages like “Everyone has a dream, believe in yours” and “In the end, good hearts overcome bad people.”Chocolat (and, no, I’m not forgetting the “e”—it’s the French spelling of the word) is a magical realism novel which, unfortunately, has little of either. Stick with One Hundred Years of Solitude or that other cocoa-flavored novel, Like Water For Chocolate if that’s what you’re after.Harris certainly sets up an interesting conflict in her 306-page novel. An unmarried woman, Vianne Rocher, and her six-year-old daughter move to the tiny French town of Lansquenet to open up a chocolate shop. Unfortunately, it’s the Lenten season and the faithful folks of Lansquenet know they should resist the sinful pleasures of marzipan, candied pralines, truffles and (quelle horreur!) Nipples of Venus.But the townspeople can resist neither the charms of Vianne Rocher nor her sensuously good confections. It soon turns into a sweet holy war: Church vs. Chocolate. To the consternation of the parish priest, Pere Reynaud, the chocolate shop becomes a hubbub of activity—a place for gossips to congregate and a refuge for those seeking shelter from the cruelties of other cold-hearted citizens.When the earthy, free-spirited Vianne decides to hold a pagan Chocolate Festival on Easter Day, the righteous indignation of Pere Reynaud is whipped to a creamy frenzy. Vianne claims she does nothing more than “sell dreams, small comforts, sweet harmless temptations.” To the priest, however, the idea of a chocolate shop setting up business during “the traditional season of self-denial” is “deliberately perverse.” Pere Reynaud, it seems, has some definite sweet-tooth issues he needs to work out in therapy (or confession).Did I mention that the chocolaterie is located directly across the town square from the church? Subtlety is not Harris’ strong suit.What does work best in the novel is Harris’ ability to deliver rich, nougaty descriptions of the chocolate-making process. The author’s biography mentions the fact that she was raised in a sweetshop similar to the one here. She does a marvelous job of recreating the smells and tastes of warm chocolate. Here’s one instance, describing a particularly ornate window display:It is an amazement of riches, glace fruits and marzipan flowers and mountains of loose chocolates of all shapes and colors, and rabbits, ducks, hens, chicks, lambs, gazing out at me with merry-grave chocolate eyes like the terra-cotta armies of ancient China, and above it all a statue of a woman, graceful brown arms holding a sheaf of chocolate wheat, hair rippling. The detail is beautifully rendered, the hair added in a darker grade of chocolate, the eyes brushed on in white. The smell of chocolate is overwhelming, the rich fleshly scent of it that drags down the throat in an exquisite trail of sweetness.It’s hard to read that and not swoon. Diabetics are forewarned to proceed with caution through these pages.Unfortunately, Harris’ delicious syntax gets melted by some poor plot choices. There’s a parade of characters so large and shallow that it’s nearly impossible to form a bond with any of them except Vianne and Pere Reynaud. Most of the others all come from that Hollywood stock of Charming Eccentrics. Perhaps that’s why Miramax scooped up Chocolat—it’s got all those odd folks left over from films like Enchanted April, The Englishman Who Went Up a Hill But Came Down a Mountain and Il Postino.The novel is also hampered by shifts in verb tense which are unnecessary and distracting. There’s a sex scene late in the third act which is equally unnecessary and distracting. In fact, there’s so much cleverness and conceit pulling me out of the novel that I wished Ms. Harris had just relaxed, letting herself melt into the fable without forcing me to gag on those emotional stereotypes. It all became too cute and sweet for my tastes.I’m sure there are people who will really like Chocolat. I’m sure there will be readers who exclaim, “This would be perfect for Oprah!” I’m sure there will be those generous critics who compare her to Hawthorne, Hugo and other authors who wrote great fiction of moral and spiritual conflict. As for me, I found it as hard to swallow as an overpriced candy bar.So, this year when my doorbell rings, I won’t answer it. I’ve already had my fill of bad chocolate.",3,0.9991,0.079,0.728,0.194,0.5334638610182088,NEGATIVE,0.9929
90,4194433894,08/29/2021,2.0,"I've got mixed feelings about this book. On the plus side are the facts that it reads easy, creates a nice ambient happiness through the words and ties into a story that's quite simplistic in its construction. The minus points (for me) come from the lack of back stories (which means we don't know why a character behaves a certain way, we just have to accept things at face value) and the fantastical feel to many elements (which I'm not a big fan of).I wonder if I might have enjoyed this book if I had read it when I was younger. I have to say though that the descriptions of chocolate were mouth watering. Unfortunately it's not enough to make me want to turn the pages with anticipation. There's a nagging feeling in me that this book was a miss because of wrong timing. I can see how it might make for a pleasant feel-good read but it simply did not hit the spot with me.",4,0.7857,0.06,0.813,0.126,0.4674107142857143,NEGATIVE,0.9997
91,2673747534,09/20/2019,3.0,"After seeing the film a couple of times I was very interested in reading the book and to be completely honest, I think the film is more my style. Still I must say the story is intriguing, I just missed some of the romantic aspects which were in the film. ",3,0.7956,0.042,0.781,0.177,0.59,POSITIVE,0.5516
92,4235661123,09/24/2021,5.0,"I love it when a book sweeps in from nowhere and goes straight onto my favourite books of all time list. This gorgeously written, beautifully evocative novel takes place in rural France, where the wind blows Vianne and her daughter into the village. They set up a chocolate shop and slowly bring the village and it’s inhabitants back to life…I loved everything about this wonderful novel. It’s about love, found family, knowing yourself and the magic that comes from good food and good company. It made me laugh, it made me weep and it made want to read everything else that Harris has ever written. Highly recommended; I adored this one. ",6,0.9897,0.038,0.648,0.314,0.5693333333333331,POSITIVE,0.9997
93,2632577130,12/20/2018,,"(...)The book is very well-written: smooth, flowing with rich imagery that suits the subject of chocolate. The story is alternatingly told by Vianne and Father Reynaud, who have very different voices. This impressed me, because it adds to the experience of the story but must be very hard to write, changing style every chapter. The story has a host of colourful characters and the slow escalation of the old and new forces in Lansquenet are fascinating to read. I’m not surprised that the book was quickly turned into a film. It lends itself extremely well for that.It was just a shame that I didn’t like the two main characters, Vianne Rocher and Father Reynaud. The last one isn’t supposed to be likable, but Vianne is. But with all her kindness, she can be remarkably cruel. She enjoys making Father Reynaud uncomfortable and counts it as a victory every time she does something he disapproves of. Don’t get me wrong, he is not a nice man by any measure. He feels superior to his parishioners and likes the power he has over them. He likes to hold power over himself, too, priding himself on being as devout and sober as possible. He values regulations over love or compassion, which in my opinion is at odds with the Christian faith. When Joséphine Muscat leaves her abusive husband, he wants her to go back to him because of their marriage, while there is no reason to assume that the husband will ever be anything but a brute. Still, I don’t think you need to attack and ridicule the faith of the entire village to address the problems within it. Someone as free-spirited and open-minded as Vianne claims to be must see the good things faith and devotion can bring: hope, love, comfort, community. Instead, she sabotages church life and doesn’t stop until Father Reynaud is utterly humiliated.(...)The story’s criticism of the way Father Reynaud’s wields excessive social control over this little village is fair, he deserved to fall from his pedestal. The priest takes advantage of his holy position to exercise a disproportionate amount of power. But the book would have been better if there was some kind of redemption for the priest, showing that some compassion and joy could bring new life to a once strong but now rigid faith. After all, he is just a man, probably the only educated man in his village. It’s not so strange that he feels lonely or that he, as time passed, has started to look down upon his neighbours. He follows de traditions of the priests before him, especially looking up to his direct predecessor, who led the parish when Reynaud was a boy in the village himself. Perhaps all he needs is someone to challenge him to be better. But the story doesn’t give him a second chance. This is only part of the review written by the lovely Jo. Read the full review at Bookworms United ",3,0.9973,0.092,0.701,0.207,0.5922732037354678,POSITIVE,0.9836
94,4023788640,06/01/2021,5.0,"I put on a stone reading this book, ha ha! I thought that I knew this story, having seen the film years ago. But when I was lent one of the sequel books I realised that I would have to read Chocolat first.It is such a good story and I look forward to reading the next in the series.",3,0.7901,0.0,0.855,0.145,0.3666666666666667,POSITIVE,0.9997
95,1952791505,03/28/2017,5.0,"2021: What a busy time. I've hardly been reading anything at all because of so many changes in my life - the wind is certainly blowing, and sometimes nearly blowing me away. But I kept my annual commitment to re-read Chocolat and I am so very glad I did. It is like visiting an old friend where I can just sit back and listen and let them tell me all about themselves over again. I wasn't as attentive to any one part of the story, but just felt a warm comforting hug from reading this book I know so well again. 2020: This year I re-read Chocolat as the world completely upended as part of the global COVID-19 pandemic. I was much more attentive to the patterns of community and connection in this story. As humans we crave and require connection, and those connections are shifting. So food, and sharing food, instead of sharing physical space, is one way that we as humans are connecting currently. 2019: As a discipline through Lent I decided to re-read Chocolat by following the days of the entries in the book. This made the reading much more intentional than I usually practice. Because I've been re-reading this so many times I often zoom through quickly. This time, stretching it out over nearly 50 days helped me to note different portions of the story and realize some of the time lapses or rapidity of some activity. Still appreciated this book as a part of my annual Lenten practice. 2018: This is not the year for re-reading for me. Like Pride and Prejudice, this didn't pack the enjoyment that it has in other years. Still, it is certainly one of my favorite books ever - and re-reading, combined with re-watching the movie each year, is a wonderful discipline. 2017: This year's reading of Chocolate flew by as I read it on a spring break service trip to Houston, TX. Reading it was like visiting an old friend - I knew all of the tones and themes that would develop in the conversation, but I wasn't sure what would strike me the most about our time together this time around. This reading, I felt more empathy with the priest character who struggles to offer guidance to his congregation. Though he is miss-guided in his need to control the movement of the spirit and of the future, I can be sympathetic to his desire to see people invest in their faith more. This year I am also more anxious to re-read the two other books in the trilogy. 2015: I try to re-read Chocolat each year at Lent, and this year I finished it on Ash Wednesday, which felt appropriate. I've loved the film since it came out, and when I stumbled upon the book while re-shelving fiction at the Gale Borden library in Elgin, IL, I eagerly took it home and devoured it like a delicious bar of European chocolate. It is so different from the film in tone and plot. Yet the film captures the important sense that I pick up from the book; the only way to find true happiness is to know, accept and connect deeply to one another as humans. Harris writes characters that are enchanting, and I've found this to ring true through every one of her works. This year I've recommended Chocolat to our Society of Heroines book group, and am so glad for the enthusiastic interest it has sparked among a wide variety of my friends. This is certainly an old favorite that I've re-read, and will re-read many times over.",3,0.9991,0.027,0.762,0.21,0.5389321789321788,POSITIVE,0.994
96,16646030,02/28/2008,4.0,"The first is Chocolat by Joanne Harris. This book was given to me by Rebecca at our book club Christmas party book exchange. I was very excited to get it because I have been wanting to read it for a long time. I am a Francophile (I think that's the word) I love all things French. I took French in High School and at BYU. I have always wanted to go to France. I like French food. You get the idea. This book was a great armchair travel book. It takes place in a small village in France. It is filled with quirky, colorful, beret-wearing characters. The main character is a woman named Vianne. She and her small daughter come to a small rural village to start a new life. She opens a chocolate shop, charms the villagers, and ends up setting herself at odds with the local priest of the Catholic Church. He feels that she is decadence personified to say the least. Oh--did I mention that Vianne might have magical powers?? The plot thickens...or should I say the chocolate thickens!! Do not read this book if you are trying to lose weight. You will CRAVE chocolate!! Chocolate is truly the main character of this book. Thank goodness I read it when I was sick and nauseous. But even that didn't stop the chocolate craving. I roused myself from my sick bed and staggered into the kitchen to scarf down some Valentines candy. Did it taste good? No! Did I feel worse? Yes! But I was powerless against the subliminal--ok maybe not subliminal--very overt message to EAT CHOCOLATE NOW!! This was a book that left me warm and cozy. I felt like I had gone on a small jaunt to France and interacted with the local color.There were just a couple of things that I didn't like. There were three different story lines that I felt would've been really interesting to explore and would've given the book a few interesting twists. These story lines were mentioned and then dropped. That was too bad. But all in all I rate it Good. Actually VERY GOOD! A twist or turn would've given it an Excellent rating. But I really liked the book and recommend it to anyone who loves France, chocolate, and cozy reads. Thanks Rebecca!P.S. I have never seen the movie so I don't know how it compares.",3,0.994,0.05,0.778,0.172,0.4904308160974829,POSITIVE,0.6207
97,1498639153,01/06/2016,4.0,"Yes, I like Joanne Harris's work. It seems a shame that this book didn't have some tempting recipes at the end for those of us who drooled over Vianne's chocolate treats. ""Mmmmm."" ""What's forbidden always tastes better anyway,"" declared Armande, wiping froth from her mouth in satisfaction. ""But this""--she sipped again, greedily--""this is better than anything I remember, even from childhood. I bet there are ten thousand calories in here. More.""There is much to like here. Vianne is sort of an enchantress, provocative and a bit daring, but she uses her powers to make people happy. I would like to read more about her and her daughter, Anouk. But, Armande was my favorite character. I loved Armande's wit and her sassiness, and her determination to live life on her own terms, as well as (view spoiler)[how to spend her last birthday. (hide spoiler)].I could quibble with a few things. I really felt like this story should have taken place in the 1950's, or maybe the 60's. I'm not quite convinced that a priest would be threatened by a Chocolate Festival in more recent times. That said, I love the underlying essence of the story. You only live once, and a few pleasures along the way make life truly enjoyable. ",3,0.9941,0.045,0.704,0.251,0.496031746031746,POSITIVE,0.9983
98,56852651,05/21/2009,3.0,"Reading this book was a challenge because every time Harris began describing all of the various confections that her heroine, Vianne Rocher, was concocting like some alchemist of cacao, I had to put the book down and procure some sweets. Fortunately our friend works at a French patisserie and was able to help abate this impulse quite nicely.The main crux of the story surrounds the conflict between Vianne, daughter of a gypsy, ardent pagan and free-thinker, and the acetic priest of a small town. There's much back-and-forth about the holiness of austerity versus the sensual delight of living, which grows old very quickly. However, the descriptions of the food are so resplendent that I felt somewhat illicit in imagining them. This book is delicious through and through, though like the confections with which Vianne makes her living, you feel a little sick to your stomach if you binge too quickly on it.",3,0.9735,0.032,0.791,0.177,0.482454648526077,POSITIVE,0.9766
99,42201396,01/07/2009,4.0,"A really beautiful and sensual read. Not sexual, just filled with smells and tastes, wonderfully written that pull you into the world in a new and heady way. In most ways this is a normal book about people; their single mindedness, their self importance and their struggles to comprehend life outside their own bubbles. When Vivienne and her daughter come to town she brings a fresh breath of air, attitude and a way for people to come together - chocolate! The magic in this book is not just in the spices in the air or tastes on the tongue, but in the way that people learn to understand and live with each other, through simple shared delights. A pleasure to read and a book I would suggest to anyone who needs a little comfort in their lives. This book gives a good cuddle and feeling of wholeness at the end.",3,0.9789,0.011,0.805,0.184,0.6137827858416094,POSITIVE,0.9993
100,2087517282,10/31/2017,5.0,"This book is like a big warm hug. It is drenched in warmth and it left me with a smile. Having seen the movie and loving it, I was worried the book would disappoint. But it did not. Although the story is not exactly the same, it definitely gives the same feels and made me realise how good the movie adaptation is.I really enjoyed reading this book. The story is bittersweet, like some of the chocolates in Vianne’s chocolaterie. It is told from two perspectives, Vianne’s, as she moves into a small French village, and Reynaud’s. Reynaud is the village priest, who objects to all Vianne stands for in his mind.The author portrays the people of the village and their emotions wonderfully well and I could really feel the atmosphere of this small village.I loved it and I will definitely be looking for more books by this author.",3,0.9872,0.036,0.725,0.239,0.4131578947368421,POSITIVE,0.9988
