,review_id,date,rating,text,num_likes,Vader_score,Vader_neg,Vader_neu,Vader_pos,TextBlob_sub,Flair_sent,Flair_conf
20,3622965089,11/09/2020,5.0,"I saw the movie years ago before I read the book, which also first happened years ago. This is my first GR-era reading, though, and it was triggered by hearing my husband tell me about seeing the movie playing on a cable channel he gets. He thought it looked interesting so he settled down to watch, but promptly fell asleep. This is nothing new, but without me there to keep nudging him awake he missed the movie. After I teased him enough about that, I told him how I had the book and its sequel and that our chat made me want to re-read them both. I had to look up the name of the sequel and in doing that, I learned about the third and fourth titles that feature the same characters, so of course I had to order used copies of them and have a surprise binge read! It took me more time to read this book than I expected, but of course I was dealing with a most unusual and distracting week. Once I got to the point of turning off the live feeds and looking around to see the world was still intact, I did a happy dance and then immersed myself in the story of Vianne Rocher, her daughter Anouk, and the changes they bring to a small town in France.There are so many layers to this book. It is a story of a strong woman who has a different way of living her life. This fact creates fear in many people, especially those who approach life in a rigid, unforgiving manner. The local priest believes from the beginning that Vianne is an enemy of decency; he creates for himself the task of exposing her as the evil witch he believes her to be. But some of the people in the town allow themselves to become acquainted with Vianne. Many are afraid, and many others are suspicious merely because she is Not From There. But she is such a gentle, friendly soul.....and don't forget the chocolate! Just reading about the treats Vianne creates will drive a chocolate lover into raptures! And there is a grand dinner late in the book that rivals Babette's feast for luxuriousness.So we have a theme of The Other, which also includes the 'river people', those travelers who live on boats and don't feel the need for roots in any one spot. They live freely, and Vianne is like them, blowing in on one wind and out again on another. But will she stay in Lansquenet forever? Is it time to ignore the breezes that whisper about the need to move on? I imagine this is a question every rover faces at some point in their lives. Mother - daughter relationships, respect for the elderly, hypocrisy in organized religion (whether by those who preach it or those who pretend to live by its rules), and secrets that twist people tighter the longer they try to bury them, finding the courage to live your own life. These are a few other layers found in this rich book. I loved it and am more than ready to enjoy the rest of the series so I will quit babbling now and dive back into Vianne's life with The Girl With No Shadow. And yes, I have plenty of chocolate to savor while I read!",16,0.994,0.068,0.786,0.146,0.5264257154882156,POSITIVE,0.9945
21,1359901666,08/10/2015,5.0,"Chocolat was exactly the kind of novel I needed at the moment. I discarded books left and right, I was in the mood for something literary and after re-watching the movie - I settled on this one. I decided to savor it as one would a piece of chocolate, slowly, letting it melt into my mouth so that I could absorb the flavor better.The book is similar to the movie and yet very different - surprisingly I like both in their own way. It was a beautiful novel, full of magic, luscious descriptions of chocolate and other confections, and human relationships. It was hard to remember that this novel is set in modern times and not back in the day. I think I prefer the movie villain as the book's villain is a bit too typical. Father Francis is everything I despise about the church and the reason I no longer go, a man convinced of his own piety and holiness while blaming everyone for their sins without actually attempting to save them. I especially can't forgive him for Josephine. The bastard knew what her husband did to her and yet he still pleaded for her to go back to him, until the husband shows his colors in public. How's leaving your extremely abusive husband breaking the sanctity of marriage, but beating your wife acceptable? And of course, everyone in town knows and no one does anything until it's almost too late. Sanctimonious assholes.The novel ends on a bittersweet note and yet there is a promise of good things to come. And now I'm curious to read the next novel.",14,0.5514,0.105,0.782,0.114,0.503415435139573,POSITIVE,0.9999
22,4304782378,11/24/2021,4.0,"'Chocolat' was a treat to read at the beginning of this holiday season. The story itself concerns a single mother, Vianne Rocher, who comes with her six year old daughter to live in a small French village. She quickly opens a chocolaterie called 'La Celeste Praline' during Lent. Vianne herself is irreligious and gets into conflict with the village's priest, Father Renaud. He is a menacing presence throughout the book. Vianne is a free spirit whose mother raised her in a most unconventional way. Her mother was a believer in magic, tarot cards and spirits. Whether Vianne herself possesses some magical abilities is a question mark. To be sure, she is intuitive and sensitive. How she frees up many of the (repressed) villagers to lead happier lives becomes the crux of the story.French words and atmosphere permeate the novel. I soaked these in, while enjoying the sights and smells of Vianne's candy store. Now, having finished the story, I'd like to indulge in a box of artisan chocolates!PBT note: This book fits the tag for First in a Series.",14,0.9748,0.012,0.831,0.157,0.5835317460317461,POSITIVE,0.9997
23,2993564711,07/22/2020,4.0,"I very much enjoyed this decedent novel by Joanne Harris. A single mother moves into a sleepy french village, opening a chocolate shop during Lent, instantly inviting ire from the village priest. The two develop a rivalry in the build up to Easter Sunday which the village quickly split between the pious and those who welcome the break from tradition.I've always like Joanne Harris, and I am surprised it took me so long to read her most famous book. Once again she doesn't disappoint in crafting great characters. I actually found myself liking the priest although I know we aren't meant to. I think it is natural to feel threatened when your whole way of life seems threatened.I'm excited to see what happens next with Vivienne ",14,0.9737,0.022,0.763,0.215,0.4988795518207283,POSITIVE,0.9996
24,15883798,02/20/2008,3.0,"I liked the style, alternating chapters narrated by the heroine,chocolate shop owner Vianne Rocher, and her nemesis, the village priest. The book creates charming images of creativity and sensitivity on the part of Vianne, contrasted with dark images of guilt and rigidity on the part of the priest. Free spirits versus conforming traditionalists. Love and friendship versus control and manipulation. Color and joie de vivre versus blackness and regret. Hints of deeper mystery in the past. ",13,0.9313,0.093,0.677,0.23,0.6416666666666667,POSITIVE,1.0
25,4463939011,01/25/2022,4.0,"When I was reading ""The Eighth Life"" by Nino Haratischwili last year, I was thinking about this book all the time. ♡",12,0.0,0.0,1.0,0.0,0.0666666666666666,POSITIVE,0.9162
26,2597924392,11/18/2018,4.0,"4.5 starsWarning: do not read this book if you’re hungry and have no delicious chocolate in the house! Sorry, had to get the practicalities out of the way first before I tell you how amazing and sensuous this book is (and that’s sensuous as in relating or affecting the senses, and not sexually gratifying - although it is a bit saucy at times).Chocolat is a wonderfully atmospheric story that’s sprinkled with just a little bit of magic and occasionally hinting at a darker underbelly... Essentially it’s the perfect read to get lost in on a chilly winter’s afternoon, as you enter Vianne’s chocolaterie and become enveloped in a warm, sugary, vanilla-scented atmosphere... sorry, just made myself hungry..Vianne and her daughter Anouk live a nomadic lifestyle, wandering through countries just like Vianne and her mother did before - but what are they running from? Perhaps a shadowy man who keeps appearing in their tarot deck, but it won’t prove so easy to escape him..I loved how Harris managed to walk the fine line between absorbing storytelling and whimsical atmosphere with more serious themes and darker tones - it’s not a frivolous read but still an enjoyable one. Plus her characterisation makes for fun reading - I’m a sucker for a feisty old lady character, and Armande is the epitome of that!.If you’re looking for a delicious read with a touch of magic, look no further!",16,0.9832,0.066,0.763,0.171,0.6566091954022988,POSITIVE,0.9984
27,52895259,04/16/2009,4.0,"Joanne Harris made me long to move to Europe. More fantasizing about small town, rural life. And the descriptions of the chocolate left me dreaming about rose creams, amaretto, pain au chocolat...why is it that these books that leave me hungry and dissatisfied are some of my favorites? Really. This book is full of luscious sentences, beautiful descriptions, and alluring personalities. It's different from the movie - but both have the same spirit of magical glamor. And both make me need to go get a truffle. ",11,0.765,0.054,0.82,0.126,0.4770833333333333,POSITIVE,0.9976
28,2951409326,12/16/2019,3.0,"3 Cosy StarsThere are a lot of intricate and interweaving strands in this book. The pacing is gentle but it works.I can see myself picking this up again at some point.I overall really really like the movie, but the depiction and character formation of the priest in the book is one I prefer to the movie depiction. The tone of the book is drastically different to the movie.99p on Amazon 16th December 2019",11,0.813,0.0,0.875,0.125,0.4,NEGATIVE,0.9932
29,513580120,01/21/2013,4.0,"I enjoyed the novel. Completely different than the movie. I liked both, for different reasons. The book was a lot darker, with beautiful imagery. The movie had Johnny Depp. ",11,0.9062,0.0,0.641,0.359,0.74,POSITIVE,0.95
30,82378847,12/28/2009,4.0,"I probably would have had a different opinion of the book had I read it before I saw the movie but...I liked the movie as well as the book for the courage it portrays in a fight against prejudices. There is so much of racism in the World today, that Vianne's fight for the Gypsies to be accepted in that little town comes as a breath of fresh, heady air, much like Vianne herself.I also liked the idea of good fun in a very tight, moralistic society, the entire town seemed to have let their hair down and had fun. Good food, lots of music and dancing and tons of Chocolate too. It was as if on that Easter the town had renewed itself. There is always a catalyst on such occasions and Vianne was the flute of champagne in that uptight little town, opening a lot of minds and sweeping away the cobwebsWhat a beautiful book.",10,0.9603,0.083,0.716,0.201,0.4991363211951446,POSITIVE,0.9997
31,49481780,03/16/2009,3.0,"Chocolat was good for the sort of fluffy, non-literary sort of book that it is. Vianne, who is a witch of sorts, arrives with her young daughter in a small French town and opens a chocolate shop. Her sensual, outsider ways began to change the lives of the townspeople and invokes the ire of the local priest. This is an enjoyable, light read, but one thing that confused me was when the novel was taking place. I remember reading a part about someone watching videos, but the idea of a priest being upset over people eating chocolate seems so bizarrely anachronistic that I assumed it couldn't be set anywhere near modern times. I suppose they couldn't have made a film if Vianne had come to town to open up a porno shop.",10,-0.3071,0.062,0.886,0.052,0.4307692307692307,NEGATIVE,0.9936
32,3507749017,08/30/2020,4.0,"""Evil wears a winning smile and bright colors. When I was a child, I used to listen to the story of the gingerbread house, of the witch who tempted little children in and ate them. I look at her shop, all wrapped in shinning papers like a present waiting to be unwrapped, and I wonder how many people, how many souls, she has already tempted beyond redemption"". A book about less grandiose magic, the magic of acceptance and simple pleasure, layered with the always over-the-top politics of a too small town. Here some of the colder rules of Christianity are inspected, without cursing it's virtues, while the simplicity of Paganism is allowed to shine. Harris has an excellent way with words, even if I felt the ending was a little open to my taste.",10,0.9134,0.063,0.786,0.151,0.5866946778711485,POSITIVE,0.9992
33,548414711,02/27/2013,4.0,"This is a bilingual review.In all honesty, the only reason I ever bought this book was because Johnny Depp is in the movie, and I have this thing where I collect books that have him on the cover. Although I don’t really remember the movie that well, the faded memory is an overall nice, magical and chocolaty one. I’ve been meaning to read the book for years, though for some reason I expected that the book would not be to my liking and that it would somehow spoil the whole Chocolat experience for me. I can now say that I was very pleasantly surprised—this was a very easy read, filled with an overall magical atmosphere and lots of chocolaty dirty talk. You should probably want to have some chocolate or candies around you while reading it.------------------------------------------------Като цяло единствената причина, поради която си купих книгата, бе факта, че Джони Деп участва във филма и че имам влечение да колекционирам книги, който имат негов образ на корицата. Гледах филма доста отдавна, споменът ми за него е вече доста избледнял, но като цяло чувството, което е оставил у мен, е приятно и магично. Книгата я купих може би преди поне 3 години, и отдавна искам да я прочета, въпреки че малко се притеснявах, че няма да ми хареса толкова, колкото филма. За моя радост бях приятно изненадана—чете се доста лесно и ти създава една магична шоколадова атмосфера. Бих препоръчала да се заредите с шоколад и сладкиши, когато е я четете. Да има, че рязко може да ви се дояде.",10,0.9298,0.012,0.912,0.076,0.6692307692307693,NEGATIVE,0.9815
34,2540369318,10/04/2018,5.0,"4.5 STARS *mild spoilers*Chocolat was an absolutely wonderful tale of a mother who decides to settle down with her (adorable) kid in the town of Lansquenet, and start up a chocolate business. This book is sooooo cute and a major must read for fans of magic, acceptance and, of course, chocolate!Vianne Rocher used to constantly travel around different places with her mother when she was younger, so she’s now decided to settle down with her little girl (Anouk) to try and make sure that Anouk doesn’t have the same troubled upbringing. When Vianne starts up La Celeste Praline, a chocolate cafe and shop, opposite the church, Father Reynaud isn’t happy. And when Vianne plans an Easter festival over (wait for it) Easter (wow I know!) Reynaud decides that he must turn the community against chocolate. After all, Church, not Chocolate! Chocolat switches from the POV of Vianne to the POV of Father Reynaud. Throughout the book Vianne manages to set people to rest and help them move on, show people that they deserve better and finally teach Anouk to make real friends. This amazing book is full of lies, mischief and beliefs, and how these things can drive people apart and bring them together. It also has death, sex and physical abuse, so it isn’t all light and fluffy, but the majority of the book is reasonably relaxed and even the death is simple and sweet.",10,0.8995,0.062,0.822,0.116,0.5905172413793104,POSITIVE,0.9998
35,3461985534,07/25/2020,5.0,"This is one of those novels that make you wish you could open a page and step right into the story.Vianne opens a chocolate shop in an adorable French town and begins getting to know her new neighbors. Vianne specializes in discerning just the perfect chocolate to fit the mood of each customer. It's been said that chocolate is the food of the gods and it certainly seems true in the case of Vianne's confections. Town members who visit her shop come away with a new zest for life and happiness that seems unexplainable, but they don't care - they love their new joie de vivre.Not only a great, absorbing story, but Harris describes the candies in a fair amount of detail, which inspires a longing to step into her shop, if only just for a moment.",9,0.9179,0.061,0.772,0.167,0.6344877344877343,POSITIVE,0.9998
36,1931507478,03/06/2017,5.0,A Lenten Easter treat. I like the way the author puts words together.,9,0.6369,0.0,0.634,0.366,0.0,POSITIVE,0.9963
37,3155007456,10/21/2021,5.0,Review to come. Because I don't know how to put into words how this story makes me feel or how I feel about it.,8,0.0,0.0,1.0,0.0,0.0,POSITIVE,0.9984
38,1306197374,06/12/2015,3.0,"Food porn at its best, Chocolat is magical, mischievous and original… but not nearly as good as I remember it. Everything the novel falls short of is portrayed beautifully in the exquisite 2000 film adaptation. (And… Johnny Depp. Say no to that, I dare you!) Although the novel is immersive and atmospheric, the film enhances the ambience and narrative into a much more compelling piece. Joanne Harris' contemporary depiction was usurped in favour of a charming 60s setting - a pivotal decision, I think. Harris disclosed that she was warned the novel was “too old fashioned” to sell, and I completely agree on the old fashioned bit; I struggled to contextualise this. The language and the plot itself felt archaic and I was completely convinced it was set in the 1950s, maybe the 60s - until microwavable pizza (yeuch) made an appearance. On a more elemental level, the film adaptation also contextualises both Vianne herself and the magical realism. If you can contextualise magical realism, that is. In the novel, Vianne’s backstory is ambiguous and left conveniently hazy whereas the adaptation meant the notion of her lifestyle made some sense. Don’t get me wrong, I like a bit of ambiguity, but unless it’s Heathcliff, I need some background knowledge on a character.I also don’t appreciate how polarising this was: Catholicism vs. Paganism. The Church was very obviously made out to be the villain of the story whereas everybody else revered Vianne, if only for her optimism and whimsical morals. Why not live on every whim and desire, take every indulgence, succumb to every desire... Look, I’d love to, honey - but the world doesn’t work like that. Whereas the glorious, free-spirited, airy fairy Vianne is the stereotype of optimism, the straitlaced, controlling priest’s POV was very, very priest-y, almost laughably so. I felt like I was reading propaganda in that sense.But the prose is beautiful. I have never gotten so hot and bothered reading descriptions of chocolate and pastries. Oh my. The quality of Chocolat for me lies in the superficial - this is a sensuous piece that leaves the senses reeling. Stock up on some good quality chocolate before you this a go - Cadbury and Hershey’s will feel very compromised in the aftermath.",9,0.9958,0.082,0.712,0.206,0.5865656565656567,POSITIVE,0.9852
39,2039767073,06/25/2017,5.0,"My kind of bookA charming heroineCriticism of strict religion practice ….. In this case the catholic church with its corruption, hypocrisy, lies, and prejudices.Inspiring descriptions of food, Chocolate and many other desserts.Anti wife beating.Some magic …. Or magic realismOh yes, the good guys win at the end.Vianne Rocher is a single mother of Anouk, and arrives to a rural conservative French village and opens a chocolate shop. She befriends a few of the villagers and some more oppose her and her life style.She promotes many good values , like opposing wife beating, opposing discrimination of minorities and outsiders, and generally shows the village that there is a better way than their old religious bigotry way. The more conservative and religious people of the village, leaded by the priest, oppose her and what she represents and get at her by trying to run her out of business and by using their children to socially isolate her daughter. Some of them consider her a witch and some oppose her life style or actions.Cute, refreshing and entertaining.",8,0.9607,0.052,0.794,0.153,0.4702380952380952,POSITIVE,0.9998
40,2424390363,06/14/2018,," Quite a few years ago, I had read one of Joanne Harris’ fantasy books ‘Runemarks; then, much more recently, I had enjoyed ‘Different’ and ‘Gentlemen and Players’ – both books set in schools. Joanne Harris was once a teacher and she completely nails that world in her fiction. I was a teacher too, so I should know. 	I knew about ‘Chocolat’ because that was her really big success, the book most people probably associate her with. But I had never got past the title. It had never seemed to me a book that I would want to read. I mean a book about chocolate! You must be joking!	I was so wrong. It is a great book and much closer to my favourite genres than I realised. A woman opens a shop selling chocolate. The local priest does not approve. There will be conflict, perhaps danger. But the woman is a witch. Not a fierce witch with blades and snippy scissors like my Grimalkin; a modern witch, subtle in her deployment of female power. 	No spoilers here. You will enjoy this book whether you like chocolate or not!",8,0.6399,0.106,0.771,0.123,0.3896929824561404,NEGATIVE,0.6504
41,2328790941,02/28/2021,4.0,"I've been meaning to read this book since watching the delightful movie some 20 years ago, but never seemed to get around to it. I've owned at least 2 copies of the book, and was fortunate enough to see Joanne Harris speak at the Ottawa Writer's Festival in 2010, where she signed one of them for me.Anyway, having just finished George Simenon's brutal 'The Snow Was Dirty', I thought 'Chocolat' would be the perfect antidote, with it's powerful message of love, unity, and compassion, all wrapped up in a delicious chocolate coated swirl. However, I conveniently forgot about the less desirable elements of the story: domestic abuse, the intolerance of the catholic priest (who views pretty much everything and everyone as an affront to himself and his religion), the petty close-minded villagers who use their religion as a means of subjugating others, and the ongoing destructive discrimination against the gypsies.Every story obviously needs conflict and Chocolat is no exception, but I found it surprisingly stressful in several places. Although I hasten to add that's more about my mental state right now as we endure Pandemic Year 2. There were a few times where it was reminiscent of watching something scary as a kid, and peeking out at the television from behind the safety of a cushion (I'm looking at you old Doctor Who!). Unfortunately, reading doesn't exactly lend itself to that approach ;) Long story short, Chocolat is a beautiful and wonderfully written tale. The book overflows with memorable characters, and I dare anyone to read it and NOT fall in love with Vianne Rocher. I firmly believe most people's lives would benefit by having someone like her in them. There are lots of uplifting and lovely moments to counteract the small minded bigotry and intolerance, and it's both heartwarming and life-affirming. I had a tricky time figuring out when it was located - I think it's based in 1995, but it feels significantly earlier. That is, I wouldn't have argued if someone had told me the events occurred in the 50's. Not that it really matters since the story is essentially timeless.I definitely need to re-watch the movie now :)",8,0.9958,0.087,0.698,0.215,0.5756084656084656,POSITIVE,0.997
42,1901342356,08/27/2018,5.0,"This book had been on my TBR for quite a long time, but now that I finally read it I can safely say that I've found a new favourite. I absolutely loved reading Chocolat and although it contained some magical elements, it was still so very realistic! I loved Harris's descriptions of the characters, surroundings and of course the chocolate. While reading it, it felt like I gained at least 10 kgs from only reading about chocolate. I could just almost smell and taste it - it definitely made me crave those delicious hot chocolate drinks! Besides the chocolate the characters were all very well thought through, and I came to love them all. And those that I didn't end up loving, were still characters I was very curious about and wanted to read more about! As a child, me and my family went on holiday to small French villages a lot and, in my opinion, this book just described it perfectly. The small old houses, the squares, the flowers, the nature and the small shops with their breads and sweets. All I want to do now is hop into the car and drive to France! This book is the first one in a trilogy and I can't wait to read the second book and get to know more about all the characters and their lives! And of course, the film with bae Johnny Depp is also waiting for me ...",7,0.9959,0.015,0.766,0.219,0.582267115600449,POSITIVE,0.9999
