,review_id,date,rating,text,num_likes,Vader_score,Vader_neg,Vader_neu,Vader_pos,TextBlob_sub,Flair_sent,Flair_conf
0,502577890,01/10/2013,4.0,"I was given Clarkson's three-book pack a couple of Christmases ago, and this is the only one of the trio I finished. Clarkson is not an especially strong writer, his all-flash, no-substance writing style becoming grating after a while... except here, where it's softened by the genuine love Jeremy has for his subject. The grown man's engineering nous writes in locked step with his childlike sense of wonder, and you can't help smiling to yourself and thinking, ""Yeah... that's right!"" as he describes your favourite machines. Pick it up for a domestic flight and you'll barely feel the plane touch down at the other end, and you'll wander through the terminal basking in the warm glow of human accomplishment.",4,-0.3069,0.076,0.875,0.049,0.4909951159951158,POSITIVE,0.9775
1,1061460370,09/22/2014,4.0,"A mix of science, technology, history, and British humour? Count me in!",4,0.5255,0.0,0.747,0.253,0.0,POSITIVE,0.9997
2,68305281,08/21/2009,3.0,"Clarkson does something important with ideas. He throws them together, blends them and makes sure someone is being offended. I like him.Here he argues that in a fight between the Enterprise, Stingray, Thunderbird 2 and the Millennium Falcon, the Falcon would win. Well this is important stuff and we need get to the bottom of it.",2,0.7269,0.11,0.672,0.218,0.8222222222222222,POSITIVE,0.9999
3,3294786034,04/22/2020,3.0,"I never thought in a million years I would enjoy this book, but I truly liked learning more of all the history behind hoover dam, Rolls Royce and the AK 47. I love Jeremy's warped sense of humor.",0,0.9517,0.0,0.622,0.378,0.62,POSITIVE,0.9952
4,2629355512,12/18/2018,3.0,"Starts off good and very funny, but eventually gets rather boring. Probably better to read one chapter at a time than read the whole book in a day...",0,0.6055,0.09,0.67,0.24,0.7,NEGATIVE,0.9993
5,41269459,12/30/2008,4.0,"I like Clarkson. You may not. If you do, you've probably read it already. If you don't, there's no way you'll even pick it up - not with his increasingly lumpy face on the jacket. Read it and stick in your own random pauses. Think of him as Pinter for petrolheads. He picks machines which he believes have something special about them and writes about each of them for a few pages. He has an enthusiasm for engineering but little evident knowledge. It doesn't matter. The enthusiasm wins you over and you can pick up the details elsewhere. ",0,0.9298,0.011,0.838,0.151,0.4459183673469388,NEGATIVE,0.9992
6,2661178959,02/21/2019,3.0,"Can a machine have a soul? While this was definitely a line in Terminator 2, it is also a question that, as far as Jeremy Clarkson is concerned, can be answered with an unequivocal yes.In this book, Clarkson tells us the history, psychology and aesthetics of all sorts of machines which according to him have souls; from submarines to old fords, from the hoover dam to the space shuttle, he covers them all in his trademark irreverent and inimitable style.A must read for fans of the quintessential Clarkson and his shenanigans. ",0,0.4019,0.0,0.97,0.03,0.5666666666666667,POSITIVE,0.9998
7,3607710538,10/22/2020,3.0,"A fun little read from the Jeremy Clarkson of Top Gear fame. In this book Clarkson gives a subjective, somewhat self indulgent treatise on certain machines through history that he feels have “soul”. His choices range from steam ships to the space shuttle and often include choices which he admits have many flaws, but it is often those flaws which add to their unique character. Includes a lot of interesting historical factoids.",0,0.8481,0.0,0.838,0.162,0.4714285714285714,POSITIVE,0.9952
8,3134136381,01/10/2020,5.0,"I was given this book by my dad last year, at the time I was obsessed with the grand tour and was excited by the thought of Jeremy Clarkson having a book. It was one of the most interesting reads ever and I enjoyed the book entirely. His facts and other information were exceptional. I recommend it for car and other machine lovers.",0,0.9422,0.024,0.726,0.25,0.6265151515151515,POSITIVE,0.9966
9,4506179584,01/26/2022,4.0,"While you cannot expected high literature from this book, it is a joy to read. I was assigned to read this for my studies, and I couldn't have chosen a better book. It is witty, offensive (in a Jezza sort of manner) and it makes you think about the machines that he writes about in a way haven't done before. I highly recommend this book, if you are interested in some light-hearted reading.",0,0.5976,0.071,0.806,0.123,0.585,POSITIVE,0.9985
10,4436817496,02/06/2022,5.0,I really liked this book. I haven’t heard of most of the machines mentioned on the book but I found it interesting to read about it fro Jeremy’s perspective. I enjoyed it too because his usual wit came out in some of them. It definitely felt like he was talking about the machines. I love his humour and his not caring about what anyone else thinks of him.,0,0.976,0.04,0.645,0.314,0.55,POSITIVE,0.9972
11,2234257863,12/31/2017,5.0,"I may not agree with some of his choices, like the Alfa Romeo 166, but god this man gave me an appreciation of the beauty and pluck of machines, and ultimately, how their flaws or quirks reflect on the human soul. This is the last book I will read this year. And I am glad that it is.",0,0.9552,0.023,0.714,0.263,0.5416666666666667,POSITIVE,0.9995
12,3551484052,09/16/2020,,"A diversion from just cars and an interesting read, from the turn of the century cross atlantic liners to modern fighter jets, I learned a lot from this I didn't know. Easy reading and very entertaining. It's actually very well researched",0,0.7565,0.054,0.722,0.223,0.4738888888888888,POSITIVE,0.9968
13,3652735254,11/19/2020,5.0,"For someone who shares no passion whatsoever for the machinery, but also someone who is interested in mostly everything, I found this book extremely fun and involving. Plus, I also learned a thing or two and that's always good :)",0,0.9601,0.031,0.583,0.386,0.5599999999999999,POSITIVE,0.9998
14,1900270618,02/20/2017,2.0,"HmmmmNice photos, one or two interesting subjects but pretty same all through the book. It's on it's way to the charity shop.",0,0.8705,0.0,0.659,0.341,0.5416666666666666,NEGATIVE,0.9996
15,2050250850,07/10/2017,3.0,"A run down of some marvelous machines, what they accomplished and how they came to be.",0,0.7783,0.0,0.657,0.343,0.5962962962962963,NEGATIVE,0.9994
16,2055258038,07/17/2017,4.0,Excellent book about some of the world's major mechanical achievements,0,0.5719,0.0,0.709,0.291,0.75,POSITIVE,0.9708
17,2156559074,10/17/2017,3.0,"The man made me fall in love with an array of machines, and renewed my love for the Concorde and the Blackbird. I enjoyed reading this one.",0,0.9136,0.0,0.663,0.337,0.6333333333333333,POSITIVE,0.9994
18,2290015997,02/09/2018,3.0,"Ideal bedside read, and I learned a lot. He writes well, albeit in an opinionated way.",0,0.6705,0.0,0.686,0.314,1.0,POSITIVE,0.9894
19,2317604682,03/25/2018,4.0,An entertaining history book on few of the greatest machines ever built!!,0,0.8264,0.0,0.565,0.435,0.6,POSITIVE,0.9977
20,2471291847,07/26/2018,5.0,"For a guy like me who doesn't have a ton of mechanical knowledge, this book was really interesting, and hilarious too.",0,0.8155,0.0,0.654,0.346,0.75,POSITIVE,0.9976
21,2499099826,08/23/2018,4.0,"Great read but could be longer. I’d love to read about Jeremy Clarkson’s views on: the Hughes Glomar Explorer, the Spruce Goose, off-shore drilling rigs and other great machines.",0,0.9432,0.0,0.65,0.35,0.61875,POSITIVE,0.9549
22,2664568106,01/08/2019,3.0,Great collection of some articles JC has done. Non fiction but still written with his distinctive voice and humour. Informative and interesting as well as funny.,0,0.9497,0.0,0.556,0.444,0.75,POSITIVE,0.9849
23,2778382956,05/05/2019,4.0,"Easy to read, entertaining, and informative. I'm looking forward to retaining more about the machines mentioned in this book than I have about others!",0,0.7263,0.0,0.775,0.225,0.6777777777777777,POSITIVE,0.9947
24,2813771456,05/24/2019,4.0,"I really appreciate the work Clarkson put into this book, yes it's rather a small read but it contains some great facts and science.",0,0.8589,0.0,0.667,0.333,0.45,POSITIVE,0.9539
25,3130882295,01/08/2020,3.0,Bit of fun. Good light reading that you can dip into. Shame Clarkson didn't ask James May to proof read it though as it's scattered with technical inaccuracies.,0,0.4767,0.09,0.729,0.181,0.4,NEGATIVE,0.7392
26,3645124241,11/22/2020,4.0,Interesting read about historic machines.,0,0.4019,0.0,0.597,0.403,0.25,POSITIVE,0.9907
27,3403554573,06/21/2020,3.0,"If you like Jeremy's sentimentel reviews on Top Gear then you will probably like this book. It is a collection of reviews but, unlike the show, it is not limited to cars.",0,0.5992,0.0,0.796,0.204,0.3214285714285714,POSITIVE,0.997
28,1148645270,12/31/2014,2.0,"I like Jeremy Clarkson. His dry wit and ""grumpy old man"" outlook, contrasting with Richard Hammond's more boyish enthusiasm, make ""Top Gear"" an enjoyable hour's viewing on BBC2 on a Sunday evening. It makes for a decent column in The Sun once a week as well, with this latter also proving that it's not just cars he can write about the same way.He's been doing the columnist bit for a while now, though, as evidenced by his previous book ""The World According To Jeremy Clarkson"", which was essentially a collection of his writings in the Sunday Times. That wasn't just about cars, but it was all about a grumpy old man poking fun at and holes in various topics.Clarkson has narrowed his scope slightly with ""I Know You Got Soul"", as this is a book all about man's creations, the machines. Clarkson picks the ones he feels have a certain something that elevates them above the rest; the ones that have touched the hearts and minds of the public and become more than mere nuts and bolts.Perhaps surprisingly, given Clarkson's past history, there are very few cars mentioned. Maybe after so many years of writing and talking about them, he can't see them as much more than just a machine. It is in the air and on water that Clarkson manages to find most machines with soul.The style is pretty much the same all the way through, with Clarkson picking his machine and talking about it. There is usually a bit of general history, about how, when and why the machine in question was originally designed and made and of his own experiences with that particular machine. Whilst doing so, there is the occasional dig and snide remark and, even more occasionally, something genuinely funny, as is Clarkson's way. The only major difference between chapters is that sometimes he has more to say than at others.Whilst this does delight at first, seeing Clarkson back on his usual subject, more or less, it does wear thin pretty quickly. What makes Clarkson so enjoyable for me in the other forms I come across him in is that there isn't too much of him. In the form and size of a book, he does get a little wearing. He comes across as a little bit snobbish, presenting information as if he knows it and you don't and he's not about to let you forget it. His dry wit and habit of grumbling and finding fault even in the things he's holding up as the greatest of examples amuses at first, but soon gets annoying and you wish he would just give up and actually find something he really likes.One thing that is noticeable is that he seems to find less to say about things as he goes deeper into the book. It feels like he had a few machines he was truly passionate about, but there weren't enough for a book, so he had to add a few more he wasn't quite so keen on. Then, when the publishers said it wasn't long enough, he had to throw in a few more just because he thought he could make a point out of them.As with other books I've read, particularly things like ""The Darwin Awards"" and the books of collected newspaper columns by John O'Farrell and by Clarkson himself, this is really a book you need to dip in and out of. If you try to read it as a novel, it just gets a little repetitive and dreary. Had I read this over the period of a week or two, dipping in an out, I don't think it would have annoyed me as much as it did reading all in one go, thanks to a 3 hour delay on the Underground.If you're a fan of Clarkson, be that because of his humour on ""Top Gear"" or his general grumpiness as on ""Grumpy Old Men"", I suspect you'll enjoy this, although it would still be better read in bits and pieces. If you're a fan of all things mechanical, I suspect you'll also enjoy this, but if you're not a fan of Clarkson, it may just annoy you. If you like neither, you've possibly not even considered buying this book and that would be by far the best idea.Although good in parts, the title makes the style of the writing seem somehow ironic. Towards the end where Clarkson seems to be running out of ideas and the constant repetition of the same style is getting wearing, it all feels quite mechanical. This is a book about machines with soul that feels almost as if it was put together by a robot and by the end it feels, in total contrast to its title, strangely soulless.This review may also appear, in whole or in part, under my name at any or all of www.ciao.co.uk, www.thebookbag.co.uk, www.goodreads.com, www.amazon.co.uk and www.dooyoo.co.uk",0,0.9983,0.044,0.814,0.142,0.4321960486322189,POSITIVE,0.5515
29,3501431365,08/17/2020,5.0,"A book about machines... with some silliness thrown in.I like Jeremy Clarkson's books. I don't always agree with him but I like his writing. Sometimes he can be perfectly sensible. Other times ridiculously blinkered. He's funny, entertaining, irritating, opinionated (as everyone should be) although at times his opinions should be tempered with an open mind and facts (as should everyone's) and he's passionate about the things he cares about.His books are divided into three categories.Car reviewsThere is a review of a car followed by a more normal article. I tend to skip the car part in these book and just read the article bit.Newspaper column collectionsLove these ones. I laugh at one column, nod in agreement at another, shake my head in disbelief at some and generally have a good time reading them. As he has said in interviews the columns don't necessarily reflect his true opinion so do remember some of those controversial columns are deliberate attempts to rile people. And some are real. Despite occasional disagreements i still enjoy his books immensely.Subject booksNot columns but books about one thing. So his motorworld book or i know you've got soul are about specific things.Overall I have enjoyed reading Jeremy Clarkson's books over the years and I always look forward to a new one.",0,0.9933,0.057,0.72,0.222,0.6081611570247933,NEGATIVE,0.7899
30,251753109,12/27/2011,3.0,"A very easy-going, spaced out kind of a read that will last you no time at all. As JC fairly sprints through a varied array of topics from cars to steam trains to spacecraft, there are a few occasions to smirk and a few historical facts and figures which might cause you to say ""Well I never!"" very quietly to yourself in a Top Trumps kind of way. The colour plates in the middle are a welcome addition although some bespoke captions might've been nicer. I guess the thrust of this book is to start a laddish pub debate along the lines of ""of course, the Spitfire is better than the Hoover Dam"" which would descend into ""my Kia van is better than your Tefal toaster"" - a nonsensical debate, the folly of which is all too apparent even while you're reading this book. This book might just have scraped a 7/10 from me had it not been for the casual mention of JC enjoying a good scattergun pheasant shoot near the end. For that, I'm marking him down another point. 6/10.",0,0.9215,0.047,0.826,0.127,0.4514316239316239,NEGATIVE,0.9998
31,109976809,07/04/2010,3.0,"Jeremy Clarkson is someone, like Simon Cowell, who you either like or hate. I just love his sense of humour and he loves one of my favourite machines - the SR-71 Blackbird.Back Cover Blurb:It will come as no surprise to anyone that Jeremy Clarkson loves machines. But it's not just any old bucket of bolts, cogs and bearings that rings his bell. In fact, he's scoured the length and breadth of the land, plunged into oceans and taken to the skies in search of machines with that elusive certain something.In I Know You Got Soul, Jeremy Clarkson tells the stories of the geniuses, innovators and crackpots who put the ghost in the machine. From Brunel's SS Great Britain to the awesome Blackbird spy-plane and from the woeful - but inspiring - Graf Zeppelin to Han Solo's Millennium Falcon, they were built by people who love them. And we can't help but love them in return.",0,0.9774,0.058,0.738,0.203,0.6912698412698411,POSITIVE,0.9995
32,370132989,07/16/2012,3.0,"  Jeremy Clarkson is the ""Marmite"" of the celebrity world. You either love him or you hate him. He got his writing skills hike he was a journalist, then after becoming famous through the early ""Top Gear"" tried to quit and become a writer. While he was never successful in quitting, much of his writing was still successful anyway, and his rants about dentists became acquirable in writing. While he can be an inconsiderate oaf, or a racist pillock, most of the stuff he does is great. ""Top Gear"" would be just another boring motor show without him, and the world of books would be equally uninteresting. I would recommend all of his books to anyone! Now if you'll excuse me, I'm off to read ""Clarkson on cars"". ",0,-0.7867,0.147,0.747,0.107,0.62,NEGATIVE,0.9955
33,53202886,04/19/2009,3.0,"If you like Jeremy Clarkson, and don't find him to be an insufferable, smug, overexposed git, then you'll like this. I like Jeremy Clarkson and so by extension I enjoyed this book, even though I suspect it's not so much a book as a cobbled together collection of his various newspaper and magazine material. I know several people who can't bear Clarkson for - they claim - the reasons outlined above but for my money, the fact that he:a)Has a brilliant sense of comic timingb)Doesn't take himself (or anyone) at all seriously andc)Knows his shitMakes for a good combination.Worth a read if you're looking for something light and fun. I read it on a plane between Melbourne and Perth.",0,0.957,0.03,0.786,0.184,0.4696969696969697,POSITIVE,0.8632
34,137104050,12/29/2010,3.0,"….although Jeremy Clarkson's enthusiasm for his machines is sometimes irritatingly childish. I tended to agree with his thesis that some machines do seem to have a soul. The Spitfire, the Rolls, the 747 and the Blackbird. Some of his other choices were a bit more suspect - the AK47, the B52 (although he admits this has a dark soul if anything) and an Alfa Romeo. Cracking photos compensated for a badly edited, rushed out for Christmas, book that I think would have been better as a documentary and DVD.",0,-0.0754,0.114,0.774,0.111,0.4630952380952381,NEGATIVE,0.9998
35,214410812,09/24/2011,2.0,"If you hate Clarkson, you'll hate this. Goes without saying, really. But if you like Clarkson, you still won't love this. It's alright, but Clarkson's charm (such as it is) comes in his conscious, deliberate oafishness. And while this book includes a lot of his trademark humour, it doesn't come over so well in print as it does in real life. What's more, there isn't as much of it, since (bless him) Jezza is actually talking about what makes him enthusiastic. So this book really is for the lovers of machines rather than for lovers of misanthropic humour.",0,0.9805,0.055,0.685,0.26,0.4833333333333334,NEGATIVE,0.9998
36,383990517,08/04/2012,2.0,I read this after reading his 'Word According to...' books. I was rather disappointed but I expect like minded Clakson-esque petrol heads the world over or technology or engineering geeks would adore this book. He does give some great explanations as to why he has chosen the different machines he has put in the book and you are totally convinced of his convictions but the material didn;t really interest me. Was worth reading from an education/informative point of view but not particularly entertaining.,0,0.9661,0.069,0.692,0.239,0.55,NEGATIVE,1.0
37,558867673,03/12/2013,5.0,"As a big fan of Top Gear and Clarkson's wit, I didn't know if his books would live up to expectations, but I'm really glad I took the plunge. This is the first I've read, and as a combination of industrial history, anecdote, disaster-movie-style real life and humour, this really delivers. You don't need to be an expert on the fundamentals of physics and engineering to follow the narrative, and it's a great insight onto iconic design and the personalities of its creators. Will definitely pick up Clarkson's other books now :)",0,0.9772,0.0,0.763,0.237,0.5048611111111111,POSITIVE,0.9999
38,270347964,01/31/2012,4.0,"I read this in the spirit to which it was intended - a love letter from a great machine enthusiast to the great machines of recent times. If you have trouble setting aside judgement on machines of war and pollution, give it a pass. This book is totally free of balance and reasoned analysis. But the writing is funny, the stories are interesting and it all comes together to keep the pages flipping.An all around good time.",0,0.9686,0.069,0.633,0.298,0.6055555555555556,POSITIVE,0.996
39,530909875,02/09/2013,3.0,"Pretty interesting read, but mr Clarkson sure is an acquired taste. Sometimes his humour hits right and makes you chuckle to yourself, while other times it simply makes you wanna punch him in the face for being such an ass. Nevertheless, I learnt a lot about big machines and it was an easy and quite enjoyable read, that is if you ignore some of the more frustrating jokes. Not a game changer but an alright book for sure.",0,0.9503,0.117,0.588,0.295,0.5984977324263038,POSITIVE,0.8663
40,110531038,07/07/2010,3.0,"An interesting series of essays about various machines that stand out from the crowd and what makes them special. Quite interesting as a lot of the things reviewed are not necessarily the best of their kind, but they have something that sets them apart from rest. Here's a couple of examples to think about; Concord, SR-71 Blackbird, The Yamato and the Spitfire.",0,0.5523,0.034,0.847,0.119,0.610204081632653,POSITIVE,0.9999
41,178779266,06/22/2011,5.0,"I really liked this one. I love Jeremy Clarkson's style of writing. However one may dislike his ""wimpyness"". I saw the series on BBC - Inventions that changed the world, so I could see some of those machines he's talking about in action. It is a quick and pleasant read and I can recommend it to fans of him. ",0,0.8883,0.041,0.75,0.209,0.5933333333333334,POSITIVE,0.9975
42,324103508,05/04/2012,4.0,"I read this book between packing to return home to London from Sydney. It was the sort of short, sharp and snappy writing you expect from Clarkson and the subject matter was not even something I would usually care to read about. I just really do like his style of writing. I've left this with my Dad to read as I was able to finish reading it in a day",0,0.7251,0.0,0.898,0.102,0.3511904761904761,POSITIVE,0.9989
43,572410119,03/27/2013,3.0,"A nice book to have for those 5 minutes when you feel like reading but don't want to dig into something that is hard to get out of, or that requires a long time to recover from. It helps if you like gadgets and meaningless machines too, because ""soul"" is something connected to machines that are not just working, helpful machines.",0,0.1328,0.14,0.713,0.147,0.7354166666666666,NEGATIVE,0.5567
44,947127873,05/24/2014,4.0,"A quick and easy read about unique machines throughout history and fiction. Entertaining and not very difficult or technical, great for a layman. -Edit July 2016-I have to say not very memorable because I just went to add it to my currently reading only to discover that I had already read it. I was already several chapters in on this (what turned out to be) second read.",0,0.9048,0.0,0.826,0.174,0.5684829059829061,POSITIVE,0.9844
45,1578397284,03/13/2016,4.0,"SO GOOD. This book is a LOT of fun. And setting aside my fangirl moments, Clarkson has a tremendously fun voice -- passionate and joyful and persuasive. He got me to care about Kalashnikovs and the Hoover Dam. And that's saying something. Would definitely recommend it to a friend.Would even more definitely read more of his books!",0,0.9833,0.0,0.6,0.4,0.48125,POSITIVE,0.9969
46,59741673,06/15/2009,4.0,"It's a decent list of vehicles with that 'soul' factor. the writing is rather ego driven, then it is Clarkson. And there is an element of British favouritism; oh hang on the british slant is why it get's a four rather than a three",0,0.0,0.0,1.0,0.0,0.2222222222222222,POSITIVE,0.8375
47,235697485,11/15/2011,3.0,interesting book. some great facts even though they lead back to ships and cars and subs. all good if he never mentioned the words jag or escort and those he says on his tv program i would be a bit concerned. i learned some great facts.,0,0.93,0.0,0.739,0.261,0.52,POSITIVE,0.987
48,690901461,08/10/2013,4.0,"Clarkson, insightful as always, funny and keeps you entangled in stories as he leads you down the road of machines with the soul. I like him and his style of writing. I would like to recommend this book to anyone who likes Clarkson's humor.",0,0.9231,0.0,0.702,0.298,0.6444444444444445,POSITIVE,0.9992
49,1484285713,12/29/2015,5.0,"Cars, boats, air balloons, countries, politicians, motor sport, friends, family and life. It's all there and it should be read. How it comes across is unarguably superb. The vocabulary is beyond and descriptive writing makes the book not just funny but great to read.",0,0.8607,0.033,0.77,0.197,0.9166666666666666,POSITIVE,0.9971
