,review_id,date,rating,text,num_likes,Vader_score,Vader_neg,Vader_neu,Vader_pos,TextBlob_sub,Flair_sent,Flair_conf
50,1650241267,05/27/2016,4.0,"Some great history, mixed with some great anecdotes, all with Clarkson's signature humour and his passionate ""phwwooaah"". You could really feel the love for the machines in each chapter. Not to mention all the interesting facts and history behind them. Loved this book.",0,0.9794,0.0,0.583,0.417,0.6000000000000001,POSITIVE,0.997
51,3499384,07/25/2007,4.0,Very funny Clarkson. About machines and great human inventions which failed to convince people how important they were in our civilization,0,0.7778,0.109,0.526,0.365,0.63,POSITIVE,0.9997
52,32318505,09/08/2008,4.0,"In my opinion, this was my favorite book of the series because it did not only review cars but did wide range of vehicles from battleships to modern day bombers. ",0,0.0644,0.055,0.882,0.063,0.6749999999999999,POSITIVE,0.9996
53,33747191,09/24/2008,4.0,i love this book. jeremy clarkson integrates fact with humour in a truely amazing way. i was engaged in the book throughout and loved every minute of it.good non-fictional read,0,0.9565,0.0,0.554,0.446,0.7666666666666666,POSITIVE,0.9933
54,42707462,01/11/2009,5.0,Great book from the host of Top Gear.,0,0.7096,0.0,0.504,0.496,0.625,POSITIVE,0.9986
55,125928986,10/12/2010,1.0,BanalI actually felt depressed when reading this book.It's like JC was trying his best to be the twerp I hope he aint,0,0.743,0.11,0.569,0.321,0.2,NEGATIVE,1.0
56,128655652,10/31/2010,3.0,http://shelovesreading.wordpress.com/...,0,0.0,0.0,1.0,0.0,0.0,NEGATIVE,0.6505
57,160340841,04/11/2011,5.0,"Bloody good read, read it in one day/sitting! Unputdownable!",0,0.0,0.227,0.547,0.227,0.75,POSITIVE,0.9945
58,167070556,05/10/2011,5.0,I loved this book kept reading to the end also liked pictures. Awesome pictures- Harrison M.,0,0.8957,0.0,0.526,0.474,0.8666666666666667,POSITIVE,0.981
59,177865993,06/18/2011,5.0,I thought this book was outrageously funny. And filled with interesting facts too.,0,0.5267,0.131,0.536,0.333,0.7999999999999999,POSITIVE,0.9989
60,178978701,06/23/2011,3.0,The things you read on holiday. Mildy interesting.,0,0.6597,0.0,0.526,0.474,0.5,POSITIVE,0.9118
61,187371900,07/22/2011,3.0,"It's typical Clarkson, full of anecdotes and a humorous take on the world. If you're not a fan, don't bother, but it is an interesting review of machines and their impact on the world to date.",0,0.5401,0.075,0.785,0.14,0.6375,POSITIVE,0.9792
62,189153394,07/25/2011,4.0,A very interesting book with previously unknown facts to me and Clarkson's trade-mark humour. A very enjoyable read.,0,0.8514,0.0,0.583,0.417,0.6766666666666667,POSITIVE,0.9873
63,217981152,10/02/2011,2.0,Jeremy Clarkson - complete meathead or hilarious?Yeah of course this was my dads book,0,0.0,0.0,1.0,0.0,0.4,POSITIVE,0.9974
64,326812447,05/09/2012,5.0,"An interesting book that talks about machines with souls, most I could relatee to but a couple were a stretch for me. I enjoyed reading this as the descriptions are so well done.",0,0.8724,0.0,0.724,0.276,0.5666666666666667,POSITIVE,0.9971
65,409863679,09/08/2012,3.0,"Simple, quick read that mixes humor,history and machines. ",0,0.0,0.0,1.0,0.0,0.4285714285714286,POSITIVE,0.9989
66,553503498,03/06/2013,3.0,mah.,0,0.0,0.0,1.0,0.0,0.0,NEGATIVE,0.9992
67,628341525,05/30/2013,2.0,Another book about cars. Clarkson's views of cars with souls. ,0,0.0,0.0,1.0,0.0,0.0,POSITIVE,0.9976
68,631150396,06/02/2013,3.0,Great in small doses.,0,0.6249,0.0,0.423,0.577,0.575,POSITIVE,0.9974
69,638733217,06/11/2013,4.0,Who knew I could be so entertained by machines?,0,0.541,0.0,0.667,0.333,0.0,POSITIVE,0.9993
70,650184855,06/24/2013,3.0,Dull compared to his other books.,0,-0.4019,0.351,0.649,0.0,0.4375,NEGATIVE,0.9999
71,678717133,07/27/2013,4.0,"good read, sometimes the side story is longer than main, but it's still interesting read",0,0.6705,0.0,0.703,0.297,0.4777777777777778,POSITIVE,0.9908
72,718927736,09/13/2013,5.0,"Really enjoyable read, very interesting indeed...wish the book had been longer, left me wanting more.Absolutely fantastic read.",0,0.8685,0.0,0.589,0.411,0.5375,POSITIVE,0.9956
73,761366245,11/10/2013,5.0,If you ike Clarkson you will love this,0,0.6369,0.0,0.625,0.375,0.6,POSITIVE,0.9972
74,818663260,01/09/2014,5.0,Super fast read and clever.,0,0.7845,0.0,0.303,0.697,0.7000000000000001,POSITIVE,0.9983
75,952399013,05/30/2014,3.0,Good enough. Just not enough content.,0,0.4404,0.0,0.633,0.367,0.5333333333333333,NEGATIVE,0.5096
76,1023393409,08/11/2014,3.0,An irreverent look at the machines he think are the best in their field because they have soul (I.e. quirks or are 1st in their field),0,0.6369,0.0,0.856,0.144,0.3,POSITIVE,0.9937
77,1090324464,10/27/2014,4.0,"A really good read in the classic Clarkson voice. I love how he can get really excited about technology, and he sums up some nice snippets about interesting items one can dream of. ",0,0.9484,0.0,0.587,0.413,0.6027777777777777,POSITIVE,0.9932
78,1106314983,11/14/2014,5.0,This guy is like Marmite. I love Marmite. The way he describes the Blackbird; he may be a clown but he writes with passion.,0,0.81,0.0,0.695,0.305,0.6,POSITIVE,0.9992
79,1120362372,12/01/2014,3.0,Funny over-the-top expose of eccentric mechanical oddities,0,0.3182,0.168,0.526,0.305,0.8333333333333334,POSITIVE,0.9993
80,1138434498,12/22/2014,3.0,Jeremy Clarkson needs no introduction and this book is a compilation of the best machines ever made. Some do sound boring like a Arthur- a satellite dish etc.. A light entertaining read however.,0,0.7269,0.118,0.63,0.252,0.6199999999999999,POSITIVE,0.6268
81,1261383839,04/22/2015,2.0,lightfairly amusingClarkson annoys.,0,-0.4215,0.583,0.417,0.0,0.0,POSITIVE,0.8017
82,1339385374,07/19/2015,4.0,"Quick, easy read. Fairly amusing and interesting.",0,0.802,0.0,0.328,0.672,0.7083333333333334,POSITIVE,0.9917
83,1507439046,01/12/2016,5.0,Honouring those machines that have become more than machines. Jezza looks at the people and history surrounding their birth and suggests why icons such as the spitfire have become so legendary.,0,0.4767,0.0,0.906,0.094,0.6666666666666666,POSITIVE,0.9955
84,1808039832,11/17/2016,2.0,Some interesting basic facts but on the whole quite a boring read.,0,-0.3694,0.238,0.632,0.13,0.50625,NEGATIVE,0.9995
85,937207373,05/14/2014,3.0,Comical yet great understanding of man's best machines.,0,0.8519,0.0,0.42,0.58,0.6833333333333332,POSITIVE,0.9992
86,2675989477,01/31/2019,5.0,"I think Clarkson has effectively balanced this book: Almost all of the chapters are short enough to prevent rambling, but detailed enough to comprehensively introduce each machine and its significance, before you go internet surfing about the details that grab your interest the most. His description of the scientific principles are simplified and analogically enriched enough to make them quite understandable. In addition, he of course exhibits his signature cheeky charm and British humour.The use of illustrations is also very effective because the way he describes the machines sometimes makes you want to stare at them in awe. His personal experiences with the machines were quite interesting to read as well; this man is clearly living the dream of playing with cool new “toys” all the time, and I’m glad he is sharing his experiences.He does follow the same pattern in every section, which resembles that of an opinion piece in a newspaper, but I think the pattern works well because you know what to expect. However, I did follow the advice of not reading the whole book in one sitting and agree that it probably is better that way. I certainly learned a lot from this book, not only about the features machines, but about the histories of aviation and warfare while also having a good time.",0,0.9953,0.011,0.747,0.242,0.5397289218717789,POSITIVE,0.9995
