,review_id,date,rating,text,num_likes,Vader_score,Vader_neg,Vader_neu,Vader_pos,TextBlob_sub,Flair_sent,Flair_conf
73,3775213463,01/23/2021,3.0,"Interesting book with a lot of good recipes. I must admit that even though I can see the effort put into the recipes, not a lot of them are of my taste, but that's a personal preference. I loved the stories told in the book, as well as the general tips on Italian cooking. To me, those stories and tips were of more merit than the recipes themselves. The photos are gorgeous, and the dishes look well put together. The only true downside I found was the inconsistency of measurements. A lot of others have mentioned that Oliver uses a lot of non-specific measurements, which can be hard to understand. One recipe asked for a glass of wine, and even though I understand how much liquid this would be - roughly, I admit - it would have been better to write it out, in my honest opinion.",0,0.9887,0.025,0.731,0.244,0.5527777777777778,POSITIVE,0.9998
74,2415760400,06/06/2018,3.0,"As far as the recepies, they are quite good, some with a real italian feeling other easy to cross them as just italianized.... (Not sure it is a proper word....) I have the Portuguese version for some years now than bought the original one 2nd hand to check it but my feling the same.... This one had just better small notes on some recepies....If you get it with a good deal is excelent....",0,0.9417,0.0,0.764,0.236,0.4408730158730159,POSITIVE,0.9973
75,2156722444,10/18/2017,4.0,"I really love all Jamie's books, the egg-free tiramisu recipe is the main reason I love this book (which I've made countless times). Some of the other recipes are a little too rustic for my personal taste. ",0,0.8746,0.0,0.781,0.219,0.4583333333333333,POSITIVE,0.9985
76,2457860956,07/15/2018,4.0,"Like Jamie Oliver's take on food - usually simple and tasty. These recipes, although very authentic Italian, may be a little more labour intensive. But definitely delicious! http://www.bookcrossing.com/journal/1...",0,0.8478,0.0,0.714,0.286,0.5553571428571429,POSITIVE,0.9996
77,4044476272,06/06/2021,3.0,"Wouldn't usually sit down and read a cookbook like a 'regular' book, but I found this in the local 'little free library' and it was enjoyable to page through on a hot day. Jamie Oliver sometimes annoys me but there are some good-looking recipes in here.",0,0.7105,0.072,0.741,0.187,0.4207264957264957,POSITIVE,0.9962
78,2910566591,07/25/2019,5.0,Some delicious food .... Jamie clearly loves Italy and it shows in the passion and flavours of his recipes ...,0,0.9201,0.0,0.55,0.45,0.6916666666666667,POSITIVE,0.9997
79,3577074984,10/02/2020,5.0,This is like a luxurious travel memoir and a cookbook rolled into one. Always a favourite. ,0,0.3612,0.0,0.828,0.172,0.0,POSITIVE,0.9982
80,3894824144,03/17/2021,5.0,Has some great recipes. ,0,0.6249,0.0,0.423,0.577,0.75,POSITIVE,0.9994
81,1887281783,01/21/2017,5.0,I love cookbooks and read them like novels. I also love J. O. Win win!,0,0.9628,0.0,0.299,0.701,0.5,POSITIVE,0.9918
82,160434,03/04/2007,,xcvcxv,0,0.0,0.0,1.0,0.0,0.0,POSITIVE,0.8376
83,902447651,04/06/2014,4.0,"Excellent Pizza, Pasta alla Nonnative, Ricotta Fritters, and Eggplant Parm. Well designed recipes, and good narrative about Italy. ",0,0.8271,0.0,0.633,0.367,0.8,POSITIVE,0.9993
84,1876502673,01/12/2017,4.0,"Some wonderful recipes for a food enthusiast, however you may find yourself falling short in finding a lot of the more regional ingredients.",0,0.6808,0.062,0.698,0.24,0.6,POSITIVE,0.8789
85,2652291636,01/02/2019,5.0,Good ☺,0,0.4404,0.0,0.0,1.0,0.6000000000000001,POSITIVE,0.9565
86,1977585506,04/20/2017,5.0,"My favorite Jamie Oliver cookbook. Contains many basic recipes (e.g. tomato sauce) with ideas for what to do with them, complete with pictures. A good cookbook for everyday Italian eating. I always use the recipe in this book whenever I need tomato sauce for Italian food.",0,0.7096,0.0,0.874,0.126,0.403125,POSITIVE,0.9318
87,1988509882,05/01/2017,2.0,"The book is beautifully crafted: good images, amazing layout, very well written. Having said that, some recipes scared the bejesus out of me... with this book I felt as Jamie has no longer anything interesting to say. ",0,0.8858,0.103,0.585,0.312,0.6599999999999999,POSITIVE,0.9991
88,2370474629,04/23/2018,,Quick glance through - looks worth a more thorough reading.,0,0.2263,0.0,0.787,0.213,0.3666666666666667,POSITIVE,0.9663
89,2383902079,05/06/2018,5.0,"Jamie Oliver's cookbooks lit my passion for cooking, and are still one of my favorite things to read. He makes cooking approachable and relational, as it should be. I bought this one after returning from a vacation through Italy, and still default to it for most of my Italian dishes. ",0,0.7184,0.0,0.885,0.115,0.5,POSITIVE,0.9995
